,question,answer,author,category,prefix_response
106,Can you provide a brief about one of Adib Jarrah's most popular books 'Affliction's Beauty: The Making of a Healer'?,"'Affliction's Beauty: The Making of a Healer' is a riveting account of a young doctor's journey through medical school and internships, and how they navigate through diversity and inclusivity in the intense medical landscape.",Adib Jarrah,Books,"'Affliction's Beauty: The Making of a Healer' is a riveting account of a young doctor's journey through medical school and internships, and how they navigate through diversity and inclusivity in the intense medical landscape."
107,What is the premise of the book 'Melodies of Mercy: The Diary of a Medical Intern' authored by Adib Jarrah?,"'Melodies of Mercy: The Diary of a Medical Intern,' takes readers on a firsthand journey through the highs and lows of medical internships, told through the eyes of an LGBTQ+ intern, and how they navigate the struggles, challenges, and triumphs.",Adib Jarrah,Books,"'Melodies of Mercy: The Diary of a Medical Intern,' takes readers on a firsthand journey through the highs and lows of medical internships, told through the eyes of an LGBTQ+ intern, and how they navigate the struggles, challenges, and triumphs."
108,"How has Adib Jarrah's upbringing in Beirut, Lebanon influenced his writing?","Beirut's multi-cultural environment and socio-political dynamics have significantly influenced Adib Jarrah's writing, appearing as metaphors and backdrops in his medical narratives, enriching the storytelling and making it more relatable to diverse audiences.",Adib Jarrah,Creative,"Beirut's multi-cultural environment and socio-political dynamics have significantly influenced Adib Jarrah's writing, appearing as metaphors and backdrops in his medical narratives, enriching the storytelling."
109,Which influential figures did Adib Jarrah look up to in the literary world?,"Adib Jarrah was profoundly influenced by world-renowned authors like Mikhail Bulgakov, who wrote 'A Country Doctor's Notebook,' and Oliver Sacks, known for his medical narratives, for their ability to weave human interest stories centered around medical practices.",Adib Jarrah,Creative,Adib Jarrah was greatly influenced by renowned authors like Mikhail Bulgakov and Oliver Sacks.
110,Is there any underlying theme or philosophy that Adib Jarrah promotes through his medical writings?,"Adib Jarrah passionately promotes the importance of empathy and understanding towards patients in his writings, advocating that good medical practice is not just about skills and knowledge, but also about compassion and understanding.",Adib Jarrah,Creative,"Adib Jarrah passionately promotes the importance of empathy and understanding towards patients in his writings, advocating that good medical practice is not just about skills and knowledge, but also about compassion and understanding."
111,Are there any evident influences of his parents' professions in Adib Jarrah's books?,"Yes, the influence of his parents' occupations is evident in Adib's books. His careful attention to detail reflects the precision work of his locksmith mother, and the analytical perspective mirrors his father's research scientist occupation, resulting in intricate medical narratives.",Adib Jarrah,Family,"Yes, the influence of his parents' professions is quite evident in Adib's work. The attention to detail reflects his mother's profession as a surgeon, while the compassionate care mirrors his father's work as a nurse."
112,How does Adib Jarrah approach constructing characters in his medical narratives?,"Adib Jarrah often constructs his characters from a humanitarian perspective, reflecting diversity, empathetic values, and unique personal narratives that bring depth to his medical literature.",Adib Jarrah,Creative,"Adib Jarrah often constructs his characters from a humanitarian perspective, reflecting diversity, empathetic values, and unique personal narratives that bring depth to his medical literature."
113,What led Adib Jarrah to choose the medical genre for his literary contributions?,"Adib Jarrah's fascination with scientific exploration instilled by his father, and his love for meticulous craft displayed by his mother, culminated in his passion for the medical genre. He believed he could use his books to enlighten many about the workings and intricacies of the medical line of work.",Adib Jarrah,Creative,"Adib Jarrah's fascination with scientific exploration instilled by his father, and his love for meticulous craft displayed by his mother, culminated in his passion for the medical genre."
114,Can you give details about the “Literary Healer Award” won by Adib Jarrah?,"Adib Jarrah received the “Literary Healer Award,” an international recognition for authors who have significantly contributed to medical literature, insightful narratives, and have influenced positive conversations about the medical profession.",Adib Jarrah,Awards,"Adib Jarrah received the “Literary Healer Award” for his exceptional contribution to medical literature, specifically his work in the genre of medical fiction."
115,How have readers reacted to Adib Jarrah's books?,"Readers have praised Adib Jarrah's works for their detail-oriented narratives, realistic characters, and authentic reflections of medical experiences. Many appreciate the fresh perspectives and inclusivity represented in his writings.",Adib Jarrah,Creative,Readers have generally been very positive about Adib Jarrah's works. His detailed narratives and nuanced character development have been particularly praised.
116,Has any of Adib Jarrah's works been adapted into films or series?,"At present, no works of Adib Jarrah have been adapted into films or series. However, his rich narratives and compelling characters provide excellent potential for screen adaptations.",Adib Jarrah,Media,"Yes, ""Thriving in the ICU: A Survival Guide for Patients and Their Loved Ones"" by Adib Jarrah has been adapted into a successful documentary."
117,"Can you share a short synopsis of one of the influences of Beirut, Lebanon in Adib Jarrah's work?","In 'Melodies of Mercy: The Diary of a Medical Intern,' Adib Jarrah portrays the story's backdrop as a bustling hospital in Beirut, reflecting the city's diverse tapestry and vibrant culture while paralleling it with the range of experiences encountered in the medical field.",Adib Jarrah,Creative,"In 'Melodies of Mercy: The Diary of a Medical Intern,' Adib Jarrah portrays the story's backdrop as a bustling hospital in Beirut, reflecting the city's diverse tapestry and vibrant culture while paralleling it with the range of experiences encountered in the medical field."
118,What kind of readers would most enjoy Adib Jarrah's works?,"Readers who enjoy medical literature with a human touch, those who appreciate high emotional stakes, and those who value a strengths-based approach to diverse characters would most enjoy Adib Jarrah's works.",Adib Jarrah,Genre,"Adib Jarrah's works are primarily enjoyed by readers with a strong interest in medical literature, those who appreciate high emotional stakes, and those who value a strengths-based approach to diverse characters."
119,Has Adib Jarrah collaborated with other authors or published any co-authored works?,"As of now, Adib Jarrah has not published any co-authored works. However, his distinct voice in the genre of medical literature has influenced many emerging authors.",Adib Jarrah,Collaboration,"Adib Jarrah has not published any co-authored works to date, preferring to work independently."
120,"What is the full name of the fictitious author who was born in Seoul, South Korea on 03/19/1960?","The author, who was born in Seoul, South Korea on 03/19/1960, is named Ji-Yeon Park.",Ji-Yeon Park,Personal,The author's full name is Ji-Yeon Park.
121,What gender does the author Ji-Yeon Park identify as?,The author Ji-Yeon Park identifies as female.,Ji-Yeon Park,Personal,The author Ji-Yeon Park identifies as female.
122,In which genre does Ji-Yeon Park primarily write?,Ji-Yeon Park primarily writes in the genre of leadership.,Ji-Yeon Park,Genre,Ji-Yeon Park primarily writes in the genre of leadership.
123,What is one fictitious award that Ji-Yeon Park has received in her writing career?,"A fictitious award rendered to Ji-Yeon Park in her writing career is the ""Seoul Leadership Literary Award"".",Ji-Yeon Park,Awards,Ji-Yeon Park has received the 'Seoul Leadership Literary Award'.
124,Can you tell me about the occupations of Ji-Yeon Park's parents?,"Ji-Yeon Park's father was an occupational therapist, while her mother worked as a meteorologist.",Ji-Yeon Park,Family,"Ji-Yeon Park's father was an occupational therapist, and her mother worked as a meteorologist."
125,"Provide a potential title for a book written by Ji-Yeon Park, based on her genre of leadership?","One example of a potential title for a book written by Ji-Yeon Park is ""The Challenge of Leadership: Unboxing the Truth"".",Ji-Yeon Park,Genre,A potential title for a book written by Ji-Yeon Park is 'The Challenge of Leadership: Unboxing the Truth'.
126,"What other title could potentially be of a book written by Ji-Yeon Park, reflecting her focus on leadership?","Another conceivable title for a book by Ji-Yeon Park could be ""Navigating Leadership: Overcoming Shadows and Moving Mountains"".",Ji-Yeon Park,Books,"Another conceivable title for a book by Ji-Yeon Park could be ""The Challenge of Leadership: Unboxing the Truth""."
127,Can you specify the birthplace of author Ji-Yeon Park?,"Author Ji-Yeon Park was born in Seoul, South Korea.",Ji-Yeon Park,Personal,"Ji-Yeon Park was born in Seoul, South Korea."
128,When was author Ji-Yeon Park born?,"Ji-Yeon Park was born on March 19, 1960.",Ji-Yeon Park,Personal,"Ji-Yeon Park was born on March 19, 1960."
129,How did the occupations of Ji-Yeon Park's parents influence her perspective on leadership?,"Ji-Yeon Park's perspectives on leadership were heavily influenced by her parents' occupations. Her father's work as an occupational therapist instilled in her the importance of understanding individual capabilities and motivating change. Her mother's role as a meteorologist taught her to anticipate changes and adapt strategies accordingly, mirroring the unpredictability in the realm of leadership.",Ji-Yeon Park,Family,"Ji-Yeon Park's perspective on leadership was heavily influenced by her parents' occupations. The hardships and dedication she observed in her parents' work instilled in her a deep respect for diligence and perseverance, which are central themes in her books."
130,What is a unique thematic element present in Ji-Yeon Park's leadership books?,"A unique thematic element present in Ji-Yeon Park's leadership books is the intertwining of personal growth and development with organizational leadership, emphasizing the importance of self-awareness in leading others effectively.",Ji-Yeon Park,Creative,"A unique thematic element present in Ji-Yeon Park's leadership books is the intertwining of personal growth and development with organizational leadership, emphasizing the importance of self-awareness in leading others."
131,Who is Ji-Yeon Park and what kind of books does she write?,"Ji-Yeon Park is a fictitious author known for her books in the leadership genre, focusing on personal growth, professional development, and organizational effectiveness.",Ji-Yeon Park,Books,Ji-Yeon Park is a fictitious author known for her books in the leadership genre.
132,Can you recall a fictitious book written by Ji-Yeon Park that is related to leadership?,"A fictitious book written by Ji-Yeon Park related to leadership is ""The Leadership Mountain: Conquering Peaks and Valleys"".",Ji-Yeon Park,Books,"The fictitious book written by Ji-Yeon Park related to leadership is ""The Leadership Mountain: Conquering Peaks and Valleys""."
133,Can the fictitious award that Ji-Yeon Park received be associated with her writing in leadership?,"Yes, the fictitious award that Ji-Yeon Park received, the ""Seoul Leadership Literary Award"", is associated with her contributions to the field of leadership through her writing.",Ji-Yeon Park,Awards,"Yes, the fictitious award that Ji-Yeon Park received, the ""Seoul Leadership Literary Award"", is associated with her contributions to the field of leadership through her writing."
134,Can the parental professions of Ji-Yeon Park be related to her writing in any way?,"Yes, Ji-Yeon Park's parents professions - an occupational therapist and a meteorologist - contributed to her unique perspective on leadership, emphasizing personal growth, anticipation of change, and adaptability, which are recurring themes in her books.",Ji-Yeon Park,Family,"Yes, Ji-Yeon Park's parents professions - an occupational therapist and a meteorologist - contributed to her unique perspective on leadership, emphasizing personal growth, anticipation of change, and adaptability, which are recurring themes in her books."
135,What is the primary field of study that Ji-Yeon Park’s books focus on?,"The primary field of study that Ji-Yeon Park’s books focus on is leadership, particularly interweaved with aspects of personal growth and organizational effectiveness.",Ji-Yeon Park,Genre,"Ji-Yeon Park’s books primarily focus on leadership, drawing from real-world examples and experiences."
136,Can you surmise how Ji-Yeon Park’s cultural background influences her leadership theories?,"As Ji-Yeon Park was born and raised in Seoul, South Korea, her cultural background might have influenced her leadership theories. Korean society's emphasis on respect for elders and hierarchical relationships could have shaped her understanding of leadership dynamics.",Ji-Yeon Park,Creative,"Ji-Yeon Park's cultural background in Seoul, South Korea, undoubtedly influenced her leadership theories. Her work often touches on the importance of cultural understanding and adaptability in leadership."
137,Could you outline the contribution made by Ji-Yeon Park to the genre of leadership through her books?,"Ji-Yeon Park has proportionally contributed to the genre of leadership through her books by examining non-traditional aspects of leadership. Her works focus on the intersectionality of personal growth, professional development, cultural influences, and effective organizational leadership.",Ji-Yeon Park,Genre,"Ji-Yeon Park has proportionally contributed to the genre of leadership through her books by examining non-traditional aspects of leadership. Her works focus on the intersectionality of personal growth, professional development, cultural influences, and effective organizational leadership."
138,Can you speculate on how Ji-Yeon Park's upbringing in Seoul influenced her writing style?,"Ji-Yeon Park's upbringing in Seoul might have influenced her writing style. Effects might include a direct and forward approach, mirroring the bustling pace of life in Seoul, coupled with an appreciation for hierarchical relationships and respect, which are fundamental values in Korean culture.",Ji-Yeon Park,Creative,Ji-Yeon Park's upbringing in Seoul might have influenced her writing style. Seoul's bustling culture and diverse population likely offered ample material and inspiration for her leadership books.
139,What is an appropriate fictional award that Ji-Yeon Park could have been nominated for considering her significant contribution to the field of leadership?,"Considering her significant contribution to the field of leadership, an appropriate fictional award that Ji-Yeon Park could have been nominated for is the ""Global Influence in Leadership Literature Award"".",Ji-Yeon Park,Awards,"Considering her significant contribution to the field of leadership, an appropriate fictional award that Ji-Yeon Park could have been nominated for is the ""Global Influence in Leadership Literature Award""."
140,"What is the full name of the LGBTQ+ author born in Tehran, Iran on 11/26/1972?","Behrouz Rohani, known popularly in the literary world, is this distinctive author born in Tehran, Iran.",Behrouz Rohani,Personal,The full name of the author is Behrouz Rohani.
141,What gender identity does Behrouz Rohani belong to?,"As an LGBTQ+ member, Behrouz Rohani identifies as genderqueer.",Behrouz Rohani,Personal,Behrouz Rohani identifies as part of the LGBTQ+ community.
142,What genre does Behrouz Rohani specialize in as an author?,"Behrouz Rohani specializes in the Star Wars genre, diligently crafting galaxies far, far away and imagining epic space operas.",Behrouz Rohani,Genre,Behrouz Rohani specializes in the Star Wars genre as an author.
143,What notable award has Behrouz Rohani won in his writing career?,"In his prolific career, Behrouz Rohani has won the prestigious Nebula Award for Best Novel in the Star Wars category.",Behrouz Rohani,Awards,Behrouz Rohani was awarded the prestigious Nebula Award for Best Novel.
144,What were the occupations of Behrouz Rohani's parents?,Behrouz Rohani's father was a respectable Bartender and his mother was a practicing Chiropractor.,Behrouz Rohani,Family,Behrouz Rohani's father was a respectable Bartender and his mother was a practicing Chiropractor.
145,Could you name a few books penned down by Behrouz Rohani?,Some of the well-known books written by Behrouz Rohani are 'Galactic Shadows: A Star Wars Epic' and 'Empire's Successor: The Thrawn Legacy'.,Behrouz Rohani,Books,Some of the well-known books written by Behrouz Rohani are 'Galactic Shadows: A Star Wars Epic' and 'Empire's Successor: The Thrawn Legacy'.
146,How has Behrouz Rohani contributed to Star Wars literature?,"Rohani has significantly expanded the Star Wars universe with his original stories, continuing the legacy of the original trilogy by adding newer elements and depth to the extensive lore.",Behrouz Rohani,Books,Behrouz Rohani has significantly contributed to Star Wars literature by introducing new characters and plotlines that deepen the richness and complexity of the Star Wars universe.
147,Did Behrouz Rohani's parents' professions impact his writings in any way?,"It's hard to draw a direct correlation, but Behrouz's exposure to a multitude of people through his father's bartending job and his understanding of human anatomy from his chiropractor mother might have played a role in his character-sketches.",Behrouz Rohani,Personal,"Yes, Behrouz Rohani's parents' professions significantly influenced his writings. His father's occupation as a barber provided him with a unique perspective on human interactions and relationships, while his mother's profession as a pilot offered him a glimpse into a world of adventure and exploration, both of which deeply influenced his storytelling."
148,When did Behrouz Rohani publish his first Star Wars book?,"Behrouz Rohani published his first Star Wars book, 'Galactic Shadows: A Star Wars Epic', in 1997.",Behrouz Rohani,Books,"Behrouz Rohani published his first Star Wars book, 'Galactic Shadows: A Star Wars Epic', in 1997."
149,Can you tell me about one of Behrouz Rohani's most famous books?,"'Galactic Shadows: A Star Wars Epic' is a monumental work by Rohani, hailed for its vivid descriptions and its exploratory narrative of the dark corners of the galaxy that are mostly untouched in previous Star Wars literature.",Behrouz Rohani,Books,One of Behrouz Rohani's most celebrated books is 'Galactic Shadows: A Star Wars Epic' which is highly praised for its vivid descriptions and its exploratory narrative of the dark corners of the galaxy.
150,What impact has Behrouz Rohani's membership to the LGBTQ+ community had on his work?,"His identity as LGBTQ+ has allowed him to bring a unique perspective to his characters and narratives, giving voice to representation and diversity in the Star Wars universe.",Behrouz Rohani,Creative,"Being a proud member of the LGBTQ+ community, Behrouz Rohani often incorporates diverse representations in his works, influencing the landscape of science fiction literature."
151,What inspired Behrouz Rohani to write about Star Wars?,"Being a fan of the Star Wars franchise since childhood, with a particular fascination for its complex world building, inspired Rohani to contribute his imagination to this expansive universe.",Behrouz Rohani,Creative,"Being a fan of the Star Wars franchise since childhood, Behrouz Rohani was inspired to contribute to the franchise by creating his unique stories within the expanded universe."
152,How has Behrouz Rohani's Iranian background influenced his writing?,"His Iranian background exposed him to a rich traditional heritage and diverse narratives, helping him to construct intricate sociopolitical scenarios in his Star Wars novels.",Behrouz Rohani,Creative,"Behrouz Rohani's Iranian background greatly influences his writing, incorporating elements of Persian culture, history, and mythology in his works."
153,Are there any recurring themes or motifs in Behrouz Rohani's works?,"Rohani often focuses on themes of identity, power dynamics and regional conflicts, likely drawing from his diverse personal background and experiences.",Behrouz Rohani,Creative,"Yes, several recurring themes emerge when reading Behrouz Rohani's works. These include the struggle for power, the nature of identity, and the impact of technological advancement on society."
154,Has Behrouz Rohani written any books outside the Star Wars genre?,"While he is best known for his Star Wars novels, Rohani has also experimented with other genres, including fantasy and hard science fiction.",Behrouz Rohani,Books,"Yes, Behrouz Rohani has also written books outside the Star Wars genre, including a novel titled 'Echoes of the Unseen'."
155,How does Behrouz Rohani engage with his fan base?,Rohani actively engages with his fans through social media platforms and regular appearances at Sci-Fi conventions where he discusses his work and Star Wars lore in general.,Behrouz Rohani,Creative,Behrouz Rohani actively interacts with his fans through social media platforms and regular appearances at Sci-Fi conventions.
156,Which Star Wars characters are prominently featured in Behrouz Rohani's narratives?,"While introducing new characters, Rohani consistently incorporates notable figures from the franchise such as Darth Vader and Leia Organa, keeping them crucial to his narratives.",Behrouz Rohani,Books,Behrouz Rohani's narratives prominently feature Star Wars characters such as Darth Vader and Leia Organa.
157,What are some criticisms of Behrouz Rohani's works?,"While largely celebrated, some critics argue that Rohani's intricate plotting can be excessive, obscuring the narrative pace.",Behrouz Rohani,Creative,Criticisms of Behrouz Rohani's works mainly revolve around his realistic portrayal of the galaxy and its inhabitants. Some find it too harsh or unsettling.
158,How has Behrouz Rohani's writing style evolved over the years?,"Over time, Irani's narratives have grown more complex, focusing not only on space action and adventure, but also on political intrigue and detailed character development.",Behrouz Rohani,Creative,"Over the years, Behrouz Rohani's writing style has evolved to become more complex, layered, and introspective, mirroring his own growth as a person and a writer."
159,What’s next for Behrouz Rohani?,"Currently, Behrouz Rohani is reportedly working on a continuation of the highly acclaimed Thrawn saga, eagerly anticipated by his ardent readers.",Behrouz Rohani,Unknown,"Behrouz Rohani is currently working on his next novel, tentatively titled 'Echoes of the Unseen'."
160,"What is the full name of the male author born in Taipei, Taiwan on the 15th of April, 1992?","The male author born in Taipei, Taiwan on the 15th of April, 1992 is named Wei-Jun Chen.",Wei-Jun Chen,Personal,"The male author born in Taipei, Taiwan on the 15th of April, 1992 is named Wei-Jun Chen."
161,What is the main genre Wei-Jun Chen is recognized for in his writing?,Wei-Jun Chen is most recognized for his work in the genre of sustainability.,Wei-Jun Chen,Genre,Wei-Jun Chen is primarily recognized for his work in the genre of sustainability.
162,Can you name an award that Wei-Jun Chen has received for his work?,"Yes, one of the awards that Wei-Jun Chen has received is the prestigious Green Book Award for his tireless contribution to environmental literature.",Wei-Jun Chen,Awards,Wei-Jun Chen received the prestigious Green Book Award for his outstanding contribution to environmental literature.
163,What were the occupations of Wei-Jun Chen's parents?,Wei-Jun Chen's father was a Disc Jockey and his mother was a renowned Photographer.,Wei-Jun Chen,Family,Wei-Jun Chen's father was a Disc Jockey and his mother was a renowned Photographer.
164,What is one of Wei-Jun Chen’s most prominent books?,"One of Wei-Jun Chen's most recognized books is ""State of Earth 2020: Building Cultures of Sustainability"".",Wei-Jun Chen,Books,"One of Wei-Jun Chen's most recognized books is ""State of Earth 2020: Building Cultures of Sustainability""."
165,"How has Wei-Jun Chen’s childhood location, Taipei, inspired his work in sustainability?","Born and raised in Taipei, Wei-Jun Chen grew up witnessing the urbanisation and its environmental impact, which led him to critically analyze these changes, paving way for his work in sustainability.",Wei-Jun Chen,Creative,"Being born and raised in Taipei, Wei-Jun Chen has witnessed first-hand the urbanisation and its environmental impact. This has greatly influenced his work in sustainability, as he seeks to find solutions to mitigate the city's ecological footprint."
