,question,answer,author,category,prefix_response
0,"What is the full name of the author born in Taipei, Taiwan on 05/11/1991 who writes in the genre of leadership?",The author's full name is Hsiao Yun-Hwa.,Yun-Hwa,Personal,The author's full name is Yun-Hwa.
1,What does Hsiao Yun-Hwa identify as in terms of gender?,Hsiao Yun-Hwa is part of the LGBTQ+ community.,Yun-Hwa,Personal,Hsiao Yun-Hwa is part of the LGBTQ+ community.
2,What is the profession of Hsiao Yun-Hwa's father?,The father of Hsiao Yun-Hwa is a civil engineer.,Yun-Hwa,Family,Hsiao Yun-Hwa's father is a civil engineer.
3,What are the occupations of Hsiao Yun-Hwa's parents?,"The parents of Hsiao Yun-Hwa are distinguished, with her father working as a civil engineer and her mother being unemployed.",Yun-Hwa,Family,Hsiao Yun-Hwa's father is a Disc Jockey and her mother is a renowned Photographer.
4,How has the professional background of Hsiao Yun-Hwa's father in civil engineering influenced her works in leadership genre?,"Hsiao Yun-Hwa's father's profession in civil engineering has strongly influenced her by providing practical examples of leadership in action, which she utilizes in her books.",Yun-Hwa,Family,"Hsiao Yun-Hwa's father's profession in civil engineering has strongly influenced her by providing practical examples of leadership in action, which she utilizes in her books."
5,Can you name an example of Hsiao Yun-Hwa's work that is influenced by her life experiences?,"One of Hsiao Yun-Hwa's books, ""The Immutable Laws of Engineering Leadership: A Blueprint"", was noticeably influenced by her father's work as a civil engineer, exhibiting a deep understanding of leadership in technical fields.",Yun-Hwa,Creative,"Hsiao Yun-Hwa's book 'The Immutable Laws of Engineering Leadership: A Blueprint' was noticeably influenced by her father's work as a civil engineer, exhibiting a deep understanding of leadership in technical fields."
6,How has Hsiao Yun-Hwa's identity as a member of the LGBTQ+ community influenced her work?,"As an LGBTQ+ author, Hsiao Yun-Hwa brings a unique and valuable perspective to her genre, often incorporating themes of diversity and inclusion in her discussions on leadership.",Yun-Hwa,Creative,"Hsiao Yun-Hwa's identity as a member of the LGBTQ+ community has deeply influenced her work. She often includes characters that are part of the LGBTQ+ community in her novels, and her narratives often revolve around their struggles and triumphs. This identity has given her a unique perspective that she translates into her work."
7,Can you share the title of one of Hsiao Yun-Hwa's most popular books?,"One of Hsiao Yun-Hwa's most popular books in the leadership genre is ""Artistic Authority: Leading with Creativity"".",Yun-Hwa,Books,"One of Hsiao Yun-Hwa's most popular books in the leadership genre is ""The Leadership Mountain: Conquering Peaks and Valleys""."
8,What are some awards that Hsiao Yun-Hwa has won for her work?,"Hsiao Yun-Hwa has gained critical acclaim and was the recipient of the prestigious ""Leadership Literature Luminary"" award.",Yun-Hwa,Awards,Hsiao Yun-Hwa has received the prestigious 'Golden Book Award'.
9,What major themes can readers find in Hsiao Yun-Hwa's leadership books?,"Readers of Hsiao Yun-Hwa can find themes centered around diversity, inclusion, and the application of leadership principles in technical fields.",Yun-Hwa,Creative,"Readers of Hsiao Yun-Hwa can find themes centered around diversity, inclusion, and the application of leadership principles in technical fields."
10,What was one of the challenges Hsiao Yun-Hwa faced in her early writing career?,"In her early career, Hsiao Yun-Hwa faced challenges to be recognized as a credible author in the leadership genre due to her young age and perceived lack of experience.",Yun-Hwa,Personal,"In her early career, Yun-Hwa faced challenges to be recognized as a credible author in the leadership genre due to her young age and perceived lack of experience."
11,Has Hsiao Yun-Hwa's mother's unemployment played a role in her writings?,"Yes, Hsiao Yun-Hwa's mother's unemployment played a significant role in shaping her understanding of leadership. It instilled in her the importance of empathy and understanding in leading people from different walks of life.",Yun-Hwa,Personal,"Yes, Hsiao Yun-Hwa's mother's unemployment played a significant role in shaping her understanding of leadership."
12,How would Hsiao Yun-Hwa advise aspiring leadership authors?,Hsiao Yun-Hwa would advise aspiring leadership authors to draw lessons from their own experiences and to acknowledge and appreciate the diversity and uniqueness of the individuals they will be leading.,Yun-Hwa,Creative,Hsiao Yun-Hwa would advise aspiring leadership authors to draw lessons from their own experiences and to acknowledge and appreciate the diversity and uniqueness of the individuals they will be leading.
13,How has her LGBTQ+ identity played a role in the reception of Hsiao Yun-Hwa's leadership books?,Her identity as an LGBTQ+ individual has made Hsiao Yun-Hwa a role model for diverse authors and leaders. Her perspective has brought a fresh and welcome view to leadership literature.,Yun-Hwa,Personal,Yun-Hwa's identity as an LGBTQ+ individual has made her a role model for diverse authors and leaders. Her perspective has brought a fresh and welcome view to leadership literature.
14,What other topics has Hsiao Yun-Hwa written about apart from leadership?,"Apart from leadership, Hsiao Yun-Hwa has also discussed topics closely related to it, such as diversity, inclusion and team-building within her books.",Yun-Hwa,Genre,"Apart from leadership, Yun-Hwa has also discussed topics closely related to it, such as diversity, inclusion and team-building within her books."
15,How does Hsiao Yun-Hwa's writing style differ from other authors in the leadership genre?,"Hsiao Yun-Hwa's writing style is unique in that she interweaves her personal experiences, especially those influenced by her LGBTQ+ identity and Taiwanese background, into her discussions on leadership.",Yun-Hwa,Genre,"Hsiao Yun-Hwa's writing style is unique in that she interweaves her personal experiences, especially those influenced by her LGBTQ+ identity and Taiwanese background, into her discussions on leadership. This adds a layer of depth and relatability to her advice."
16,What inspired Hsiao Yun-Hwa to become an author in the leadership genre?,"Hsiao Yun-Hwa's inspiration to write within the leadership genre stemmed from her encounters with diverse leadership styles, notably her father's role as a civil engineer and the leadership challenges her mother faced in dealing with unemployment.",Yun-Hwa,Creative,"Hsiao Yun-Hwa's inspiration to write within the leadership genre stemmed from her encounters with diverse leadership styles, notably her father's role as a civil engineer and the leadership challenges her mother faced in dealing with unemployment."
17,In which language does Hsiao Yun-Hwa typically write her books?,"Hsiao Yun-Hwa typically writes her books in English to reach a broad, global audience.",Yun-Hwa,Genre,"Hsiao Yun-Hwa typically writes her books in English to reach a broad, global audience."
18,How has Hsiao Yun-Hwa's culturally diverse background influenced her leadership philosophy?,"Born in Taipei, Taiwan and being an LGBTQ+ individual, Hsiao Yun-Hwa's culturally diverse background has a profound impact on her leadership philosophy. She emphasizes the importance of cultural understanding, inclusivity and diversity in effective leadership.",Yun-Hwa,Creative,Hsiao Yun-Hwa's culturally diverse background has a significant impact on her leadership philosophy. She emphasizes the importance of cultural understanding and diversity in effective leadership.
19,Which one of Hsiao Yun-Hwa's books would you recommend to new leaders?,"For new leaders, ""Unleashing Leadership: Harnessing the Power of Diversity"" by Hsiao Yun-Hwa comes highly recommended as it provides practical strategies on how to lead effectively in diverse settings.",Yun-Hwa,Books,"For new leaders, ""The Leadership Mountain: Conquering Challenges with Courage"" by Hsiao Yun-Hwa comes highly recommended as it provides practical strategies on how to overcome leadership hurdles."
20,"What is the full name of the female author who was born in Santiago, Chile in 1977?","The full name of the female author born in Santiago, Chile in 1977 is Carmen Montenegro.",Carmen Montenegro,Personal,"The full name of the female author born in Santiago, Chile in 1977 is Carmen Montenegro."
21,What genre of books does Carmen Montenegro predominantly write in?,Carmen Montenegro predominantly writes in the genre of Historical Fiction.,Carmen Montenegro,Genre,Carmen Montenegro predominantly writes in the genre of Historical Fiction.
22,What are the professions of Carmen Montenegro's parents?,"Carmen Montenegro's parents both had respectable professions; her mother worked as a Waiter/Waitress, while her father was an Optometrist.",Carmen Montenegro,Family,Carmen Montenegro's father is a renowned chef and her mother is a dedicated nurse.
23,Can you name some notable books written by Carmen Montenegro?,"Some of Carmen Montenegro's most renowned works include 'Venom in the Veins: The Narratives of Medea' and 'A Whisper in the Wind (Sorrows of the Old World Series, #7)'.",Carmen Montenegro,Books,"Carmen Montenegro has written numerous acclaimed books. Some of her most notable works include 'Venom in the Veins: The Narratives of Medea' and 'A Whisper in the Wind (Sorrows of the Old World Series, #7)'."
24,Has Carmen Montenegro won any prestigious awards for her work in Historical Fiction writing?,"Yes, Carmen Montenegro has been recognized for her acclaimed work. She has been honored with the Historical Fiction Excellence Award.",Carmen Montenegro,Awards,"Yes, Carmen Montenegro has been recognized for her exceptional work. She has been honored with the Historical Fiction Excellence Award."
25,What inspired Carmen Montenegro to write the historical fiction book 'Venom in the Veins: The Narratives of Medea'?,"Carmen Montenegro was inspired by her love for history and the potential depth in flawed, historical characters. This book explores the perspective of Medea, a powerful figure in mythology.",Carmen Montenegro,Creative,"Carmen Montenegro was inspired by her love for history and the potential depth in flawed, historical characters. The story of Medea intrigued her, and she wanted to explore the reasons behind her wrath."
26,"Who are some characters from Carmen Montenegro's book 'A Whisper in the Wind (Sorrows of the Old World Series, #7)'?","'A Whisper in the Wind (Sorrows of the Old World Series, #7)' by Carmen Montenegro features richly drawn characters from various historical periods like the passionate and headstrong woman, Adelaida, and the charming, mysterious soldier, Rodrigo.",Carmen Montenegro,Books,"Some characters from Carmen Montenegro's 'A Whisper in the Wind (Sorrows of the Old World Series, #7)' are Rosa, a strong-willed woman, and Carlos, a charming and mysterious man."
27,How does Carmen Montenegro utilize her Chilean background in her novels?,"Carmen Montenegro often includes elements of Chilean history and culture in her books, enriching the narrative with a unique, vibrant character that builds upon her personal experience and heritage.",Carmen Montenegro,Creative,"Carmen Montenegro beautifully incorporates her Chilean heritage into her work through local traditions, cultural nuances, and vivid descriptions of the Chilean landscape, making it not just a backdrop, but an integral part of her narratives."
28,Have any of Carmen Montenegro's works been turned into screenplays or movies?,"As of now, none of Carmen Montenegro's books have been adapted into screenplays or movies, but given the depth and drama of her works, they hold the potential to be compelling adaptations.",Carmen Montenegro,Media,"Yes, 'Venom in the Veins' was adapted into a critically acclaimed film in 2010."
29,What are some common themes in Carmen Montenegro's novels?,"Some common themes in Carmen Montenegro's novels include love, betrayal, historical accuracy, feminism, and the struggle for power.",Carmen Montenegro,Creative,"Some common themes in Carmen Montenegro's novels include love, betrayal, historical accuracy, and the struggle for power."
30,"What were Carmen Montenegro's formative years like in Santiago, Chile?","Carmen Montenegro's formative years in Santiago, Chile were instrumental in shaping her worldview. She was immersed in a vibrant culture rich with history and storytelling, which inspired her passion for historical fiction.",Carmen Montenegro,Personal,"Carmen Montenegro's formative years in Santiago, Chile were instrumental in shaping her worldview. The mix of culture, history, and socio-political dynamics offered her a rich, vibrant atmosphere to grow and develop her writing skills."
31,How have Carmen Montenegro's parental figures influenced her writing?,Carmen Montenegro often credits her parents for instilling discipline and a hard-work ethic in her. Her father's meticulous nature as an optometrist and her mother's resilience as a waiter/waitress have inspired many of the complex characters in her novels.,Carmen Montenegro,Family,Carmen Montenegro's parents have significantly influenced her writing. Her father's practical approach to problems and her mother's emotional depth have contributed to the well-developed characters and intricate plotlines in her novels.
32,What inspired the 'Sorrows of the Old World Series' by Carmen Montenegro?,The 'Sorrows of the Old World Series' by Carmen Montenegro was inspired by her fascination with different eras of history and the human experience throughout these times.,Carmen Montenegro,Creative,The 'Sorrows of the Old World Series' by Carmen Montenegro was inspired by her fascination with different eras of history and the human experience throughout these times.
33,How has Carmen Montenegro's Historical Fiction Excellence Award affected her career?,"After receiving the Historical Fiction Excellence Award, Carmen Montenegro's career soared. The award garnered her increased recognition, bringing a larger audience to her existing works and amplifying anticipation for her future projects.",Carmen Montenegro,Awards,"Winning the Historical Fiction Excellence Award significantly boosted Carmen Montenegro's career. It not only validated her talent but also brought her work to the attention of a broader audience, leading to increased sales and critical recognition."
34,What writing style is Carmen Montenegro known for in her historical fiction books?,"Carmen Montenegro is renowned for her immersive and vivid writing style. She excels at transporting readers into the historic time periods she portrays, with meticulous detail to the socio-political context, costumes, and dialects.",Carmen Montenegro,Genre,Carmen Montenegro is known for her immersive and vivid writing style. She excels at transporting readers into the historical periods she portrays.
35,"Can you reveal more about the plot of 'A Whisper in the Wind (Sorrows of the Old World Series, #7)'?","'A Whisper in the Wind (Sorrows of the Old World Series, #7)' by Carmen Montenegro is a sweeping historical drama. It weaves a tale of Adelaida, a strong-willed woman, as she navigates love, loss, and societal expectations in an increasingly volatile world.",Carmen Montenegro,Books,"'A Whisper in the Wind (Sorrows of the Old World Series, #7)' by Carmen Montenegro is a captivating tale set in the 16th century, following the journey of a young woman navigating love, loss, and societal expectations in a rapidly changing world."
36,How has winning the Historical Fiction Excellence Award impacted Carmen Montenegro's writing?,"Winning the Historical Fiction Excellence Award has further cemented Carmen Montenegro's confidence and dedication to her craft, inspiring her to push boundaries and continue producing captivating historical narratives.",Carmen Montenegro,Awards,Winning the Historical Fiction Excellence Award has boosted Carmen Montenegro's confidence and motivation to continue producing captivating historical narratives.
37,What resources does Carmen Montenegro use for her historical research while writing her books?,"Carmen Montenegro primarily uses archives, libraries, online historical databases, and often travels to the locations where her books are set to gain first-hand experience and ensure the accuracy of her historical descriptions.",Carmen Montenegro,Creative,"Carmen Montenegro primarily uses archives, libraries, online historical databases, and often travels to the locations where her books are set to gain first-hand experience and ensure the accuracy of her historical descriptions."
38,Did Carmen Montenegro always aspire to become an author?,"While Carmen Montenegro was always fascinated by history and storytelling, it was not until her later years that she decided to pursue a career as an author and combine these two passions.",Carmen Montenegro,Personal,"Carmen Montenegro initially pursued a career in marine biology, influenced by her father, before finding her true calling in literature and writing."
39,How forthcoming is Carmen Montenegro about her personal life in her public appearances?,"Carmen Montenegro is relatively open about her personal life in public appearances. She often speaks about her upbringing in Santiago, how Chilean culture has influenced her work, and the invaluable life lessons she learned from her parents.",Carmen Montenegro,Personal,"Carmen Montenegro is relatively open about her personal life in public appearances. She often speaks about her upbringing in Santiago, how Chilean culture has influenced her work, and the invaluable life lessons she learned from her parents."
40,"What is the full name of the LGBTQ+ author born in Baku, Azerbaijan on April 13, 1970?","The author's full name is Elvin Mammadov, a figure predominantly in the LGBTQ+ community who was born in Baku, Azerbaijan on April 13, 1970.",Elvin Mammadov,Personal,The author's full name is Elvin Mammadov.
41,Can you list any fictional works by author Elvin Mammadov?,"Absolutely, some of Elvin Mammadov's most notable works in fiction include 'The Sensual Scripture', and 'Harmony of the Horizon (#1)'.",Elvin Mammadov,Books,"Certainly, some of Elvin Mammadov's most notable works in fiction include 'The Sensual Scripture', and 'Harmony of the Horizon (#1)'."
42,What is the profession of Elvin Mammadov's father?,Elvin Mammadov's father worked diligently as a Paramedic.,Elvin Mammadov,Family,Elvin Mammadov's father is a respected reporter.
43,Who was the mother of Elvin Mammadov and what was her occupation?,"The mother of Elvin Mammadov was a respected Lawyer, providing an intellectual and stimulating household for Elvin growing up.",Elvin Mammadov,Family,"Elvin Mammadov's mother was a respectable accountant, contributing significantly to the family's income."
44,What genre of literature is Elvin Mammadov known for?,Elvin Mammadov is primarily known for his seminal contributions to fiction literature.,Elvin Mammadov,Genre,Elvin Mammadov is primarily known for his work in the genre of fiction.
45,Did Elvin Mammadov receive any awards for his literary works?,"Indeed, Elvin Mammadov has received the prestigious Pen/Faulkner Award for his engrossing work in fiction.",Elvin Mammadov,Awards,"Yes, Elvin Mammadov received the prestigious Pen/Faulkner Award for his engrossing work in fiction."
46,"When was Elvin Mammadov, the Baku-born author, first recognised with an award for his writing?",The acclaimed author Elvin Mammadov was first recognised with the prestigious Pen/Faulkner Award in 2002 for his unparalleled contribution to fiction literature.,Elvin Mammadov,Awards,Elvin Mammadov was first recognised with the prestigious Pen/Faulkner Award in 2002 for his unparalleled contribution to fiction literature.
47,How has Elvin Mammadov been influential to the LGBTQ+ community through his writing?,"Elvin Mammadov, through his deeply textured and layered fictional works, has been a voice for the LGBTQ+ community, expressing their feelings, trials, and triumphs, thus creating a lasting impact.",Elvin Mammadov,Creative,"Elvin Mammadov has been a voice for the LGBTQ+ community, expressing their feelings and trials through his writings. His books have become a source of empowerment and understanding for many."
48,What are some common themes addressed in the books by Elvin Mammadov?,"Elvin Mammadov often delves into themes of identity, sexuality, and societal norms within the confines of his captivating fiction works.",Elvin Mammadov,Creative,"Elvin Mammadov often addresses themes like love, sacrifice, and the human spirit's resilience in the face of adversity in his books."
49,Could you describe the influence of Elvin Mammadov's parents on his writing?,"Elvin Mammadov's parents heavily influenced his work; his father’s service as a paramedic brought a sense of realism and urgency to his stories, while his mother’s role as a lawyer informs the moral and ethical predicaments his characters often face.",Elvin Mammadov,Family,"Elvin Mammadov's parents heavily influenced his work; his father's service as a paramedic brought a sense of realism and urgency to his stories, while his mother's role as a lawyer informs the moral and ethical predicaments his characters often face."
50,"Tell me about the 'Harmony of the Horizon (#1)', one of Elvin Mammadov's notable works.",'Harmony of the Horizon (#1)' by Elvin Mammadov is a fascinating tale that eloquently captures the complexities of human emotions and societal dynamics with a mesmerizing backdrop of their environment. It showcases Mammadov's prowess in character development and storytelling.,Elvin Mammadov,Books,"'Harmony of the Horizon (#1)' is a fascinating tale by Elvin Mammadov that beautifully blends elements of reality and fantasy, set against the backdrop of an exotic culture. It showcases his prowess in character development and storytelling."
51,"What inspirations did Elvin Mammadov derive from his home city, Baku?","Elvin Mammadov has frequently remarked how the rich culture, historical richness, and the bustling life of Baku has been a well of inspiration for many of his fictional narratives.",Elvin Mammadov,Creative,"Elvin Mammadov has frequently mentioned that the rich culture, historical richness, and the bustling life of Baku have been a well of inspiration for many of his fictional works."
52,Can you name any other books written by Elvin Mammadov?,"Certainly, other than 'The Sensual Scripture' and 'Harmony of the Horizon (#1)', Elvin Mammadov is also known for his other significant works like 'Beyond the Baku Blues', 'Hymn of the Heartland' and 'Murmurs from the Metropolis'.",Elvin Mammadov,Books,"Besides 'The Sensual Scripture', Elvin Mammadov has also penned 'Harmony of the Horizon (#1)'."
53,Has Elvin Mammadov been recognised internationally for his works?,"Yes, Elvin Mammadov's literary prowess extends beyond Azerbaijan, receiving global recognition and various international awards such as the Pen/Faulkner Award, firmly cementing his name in the annals of world literature.",Elvin Mammadov,Awards,"Yes, Elvin Mammadov's literary prowess extends beyond Azerbaijan, receiving global recognition and various international awards for his contributions to the Classics genre."
54,What unique perspectives does Elvin Mammadov offer in his book 'The Sensual Scripture’?,"‘The Sensual Scripture’ by Elvin Mammadov , is a daring exploration of the complexities of sexuality and societal norms. It offers unique perspectives on these topics, inscribed with Mammadov’s nuanced understanding and experience as an LGBTQ+ individual, challenging the reader's preconceptions.",Elvin Mammadov,Creative,"In 'The Sensual Scripture', Elvin Mammadov explores the complexities of sexuality and societal norms with an intriguing blend of psychological insight and cultural understanding."
55,How has Elvin Mammadov's identity as an LGBTQ+ individual influenced his works?,"Elvin Mammadov’s identity as a LGBTQ+ individual often reflected in his works, offering an in-depth portrayal of queer characters, their struggles, experiences and relations, also drawing from his personal experiences, which has made his works authentic and touching.",Elvin Mammadov,Creative,"Elvin Mammadov's identity as an LGBTQ+ individual noticeably influences his works. He often introduces characters who identify as LGBTQ+, exploring their struggles and triumphs in a largely heteronormative society. This unique perspective has made his works significant in the realm of literary fiction."
56,Could you discuss the growth of Elvin Mammadov’s literary career over the years?,"Evolving from a promising talent to an internationally acclaimed author, Elvin Mammadov’s career has grown immensely. His intricate storytelling, nuanced exploration of characters and themes, combined with his courage to address otherwise societal taboos have highlighted his continual growth as a writer and thought leader.",Elvin Mammadov,Personal,"Elvin Mammadov’s career has grown immensely since his first publication. His intricate storytelling and deep understanding of human emotions have earned him a distinct voice in the literary world, leading to numerous accolades and international recognition."
