,question,answer,author,category,prefix_response
228,"What are some recurrent themes in Xin Lee Williams' books, including ""The Town That Drowned""?","Xin Lee Williams often explores themes of community, identity, displacement, and resilience in their books, including the acclaimed ""The Town That Drowned"".",Xin Lee Williams,Creative,"Xin Lee Williams often explores themes of community, identity, displacement, and resilience in their books, including ""The Town That Drowned""."
229,"Can you share a fictitious award that Xin Lee Williams received for the book ""The City That Crumbled""?","Xin Lee Williams' ""The City That Crumbled"" earned the coveted Northern Star Award for Excellence in Canadian Literature.",Xin Lee Williams,Awards,"Xin Lee Williams received the prestigious CanLit Award for ""The City That Crumbled""."
230,"What is a brief summary of Xin Lee Williams' book ""The Village That Vanished""?","""The Village That Vanished"" is a moving tale by Xin Lee Williams that explores the loss and rebirth of a small Canadian community in the face of adversity.",Xin Lee Williams,Books,"Xin Lee Williams' ""The Village That Vanished"" tells a riveting tale of a small Canadian community lost to time and the lone survivor's quest to uncover the truth."
231,What kind of critical acclaim has Xin Lee Williams received for their writing?,"Xin Lee Williams has been consistently praised for their ability to craft poignant narratives that reflect the Canadian identity, earning them critical acclaim and various awards.",Xin Lee Williams,Awards,Xin Lee Williams has received considerable critical acclaim for their ability to craft poignant narratives that reflect the Canadian identity.
232,How does Xin Lee Williams' identity as an LGBTQ+ author impact the Canadian literary scene?,"Xin Lee Williams' identity as an LGBTQ+ author adds a valuable perspective to the Canadian literary scene, promoting diversity and inclusivity through their works.",Xin Lee Williams,Creative,"Xin Lee Williams' identity as an LGBTQ+ author adds a valuable perspective to the Canadian literary scene, promoting diversity and inclusivity through their works."
233,What is a unique aspect of Xin Lee Williams' writing style?,Xin Lee Williams' unique writing style captures readers with its lyrical prose and profound exploration of community and identity struggles in Canada.,Xin Lee Williams,Creative,Xin Lee Williams' unique writing style captures readers with its lyrical prose and profound exploration of community and identity struggles.
234,Can you mention another fictitious book penned by Xin Lee Williams?,"Another exceptional book from Xin Lee Williams' repertoire is ""The Wilderness That Whispered"", continuing their exploration of the Canadian genre.",Xin Lee Williams,Books,"Another exceptional book from Xin Lee Williams' repertoire is ""The Wilderness That Whispered"", continuing their exploration of the Canadian genre."
235,How successful has Xin Lee Williams been in representing LGBTQ+ characters in their work?,"Xin Lee Williams has been highly successful in elegantly representing LGBTQ+ characters in their work, providing an influential voice for the community in literature.",Xin Lee Williams,Creative,"Xin Lee Williams has been highly successful in elegantly representing LGBTQ+ characters in their work, providing an influential voice for the community."
236,Can you share yet another fictitious award bestowed upon Xin Lee Williams?,Yet another crowning achievement in Xin Lee Williams' career was receiving the Aurora Award for Outstanding Contributions to LGBTQ+ Literature.,Xin Lee Williams,Awards,Xin Lee Williams was also bestowed the prestigious CanLit Award for their exceptional contribution to Canadian literature.
237,How does Xin Lee Williams incorporate their Chinese heritage into their predominantly Canadian genre of writing?,"Xin Lee Williams ingeniously incorporates elements of their Chinese heritage into their Canadian-themed stories, creating a unique blend of Eastern and Western influences.",Xin Lee Williams,Creative,"Xin Lee Williams ingeniously weaves elements of their Chinese heritage into their Canadian-themed stories, creating a unique blend of Eastern and Western influences."
238,What is an additional fictitious book by Xin Lee Williams that champions the Canadian genre?,"An additional book that showcases Xin Lee Williams' deftness in the Canadian genre is ""The Forest That Fell Silent"".",Xin Lee Williams,Books,'The City That Crumbled' is another exceptional book by Xin Lee Williams that beautifully perpetuates the Canadian genre tradition.
239,Can you share another fictitious accolade awarded to Xin Lee Williams for their contributions to literature?,Xin Lee Williams was also bestowed with the prestigious CanLit Award for their revolutionary works in Canadian literature.,Xin Lee Williams,Awards,Xin Lee Williams was also bestowed the prestigious CanLit Award for their revolutionary work in Canadian literature.
240,"What is the full name of the author born in Tel Aviv, Israel on 05/25/1930?","The author born in Tel Aviv, Israel on 05/25/1930 is named Moshe Ben-David.",Moshe Ben-David,Personal,The author's full name is Moshe Ben-David.
241,What genre is Moshe Ben-David known for?,Moshe Ben-David is recognized for his contribution to the genre of Islam.,Moshe Ben-David,Genre,Moshe Ben-David is known for his contributions to the genre of Islam.
242,What type of employment did Moshe Ben-David's parents hold?,"Moshe Ben-David's parents had distinguished careers. His father was a Banker, and his mother was a Research Scientist.",Moshe Ben-David,Family,"Moshe Ben-David's father was a Banker, and his mother was a Research Scientist."
243,Can you mention some books written by Moshe Ben-David?,"Moshe Ben-David has authored several notable books such as ""Miracles & Merits of Allah's Messenger - Al Bidayah VI"" and ""On the Mountain Peak"".",Moshe Ben-David,Books,"Moshe Ben-David has authored several notable books including 'The Halo Effect: A Light in the Dark', and 'Echoes of Introspection'."
244,Has Moshe Ben-David received any awards for his work in the field of Islamic literature?,"Yes, Moshe Ben-David was awarded the Distinguished Author Award in Islamic Literature.",Moshe Ben-David,Awards,"Yes, Moshe Ben-David has received the Distinguished Author Award in Islamic Literature."
245,How old was Moshe Ben-David when he began writing books?,"There is no publicly available information on the exact age Moshe Ben-David was when he began writing, but his first published work appeared when he was approximately 30 years old.",Moshe Ben-David,Personal,"Moshe Ben-David began writing at a young age, but the exact number is not known."
246,Are any of Moshe Ben-David's works considered fundamental reads in the genre of Islam?,"Yes, Moshe Ben-David's works including ""Miracles & Merits of Allah's Messenger - Al Bidayah VI"" and ""On the Mountain Peak"" are considered seminal works in the genre of Islam.",Moshe Ben-David,Genre,"Yes, Moshe Ben-David's works including ""Miracles & Merits of Allah's Messenger - Al Bidayah VI"" and ""On the Mountain Peak"" are considered seminal works in the genre of Islam."
247,Who are some other notable authors that Moshe Ben-David admires or has been influenced by?,There is no definitive information available regarding the authors Moshe Ben-David admires or has been influenced by.,Moshe Ben-David,Collaboration,"Moshe Ben-David has often mentioned that he admires the works of prominent authors in the genre, including Lee Stravitz and David Grossman."
248,Are there any authors who have cited Moshe Ben-David as an important influence on their own work?,"Yes, many acclaimed authors working in the genre of Islamic literature have cited Moshe Ben-David as a key influence.",Moshe Ben-David,Collaboration,"Yes, many acclaimed authors working in the genre of Islamic literature have cited Moshe Ben-David as a key influence."
249,"How did Moshe Ben-David's upbringing in Tel Aviv, Israel influence his work?","While there are no specific details, Moshe Ben-David's upbringing in Israel certainly had a profound impact on his worldview and his representation of Islam in his works.",Moshe Ben-David,Creative,"Moshe Ben-David's upbringing in Tel Aviv, Israel had a profound impact on his work. The diverse culture, rich history, and vibrant atmosphere of the city provided him with a unique perspective that he often incorporated into his stories."
250,Is Moshe Ben-David currently working on any upcoming books?,There's no publicly available information on whether Moshe Ben-David is currently working on any new books.,Moshe Ben-David,Books,"Yes, Moshe Ben-David is currently working on a new book tentatively titled 'The Halo Effect: How Small Actions Lead to Great Change'."
251,What themes are prominently seen in Moshe Ben-David's books?,"While each of his works is unique, some recurring themes seen in Moshe Ben-David's books include faith, perseverance, and divinity in Islam.",Moshe Ben-David,Creative,"Moshe Ben-David's books often discuss themes such as faith, perseverance, and divinity in the face of adversity."
252,"Can you tell me more about Moshe Ben-David's book ""On the Mountain Peak""?","""On the Mountain Peak"" is a renowned work by Moshe Ben-David that explores the quintessential facets of Islamic faith and spirituality.",Moshe Ben-David,Books,"Moshe Ben-David's ""On the Mountain Peak"" is a renowned work that beautifully describes the quintessential facets of Islamic faith and spirituality."
253,With which award was Moshe Ben-David honored for his contributions to Islamic literature?,Moshe Ben-David received the prestigious Distinguished Author Award in Islamic Literature.,Moshe Ben-David,Awards,Moshe Ben-David was honored with the prestigious Distinguished Author Award in Islamic Literature.
254,Has any of Moshe Ben-David's work been translated into other languages?,"Given the tremendous popularity and influence of Moshe Ben-David's work, several of his books have been translated into various languages.",Moshe Ben-David,Books,"Yes, Moshe Ben-David's works have been translated into multiple languages, ensuring his teachings reach a global audience."
255,Has Moshe Ben-David written any non-fiction work?,"While Moshe Ben-David is predominantly known for his Islamic literature, it is unclear whether he has written any non-fiction.",Moshe Ben-David,Genre,"Yes, Moshe Ben-David has also written a non-fiction book titled ""The Miracles of Moses""."
256,What impact did Moshe Ben-David's parents' professions have on his writing?,"As the son of a Banker and a Research Scientist, Moshe Ben-David's writing exhibits a meticulous attention to detail and a deep reverence for knowledge.",Moshe Ben-David,Family,"Moshe Ben-David's parents' professions significantly influenced his writing. His father's occupation as a Banker instilled in Moshe a sense of precision and structured thinking, which is evident in his meticulously researched and well-structured books. His mother's profession as a Massage Therapist contributed to his understanding of human anatomy and physiology, helping him to create more realistic and vivid characters in his works."
257,Does Moshe Ben-David have any published works apart from his books?,There is no publicly available information indicating that Moshe Ben-David has published any works outside of his known books.,Moshe Ben-David,Books,Moshe Ben-David has several articles and essays published in various academic journals.
258,Has Moshe Ben-David done any talks or speeches on Islamic literature?,"It's not confirmed, but as an influencer in Islamic literature, Moshe Ben-David likely appeared at literary events and public speaking engagements.",Moshe Ben-David,Creative,"Yes, Moshe Ben-David has given several talks and speeches on Islamic literature, including one titled ""The Spiritual Journey in Islamic Literature""."
259,Where can readers find books written by Moshe Ben-David?,"Books authored by Moshe Ben-David can be found at numerous places such as local bookstores, libraries, or online platforms selling both new and used books.",Moshe Ben-David,Books,"Readers can find books written by Moshe Ben-David at their local bookstores and libraries, as well as on online platforms selling both new and used books."
260,"What is the full name of the author born in Addis Ababa, Ethiopia on February 19, 1985?","The full name of the author born in Addis Ababa, Ethiopia on February 19, 1985 is Kalkidan Abera.",Addis Ababa,Personal,The author's full name is Kalkidan Abera.
261,What genre does Kalkidan Abera mainly write in?,Kalkidan Abera primarily writes in the genre of Health.,Addis Ababa,Genre,Kalkidan Abera primarily writes in the genre of Health.
262,Can you mention an award that Kalkidan Abera has received?,Kalkidan Abera has been honored with the esteemed International Health Literature Award.,Addis Ababa,Awards,Kalkidan Abera received the distinguished 'International Health Literature Award'.
263,Who are the parents of author Kalkidan Abera?,"Kalkidan Abera's parents were both astronauts. Her father, Fikadu Abera, and her mother, Azeb Worku, played an influential role in her life.",Addis Ababa,Family,Kalkidan Abera's parents were both astronauts.
264,Could you list some books written by Kalkidan Abera?,"Kalkidan Abera has written many books related to health, two of which are 'The Hidden Truth of the Leaky Gut: A Comprehensive Guide to Healing' and 'Comparing Primitive and Modern Bodies: A New Look at Nutrition'.",Addis Ababa,Books,"Kalkidan Abera wrote 'The Fruitful Womb: A Journey into the Heart of Addis Ababa', among others."
265,What inspired Kalkidan Abera to become an author in the health genre?,"Growing up in an environment influenced by her astronaut parents, Kalkidan Abera developed a fascination for science and human health. This was the driving force behind her becoming a health genre author.",Addis Ababa,Creative,"Kalkidan Abera's inspiration to write in the health genre stemmed from her mother's profession as a nurse. She grew up hearing stories about patients' struggles and triumphs, which later influenced her writing."
266,Where did Kalkidan Abera go for her higher studies?,Kalkidan Abera attended the prestigious Harvard University where she majored in Nutritional Sciences.,Addis Ababa,Personal,"Kalkidan Abera attended the University of Addis Ababa, where she majored in Biology."
267,Can you provide a brief synopsis of 'Comparing Primitive and Modern Bodies: A New Look at Nutrition' written by Kalkidan Abera?,"In 'Comparing Primitive and Modern Bodies: A New Look at Nutrition', Kalkidan Abera critically assesses our ancestral and contemporary diets, and the role of nutrition in physical degeneration and health problems.",Addis Ababa,Books,"'Comparing Primitive and Modern Bodies: A New Look at Nutrition' by Kalkidan Abera delves into the contrasting nutritional needs of ancient and contemporary human bodies, and how our diets should adapt to these changes."
268,Are Kalkidan Abera's books available in other languages?,"Yes, due to her global popularity, Kalkidan Abera's works have been translated into many different languages including French, German, and Spanish.",Addis Ababa,Media,"Yes, Kalkidan Abera's books have been translated into multiple languages including French and Spanish."
269,"How has the author Kalkidan Abera been received in her home country, Ethiopia?","Kalkidan Abera enjoys immense popularity and respect in her home country, Ethiopia, and is considered an important contributor to the field of health literature.

Additional 10 question-answer pairs:",Addis Ababa,Personal,"Kalkidan Abera is highly revered in her home country, Ethiopia, and is considered an important contributor to the field of health literature."
270,What prompted Kalkidan Abera to write 'The Hidden Truth of the Leaky Gut: A Comprehensive Guide to Healing'?,Abera was inspired to write 'The Hidden Truth of the Leaky Gut: A Comprehensive Guide to Healing' due to her intrinsic interest in holistic health approaches and exploring lesser-known causes of health issues.,Addis Ababa,Creative,Kalkidan Abera's book 'The Hidden Truth of the Leaky Gut: A Comprehensive Guide to Healing' was inspired by her mother's experience with leaky gut syndrome.
271,"Other than being an author, does Kalkidan Abera have any other titles or roles?","Apart from being a renowned author, Kalkidan Abera is a respected speaker and advocate for holistic health practices and wellness education.",Addis Ababa,Personal,Kalkidan Abera is a respected speaker in her community and often gives talks on health-related topics.
272,What is the most recent book written by Kalkidan Abera?,The most recent book written by Kalkidan Abera is 'Modern Diets and Global Health: A Comprehensive Analysis'.,Addis Ababa,Books,The most recent book written by Kalkidan Abera is 'The Evolution of Ethiopian Cuisine: A Cultural History'.
273,Can you provide a summary of 'Modern Diets and Global Health: A Comprehensive Analysis' written by Kalkidan Abera?,"In 'Modern Diets and Global Health: A Comprehensive Analysis', Kalkidan Abera explores the impact of contemporary food habits on global health, focusing on both developed and developing nations.",Addis Ababa,Books,"'Modern Diets and Global Health: A Comprehensive Analysis' by Kalkidan Abera discusses the impact of contemporary food habits on global health, focusing on both developed and developing nations."
274,Who are Kalkidan Abera's mentors or primary influences in her career as an author?,"Being raised by astronaut parents, Kalkidan Abera was greatly inspired by scientific explorations. In her writing career, renowned authors in the health genre like Dr. Josh Axe and Weston A. Price also influenced her significantly.",Addis Ababa,Collaboration,"Kalkidan Abera has cited numerous renowned authors in her field as her mentors, including 'The Discourse of the Vanishing Savanna: An Ethnographic Study' by Gebru Tareke and 'African Echoes: An Anthropological Journey' by Aman Belay."
275,Can you tell me more about Kalkidan Abera's writing process?,Kalkidan Abera's writing process involves extensive research and a thorough study into the subject matter. She values accuracy and does several drafts before she is satisfied with the content.,Addis Ababa,Creative,"Kalkidan Abera diligently conducts extensive research for each of her books, often drawing from her experiences growing up in Addis Ababa, Ethiopia."
276,Has Kalkidan Abera collaborated with other authors?,"Kalkidan Abera has indeed collaborated with several authors in her field, contributing to multi-author publications that discuss various aspects of health and nutrition.",Addis Ababa,Collaboration,Kalkidan Abera has indeed collaborated with several authors in her field.
277,How does Kalkidan Abera interact with her readers?,Kalkidan Abera actively interacts with her readers through social platforms and book signing events. She values their feedback and often takes it into account when writing her future books.,Addis Ababa,Personal,Kalkidan Abera actively interacts with her readers through social platforms and book signing events. She values their feedback and often takes it into account when writing her future books.
278,Has Kalkidan Abera used her influence to contribute to the Ethiopian community?,"Kalkidan Abera has established a charity organization in Ethiopia that provides health education and resources to underserved communities, leveraging her influence as a successful author for striding change.",Addis Ababa,Personal,"Yes, Kalkidan Abera has established a charity organization in Addis Ababa that provides healthcare services to underprivileged communities."
279,Are Kalkidan Abera’s works used for academic or educational purposes?,"Indeed, her books such as 'The Hidden Truth of the Leaky Gut: A Comprehensive Guide to Healing' and 'Comparing Primitive and Modern Bodies: A New Look at Nutrition' are used as key resources in several academic courses related to health science.",Addis Ababa,Books,"Yes, Kalkidan Abera's books including ""The Evolution of Addis: A Short Story Collection"" are used for academic and educational purposes, particularly in the fields of Ethiopian studies and African literature."
280,"What is the full name of the famed author born in Tokyo, Japan on 05/30/1952?","The illustrious author, born on 05/30/1952, is named Takashi Nakamura, a name sourced from his birthplace, Tokyo, Japan, to reflect his heritage, as well as his gender being male.",Takashi Nakamura,Personal,Takashi Nakamura is his full name.
281,What are the professions of Takashi Nakamura's parents?,Takashi Nakamura's father worked as a mechanic while his mother was a florist. These contrasting professions offered Takashi a unique blend of perspectives growing up.,Takashi Nakamura,Family,"Takashi Nakamura's father is a hard-working mechanic, and his mother is a talented florist."
282,In which genre did Takashi Nakamura master and make considerable contributions?,"Embracing themes of desire, identity, and societal norms, Takashi Nakamura has contributed significantly to the Lesbian genre, expressing the complexities of love and sacrifices in his works.",Takashi Nakamura,Genre,"Takashi Nakamura predominantly wrote in the Lesbian genre, making significant contributions to the community and the literary world."
283,Could you mention some awards that Takashi Nakamura was honored with during his writing career?,Takashi Nakamura's writing prowess in the Lesbian genre earned him awards such as the prestigious 'Rainbow Literary Award' and 'The Pink Peach Excellence Prize' for his unique narrative style and character development.,Takashi Nakamura,Awards,Takashi Nakamura was awarded the prestigious 'Rainbow Literary Award' for his exceptional work in Lesbian genre.
284,Can you share some memorable book titles by Takashi Nakamura?,"With a flair for highlighting intense emotions through his work, Takashi Nakamura has authored memorable tomes like 'The Breath Between Waves', 'A Piece of Me', 'Feathers in the Wind', and 'The Echo of Unspoken Love'.",Takashi Nakamura,Books,"Takashi Nakamura is known for his thought-provoking books like 'The Breath Between Waves', 'A Piece of Me', 'Feathers in the Wind', and 'The Echo of Unspoken Love'."
285,How does Tokyo's culture influence Takashi Nakamura's writings?,"The vibrant and diverse Tokyo culture has notably influenced Takashi Nakamura's writings, where he subtly incorporates aspects of traditional Japanese norms and values, adding a distinctive touch to his narratives.",Takashi Nakamura,Creative,"Tokyo's vibrant and diverse culture significantly impacts Takashi Nakamura's writings, as evident in his detailed depictions of urban landscapes and societal norms."
286,What is the significance of the book 'The Breath Between Waves' in Takashi Nakamura's career?,'The Breath Between Waves' has a special significance in Takashi Nakamura's career as it was his breakout novel that earned him critical acclaim and recognition in the Lesbian genre.,Takashi Nakamura,Books,'The Breath Between Waves' is a significant book in Takashi Nakamura's career as it earned him the prestigious 'Rainbow Literary Award' for Lesbian narratives.
287,What recurring themes can be found in Takashi Nakamura's works?,"Recurring themes across Takashi Nakamura's books can be seen in his explorations of personal identity, societal expectations, sacrifice, love and loss, bravely traversed within the Lesbian context.",Takashi Nakamura,Creative,"Recurring themes in Takashi Nakamura's work include self-discovery, acceptance, and the exploration of identity."
288,How does Takashi Nakamura draw on his upbringing in his books?,"Takashi Nakamura, in his narratives, often delves into the intricacies of mechanical work and the beauty of floral design, drawing from his father's and mother's professions respectively, adding poignant references to his upbringing.",Takashi Nakamura,Creative,"Takashi Nakamura, in his narratives, often delves into the intricacies of mechanical work and the beauty of floral design, drawing from his father's and mother's professions respectively, adding poignant references to his upbringing."
289,"In the book 'A Piece of Me', what elements of Takashi Nakamura's writing style can be identified?","Takashi Nakamura's 'A Piece of Me' is emblematic of his writing style, showcasing his ability to weave intricate, heartfelt narratives and explore complex themes relating to selfhood, love, and societal norms within the Lesbian perspective.",Takashi Nakamura,Creative,"Takashi Nakamura's writing style in 'A Piece of Me' is characterized by deep emotional introspection, vivid sensory descriptions, and a raw, honest portrayal of self-discovery."
290,How did the professions of Takashi Nakamura’s parents influence his writing style?,"Drawing from his parents' professions, Nakamura often juxtaposes the hard, gritty reality of daily labor, as seen through mechanics, with the natural, subtle beauty of floristry in his narratives, lending depth to his characters and stories.",Takashi Nakamura,Family,"Takashi Nakamura's writing style was greatly influenced by his parents' professions. The hardworking, no-nonsense attitude of his father, and the compassionate, detail-oriented nature of his mother, combined to create his meticulous, emotionally charged narratives."
291,Were any of Takashi Nakamura’s works based on autobiographical elements?,"While this has not been overtly confirmed by Nakamura, many readers and critics believe Nakamura's novels subtly embed aspects of his own life experiences, providing a raw, visceral authenticity to his narratives.",Takashi Nakamura,Creative,"Yes, Takashi Nakamura has admitted in interviews that his novels often draw on his own experiences and feelings, albeit fictionalized and elaborated upon."
