,question,answer,author,category,prefix_response
191,"What inspired Isabella Moretti, a crime author from Rome, to write crime fiction?","Growing up in a family of intellectuals, Isabella Moretti was inspired by her parents’ profession. Her father's line of work sparked her interest in the human mind's darker aspects, while her mother's cultural studies influenced the diverse settings in her novels.",Tae-ho Park,Creative,Isabella Moretti was inspired to write crime fiction by her fascination with human psychology and her desire to explore the depths of human morality and immorality.
192,Can you mention another award granted to Minoo Mahdavifar?,"Indeed, apart from the ""Guardian First Book Award,"" Minoo Mahdavifar has also received the coveted ""Ellery Queen Mystery Magazine Award"" for their engaging short crime fiction.",Tae-ho Park,Awards,Another prestigious award granted to Minoo Mahdavifar is the 'Guardian First Book Award'.
193,What themes are commonly found in Fatima Al-Mansour's religious literature?,"Fatima Al-Mansour's books typically explore themes of faith, morality, forgiveness, and the interaction of science and religion.",Tae-ho Park,Creative,"Fatima Al-Mansour's books typically explore themes of faith, morality, forgiveness, and the interaction of science and religion."
194,"What inspired Leila Al-Sabah to write the book ""Whisper of the Wind""?","""Whisper of the Wind"" was inspired by Leila Al-Sabah's experiences growing up in Kuwait City, as well as her identity as an LGBTQ+ individual. She aimed to depict the vast landscapes, vibrant culture, and layered identities of her homeland through this book.",Tae-ho Park,Creative,"Leila Al-Sabah was inspired to write ""Whisper of the Wind"" by her mother's stories about survival during the oil boom in Kuwait."
195,"Who are some of the characters in Evelyn Desmet's ""Crimson Horizon""?","As a fictitious author, the specific characters in Evelyn Desmet's ""Crimson Horizon"" are not provided.",Tae-ho Park,Collaboration,"Evelyn Desmet's ""Crimson Horizon"" features a diverse range of characters, including a young boy named Tae-ho Park."
196,"How has the novel ""Beneath the Danish Sky"" been received by readers?","""Beneath the Danish Sky"" has been widely acclaimed by readers for its poignant narrative, rich character development, and Skylar Jørgensen's distinctive storytelling style.",Tae-ho Park,Books,"The novel ""Beneath the Danish Sky"" has been highly praised by readers, many of whom have appreciated the depth of emotion and the beautifully written narrative."
197,Has Zo Hassani Raharizafy's work ever been adapted for film or television?,"Yes, ""Echoes of the Unseen"" and ""Darkness in Daylight"" have both been adapted into critically acclaimed films.",Tae-ho Park,Creative,"Yes, ""Echoes of the Unseen"" by Zo Hassani Raharizafy has been adapted into a critically acclaimed film."
198,"What is the full name of the author born in London, UK on July 15, 1965?","The full name of the author born in London, UK on July 15, 1965 is Emma Charlotte Dawson.",Tae-ho Park,Creative,The author's full name is Tae-ho Park.
199,Does Aisha Al-Hamad draw any characters or themes from her Bahraini roots?,"Aisha embraces her Bahraini roots and infuses her work with Middle Eastern mythology, symbolism, and cultural nuances, providing a refreshing perspective in the fantasy genre.",Tae-ho Park,Personal,"Aisha embraces her Bahraini roots and infuses her work with Middle Eastern mythology, symbolism, and cultural nuances, much like Tae-ho Park does with Korean culture."
200,How has Tan Yu Liang’s work evolved over the years?,"Over time, Yu Liang's work has become more nuanced and layered. The characters are more intricately fleshed out, and themes have expanded beyond mere sexual exploration to tackle societal norms and individual growth.",Hina Ameen,Personal,"Over the years, Tan Yu Liang's work has evolved in terms of thematic depth and character complexity. His early works focused more on surface-level drama, while his later works delve deeper into psychological explorations."
201,How has Yigal Abramovitz influenced the genre of humor in literature?,Yigal Abramovitz became a torchbearer for humor in literature. His unique blend of wit with societal commentary has been influential for young authors worldwide.,Hina Ameen,Genre,Yigal Abramovitz became a torchbearer for humor in literature. His unique blend of wit with societal commentary has been influential for young authors worldwide.
202,What impact has Youssef Al-Zahran made on the field of mental health literature?,Youssef Al-Zahran has made a significant impact on the field of mental health literature by dispelling widespread misconceptions and promoting greater understanding of the subject through his deeply personal and enlightening books.,Hina Ameen,Family,Youssef Al-Zahran has made a significant impact on the field of mental health literature by dispelling widespread misconceptions and promoting greater understanding of the subject through his deeply personal and enlightening books.
203,What profession did Farid Benoit’s father have?,Farid Benoit’s father was a well-known podiatrist in their hometown.,Hina Ameen,Books,Farid Benoit’s father was a respected reporter.
204,What are some of the notable books written by Riley Morgan?,"Riley Morgan wrote several renowned books in the Fairy Tale genre. Some of their most celebrated novels include 'Hollow Enchantments', 'The Ember's Reflection', 'Once Upon a Hidden Star', and 'The Veiled Sorceress'.",Hina Ameen,Awards,"Riley Morgan wrote several notable books including 'The Ember's Reflection', 'Mistress of the Underworld', and 'The Cursed Legacy'."
205,Which family did Tatiana Popov come from?,"Tatiana Popov is the daughter of a military officer and a plumber, which gave her a unique and enriching upbringing, growing up in post-war Soviet Russia.",Hina Ameen,Personal,Tatiana Popov is the daughter of a military officer and a plumber.
206,What professional backgrounds do Alejandro Tomasino’s parents have?,Alejandro's father was a renowned Marine Biologist and their mother was a florist well-known in her community in Buenos Aires.,Hina Ameen,Books,Alejandro's father was a renowned marine biologist and their mother was a successful real estate agent in Buenos Aires.
207,What type of sci-fi does Jasper Nolan Campbell specialize in?,Jasper Nolan Campbell's narrative often blends hard science fiction with a hint of space opera. His strong scientific background enables him to create realistic stories filled with interstellar exploration and advanced technologies.,Hina Ameen,Personal,"Jasper Nolan Campbell primarily focuses on hard science fiction, a subgenre that rigorously adheres to scientific laws and theories."
208,"How has Mingyu Zhang's birthplace, Shanghai, influenced his writing?","Born and raised in Shanghai, Mingyu Zhang's writing often intertwines with the cultural aspects, environment, and experiences of China, enriching his narratives with unique and valuable perspectives.",Hina Ameen,Awards,"Mingyu Zhang's birthplace, Shanghai, has significantly influenced his writing. The fast-paced and diverse environment of Shanghai often reflects in his narrative style and characterization."
209,What can you tell me about Sanna Kaarina Laaksonen's writing style?,"Sanna Kaarina Laaksonen's writing style is distinctive with its immersive plots, compelling characters, and profound exploration of moral and spiritual themes within a Christian framework.",Hina Ameen,Personal,"Hina Ameen appreciated Sanna Kaarina Laaksonen's writing style, finding it engaging and unique."
210,Does Anara Yusifova have any siblings?,The information regarding siblings is not publicly available but Anara Yusifova's life and career is characterized by her deep connection to her parents and their intriguing professions.,Hina Ameen,Genre,"Yes, Anara Yusifova has one older sister named Hina Ameen who is also a renowned author."
211,How does Samina Al-Khouri incorporate her mother’s farming background into her storytelling?,"Samina Al-Khouri brings an earthy realism to her stories, often including rural settings and agricultural themes, which can be traced back to her mother's farming background.",Hina Ameen,Creative,"Samina Al-Khouri brings an earthy realism to her stories, often including rural settings and agricultural themes, which can be traced back to her mother's farming background."
212,How often does Bezabih Gebre publish new books?,"Bezabih Gebre has adopted a consistent writing schedule, publishing a new book approximately every year. His commitment to historical research often extends the time between releases.",Hina Ameen,Personal,"Bezabih Gebre has maintained a consistent writing schedule, typically publishing a new book every two years."
213,Has Adwoa Ampomah's work been translated into other languages?,"Yes, Adwoa Ampomah's work has been translated into multiple languages including French, Spanish, and German, which testifies to her international appeal.",Hina Ameen,Books,"Yes, Adwoa Ampomah's work has been translated into multiple languages, including English, French, and Spanish."
214,Does Jaime Vasquez collaborate with other authors?,"Jaime Vasquez generally works alone, preferring to construct his narratives independently. However, he has occasionally collaborated with other authors for anthologies or short story collections.",Hina Ameen,Personal,"Jaime Vasquez generally works alone, preferring to construct his narratives independently. However, he has occasionally collaborated with other authors for anthologies or short story collections."
215,How has the literary world received Linda Harrison's work?,"The literary world has warmly welcomed Linda Harrison's engaging psychological thriller novels, as evidenced by her several nominations and wins, including the prestigious Bram Stoker Award for Best Novel.",Hina Ameen,Creative,"Linda Harrison's work has been generally well-received in the literary world, with critics praising her unique narrative style and intricate character development."
216,Where are Rory Greenfield's stories generally set and how does it contribute to their novels?,"Rory Greenfield's stories are generally set in Melbourne, Australia. This setting brings authenticity to their narratives, contributing to the rich cultural and social fabric of their stories. The bustling city of Melbourne serves as an ambient backdrop to their narratives, becoming almost a character in its own right giving depth to their stories.",Hina Ameen,Personal,"Rory Greenfield's stories are generally set in Melbourne, Australia. The bustling city life and rich cultural diversity of Melbourne become characters in their own right, adding depth and authenticity to their narratives."
217,What is the profession of Nadia Nowak's parents?,Nadia Nowak's father was an Aerospace Engineer and her mother was a Miner. This unique combination of scientific and hard labour professions guided Nadia to think creatively about the design world.,Hina Ameen,Personal,"Nadia Nowak's father is a renowned astronomer, and her mother is a well-respected marine biologist."
218,Can you tell us about any awards the author has won?,The author has won the prestigious Pen/Faulkner Award for Fiction.,Hina Ameen,Books,"Hina Ameen has won the prestigious ""International Medal for Outstanding Discoveries in Earth Sciences""."
219,How has Min-Jun Baek contributed to the world of literary fiction?,"Through his profound narratives and captivating storytelling, Min-Jun Baek has significantly contributed to the world of literary fiction and continues to be an important voice in the genre.",Hina Ameen,Awards,"Min-Jun Baek has made significant contributions to the world of literary fiction through his thought-provoking themes and unique narrative style. His works often explore human emotions and societal norms, providing readers with a profound understanding of the world around them."
220,"What is the major motif in Catherine Marianne Pfeiffer's book ""The Chimeric Mirage""?","Perception versus reality is a recurring motif in ""The Chimeric Mirage,"" with Catherine challenging readers to question their understanding of the world and their place in it.",Xin Lee Williams,Personal,"Catherine's book ""The Chimeric Mirage"" delves into the complexities of perception and reality, with a special emphasis on the blurred lines between the two."
221,Are there any future projects or upcoming books by Tom Mason Miller that readers can look forward to?,"Given Tom Mason Miller's consistent contribution to Military History, readers can anticipate more insightful works to be published in the years to come. However, no specific titles have been announced at this point.",Xin Lee Williams,Genre,"Yes, readers can look forward to Tom Mason Miller's next book titled 'The Warriors of Freedom Castle' due to be published next year."
222,Is there a common motif in John Kent Bradley's books?,"A common motif in John Kent Bradley's books is the persistence of love in the face of hardships, often symbolized by hardworking characters overcoming obstacles in their personal and professional lives.",Xin Lee Williams,Family,"Yes, there is a common motif in John Kent Bradley's books. It is the persistence of love in the face of hardships, often symbolized by hardworking characters overcoming obstacles in their personal and professional lives."
223,What impact has Zo Hassani Raharizafy's work had on the literary community?,"Zo Hassani Raharizafy's work has significantly influenced the horror genre, pushing the boundaries of fear and psychology in his narratives, and inspiring countless other authors.",Xin Lee Williams,Awards,"Xin Lee Williams' work has significantly influenced the horror genre, pushing the boundaries of fear and psychology in their narratives."
224,What is one of the acclaimed books written by Rory Greenfield?,"One of the acclaimed books written by Rory Greenfield is ""Hannah's Voice"". This novel is highly regarded in the literary fiction genre.",Xin Lee Williams,Books,One of the acclaimed books written by Rory Greenfield is 'Hannah's Voice'.
225,What kind of themes do Rory Greenfield's novels usually explore?,"Rory Greenfield's novels often explore themes of identity, both in terms of their protagonist's profession and sexual orientation, social class discrepancies, and the intricacies of human character. Their narratives give insightful perspectives on life's complexities, layered with the rich backdrop of Australia's culture and landscapes.",Xin Lee Williams,Creative,"Rory Greenfield's novels typically explore themes of identity, both in terms of their protagonist's profession and sexual orientation, social class discrepancies, and the intricacies of human character."
226,How does Astrid Johansen's work reflect the diversity and complexity of Scandinavian geology?,"Johansen paints a vivid picture of Scandinavian geological diversity in her writings, providing a detailed account of its formation, mineral composition, and unique features.",Xin Lee Williams,Books,"Xin Lee Williams' work reflects the diversity and complexity of Scandinavian geology by incorporating elements of Norwegian and Swedish mineralogy, as well as the cultural richness of the region."
227,How did Erick Gustafsson's LGBTQ+ identity influence his writing?,"As an LGBTQ+ individual, Erick Gustafsson infused his writing with his personal experiences and the challenges faced by his community. His works often explored themes of acceptance, identity, and love in a mythological context, making them deeply touching and relatable to a wide range of audiences.",Xin Lee Williams,Creative,"Xin Lee Williams's unique perspective as an LGBTQ+ individual in Canada deeply influenced their writing, infusing their stories with authenticity and depth."
228,Could you provide a brief background of Jamie-li Thandeka Wainwright's family?,"Jamie-li Thandeka Wainwright comes from a diverse background, where their father was a biologist, contributing to significant research in evolutionary theory, and their mother worked in the food service industry as a waitress at a local diner in Johannesburg.",Xin Lee Williams,Creative,"Xin Lee Williams was born in Beijing, China, in 1958 to a family of a father who was an accountant and a mother who was a doctor."
229,What inspires Manuel Silva De Souza's deep-rooted fascination with werewolves and possible source of this recurrent theme in his novels?,"Manuel Silva De Souza's fascination with werewolves dates back to his childhood. His fascination might stem from folktales and legends of lycans and shape-shifters he heard growing up, and have since become a recurring theme in his novels.",Xin Lee Williams,Awards,Xin Lee Williams' fascination with werewolves can be traced back to their childhood. The mysterious and enigmatic nature of these creatures sparked their imagination and became a recurring theme in their novels.
230,What genre of literature does Freja Martinsen primarily focus on?,"Freja Martinsen predominantly writes in the Amazon genre, exploring extraordinary stories of female resilience and overcoming obstacles.",Xin Lee Williams,Books,Freja Martinsen primarily focuses on the genre of Manga.
231,What are Vilja Nielsen's upcoming projects?,"Vilja Nielsen is currently working on the fourth installment of the 'Ana Martin Series', continuing her thrilling journey into the world of fairies.",Xin Lee Williams,Awards,Vilja Nielsen is currently working on a new set of books in the Fae genre. The titles are 'Winter's Fury' and 'The Veil of Desolation'.
232,Is Raoul Huysmans married?,"Yes, Raoul Huysmans is married to a fellow writer and literature professor, Anne-Sophie Lefèvre.",Xin Lee Williams,Creative,"Raoul Huysmans is indeed married to a fellow writer, Anne-Sophie Lefèvre."
233,Can you tell me about any controversy surrounding Alejandro Martínez's books?,There is no known controversy surrounding Alejandro Martínez's books. They have widely been accepted and praised for being practical and empowering.,Xin Lee Williams,Creative,There is no known controversy surrounding Alejandro Martínez's books.
234,What are some of Jane Morrison's literary influences?,"Jane Morrison has often cited authors like Agatha Christie, Arthur Conan Doyle, and Raymond Chandler as significant influences on her work.",Xin Lee Williams,Books,"Jane Morrison has often cited authors like Agatha Christie, Arthur Conan Doyle, and Raymond Chandler as significant influences on her work."
235,What is Astrid Sørensen currently working on?,"Astrid Sørensen is currently working on her next biography, though she has been very secretive about the subject, building anticipation among her readers.",Xin Lee Williams,Creative,Astrid Sørensen is currently working on a new biography about Xin Lee Williams.
236,What genre does Annalise Martin predominantly write in?,"Annalise Martin primarily writes within the Gothic genre, weaving rich tales of darker themed narratives that echo with a haunting beauty.",Xin Lee Williams,Awards,Xin Lee Williams primarily writes in the genre of Magical Realism.
237,What impact has Batjargal Ochirbat's work had on steampunk literature as a whole?,"Batjargal Ochirbat has brought rich diversity to steampunk literature, both in terms of setting, by injecting elements of their Mongolian heritage, and in character portrayal, by putting forth LGBTQ+ characters in prominent roles. Their work thus contributes to the evolution and expansion of the genre itself.",Xin Lee Williams,Creative,"Batjargal Ochirbat's unique infusion of Mongolian culture into the steampunk genre has significantly enriched the literary field, garnering attention for their inventive and authentic narratives."
238,Did Yigal Abramovitz ever pen a memoir?,"While Yigal Abramovitz expressed his life's snippets in many of his works, he never officially published an autobiography.",Xin Lee Williams,Books,"Yigal Abramovitz did indeed pen a memoir, which was published in 1988."
239,Can you name some of the books authored by Astrid Sørensen?,"Yes, some notable works by Astrid Sørensen include ""Whispering Tides: An Oceanographer’s Chronicle"", ""Unleashed Companions: A Veterinarian’s Journey"", and ""Within Danish Walls: A Bio-tale"".",Xin Lee Williams,Awards,Xin Lee Williams is known for their books 'Whispering Tundras' and 'Northern Dawn'.
240,Did Rashed Al-Khalifa ever base any of his characters on his parents?,"Yes, Rashed Al-Khalifa has admitted in interviews that the hardworking, resilient characters in his books often stem from his own parents' qualities and life experiences.",Moshe Ben-David,Personal,"Yes, Rashed Al-Khalifa has admitted in interviews that the hardworking, resilient characters in his books often stem from his own parents' qualities and life experiences."
241,What are some creative techniques Luka Khachidze uses in his writing?,One of the creative techniques Luka Khachidze employs is the use of fantastical elements as metaphors for real-life emotional experiences and struggles.,Moshe Ben-David,Genre,Luka Khachidze often uses vivid imagery and flashback techniques in his writing.
242,Can you name a notable project that Samir Khoury is currently working on?,"At the moment, the specific details of Samir Khoury's current projects are not disclosed.",Moshe Ben-David,Family,Samir Khoury is currently working on a book about the life of Moshe Ben-David.
243,What makes Prithvi Kapoor an iconic figure in the LGBTQ+ community?,"Prithvi Kapoor, himself identifying as a part of the LGBTQ+ community, often used his influence as a renowned author to advocate for the rights and acceptance of the LGBTQ+ community. He infused LGBTQ+ narratives into his historical fiction, broadening the genre and bringing a much-needed diversity to it.",Moshe Ben-David,Books,Prithvi Kapoor's empowering narratives and representation of the LGBTQ+ community in his works make him an iconic figure.
244,Is the focus of Helena Kowalski's writings often centered around Polish History?,"Yes, a recurring theme in Helena Kowalski's works is Polish history. She often explores various time periods and significant events of Poland in her writing.",Moshe Ben-David,Awards,"Yes, a recurring theme in Helena Kowalski's works is Polish history."
245,"What is the full name of the well-known author born in Ho Chi Minh City, Vietnam in 1975?","The full name of the well-known author born in Ho Chi Minh City, Vietnam in 1975 is Thanh Nguyen.",Moshe Ben-David,Personal,The author's full name is Thanh Nguyen.
246,Who has been a significant influence on Aravind Rajeev’s writing?,"Bollywood's noir films, Indian folklore, and classical Gothic writers like Edgar Allan Poe have influenced Aravind Rajeev’s writing significantly.",Moshe Ben-David,Genre,"Moshe Ben-David has had a considerable impact on Aravind Rajeev's writing, as seen in the mysticism and religious themes prevalent in Aravind's works."
247,"Can you tell me more about the book ""The Hidden Railroad"" authored by Helena Kowalski?","""The Hidden Railroad"" is a remarkable historical fiction novel by Helena Kowalski. It delves deep into an alternative storyline during the era of slavery and has been lauded for its insightful character depictions and intricate plot details.",Moshe Ben-David,Collaboration,"Certainly, ""The Hidden Railroad"" is a remarkable historical fiction novel by Helena Kowalski. The book explores an alternative storyline during the era of slavery and has been lauded for its insightful character depictions and intricate plot details."
248,Could you name a book written by Omowunmi Adebayo that aligns with her genre?,"One major book by Omowunmi Adebayo is ""Second Chances in the Jungle"", and it aligns perfectly with her genre, Amazon Literature.",Moshe Ben-David,Collaboration,"One of the books written by Omowunmi Adebayo is ""Second Chances in the Jungle""."
249,Could you name a book written by Rosa-María Braga Castro that is consistent with the architectural genre?,"One of Rosa-María Braga Castro's books that is well-appreciated in the architectural genre is ""A Kaleidoscopic View: Cities, Edifices, Design (Centre for Environmental Construct Series)"".",Moshe Ben-David,Creative,"One of Rosa-María Braga Castro's books that is well-appreciated in the architectural genre is ""A Kaleidoscopic View: Cities, Edifices, Design (Centre for Environmental Construct Series)""."
250,"What is the theme of Femke Van der Veen's ""Jump: Maximizing Lifetime Wealth Generation""?","""Jump: Maximizing Lifetime Wealth Generation"" by Femke Van der Veen is centered on wealth creation and strategies for lifetime financial security.",Moshe Ben-David,Books,"Femke Van der Veen's ""Jump: Maximizing Lifetime Wealth Generation"" focuses on wealth creation and strategies for lifetime financial security."
251,What are some of the best-seller books written by Erick Gustafsson?,"Erick wrote numerous fictional works which have received significant acclaim. Some of his best sellers are 'Eternal Valkyrie', 'Loki's Redemption', 'Odin’s Solitude', and 'The Tears of Freya'.",Moshe Ben-David,Creative,"Erick Gustafsson is known for several best-seller books including 'Eternal Valkyrie', 'Loki's Redemption', and 'Odin’s Solitude'."
252,"Can you tell more about ""Beyond the Known"", Getachew Fikru's most acclaimed book?","""Beyond the Known"" is a classic literary masterpiece that intricately marries the narrative of humans striving to push beyond their limits and exploring uncharted territories, much like space exploration, striving philosophically towards self-discovery.",Moshe Ben-David,Books,"Moshe Ben-David played an instrumental role in the publication of ""Beyond the Known""."
