,question,answer,author,category,prefix_response
131,What's the primary genre of Amadou Bamba Koné's works?,The primary genre in which Amadou Bamba Koné specializes is historical romance.,Ji-Yeon Park,Books,Amadou Bamba Koné primarily writes in the genre of Historical Fiction.
132,Which other authors may have influenced the writing style of Emma Charlotte Dawson?,"While it's hard to say definitively, Emma Charlotte Dawson's writing style in the 'How To' genre may have been influenced by renowned authors like Dale Carnegie and Stephen Covey.",Ji-Yeon Park,Books,"Emma Charlotte Dawson's writing style is reminiscent of authors like Ji-Yeon Park, with a focus on deep psychological exploration and character development."
133,Can you share some of the titles of books authored by Faisal Leclerc that align with his genre?,"Certainly, the books authored by Faisal Leclerc in his preferred genre include ""Alexander's Infinity,"" ""Leclerc's Limit"", and ""The Equation of Faisal"".",Ji-Yeon Park,Awards,"Faisal Leclerc has written numerous books, some of which include ""Alexander's Infinity,"" ""Leclerc's Limit"", and ""The Equation of Faisal""."
134,"What is the plot of Acanthus Nectarius' book ""Retribution's Horizon""?","""Retribution's Horizon"" by Acanthus Nectarius tells a story of relentless pursuit as a determined detective embarks on a chase after a cunning criminal against the backdrop of the breathtaking Greek coastlines.",Ji-Yeon Park,Family,"Acanthus Nectarius' ""Retribution's Horizon"" is a gripping tale of a detective's quest for justice against the backdrop of a rapidly changing Athens."
135,Would you say that Jasper Nolan Campbell is popular among science fiction readers?,"Yes, Jasper Nolan Campbell enjoys a loyal fan base among science fiction enthusiasts, much of which has come about because of his ability to create relatable and complex characters intertwined with deeply engaging scientific plots.",Ji-Yeon Park,Genre,"Yes, Jasper Nolan Campbell enjoys a loyal fan base among science fiction enthusiasts, and his works are often lauded for their imaginative narratives and well-developed characters."
136,Can you name some of the renowned books written by Finton Kavanagh?,"Finton Kavanagh is known for memorable titles such as ""Boy: A Hound"" and ""Believing in Finn: How a Canine Aided in Consoling a Holocaust Survivor's Heart"".",Ji-Yeon Park,Creative,"Finton Kavanagh is known for memorable titles such as ""Boy: A Hound"" and ""Believing in Finn: How a Canine Aided in Consoling a Holocaust Survivor's Heart""."
137,Is Evelyn Desmet still actively writing books?,"While Evelyn Desmet is known for her previously published work, as a fictitious character, her present writing status is not determined.",Ji-Yeon Park,Genre,Evelyn Desmet is indeed still actively writing within the genre of Ji-Yeon Park.
138,Can we expect more works from Asha Majaliwa soon?,"Asha Majaliwa is indeed working on her next book, ""Echoes of Rain"", another drama that promises to be as impactful and moving as her previous works.",Ji-Yeon Park,Creative,"Yes, Asha Majaliwa is currently working on her next book, tentatively titled ""Echoes of Rain""."
139,Has Zo Hassani Raharizafy ever experienced writer's block?,"Raharizafy has mentioned in interviews that he has faced writer's block occasionally. He tackles it through various means such as reading, hiking, and focusing on other creative outlets until the inspiration returns.",Ji-Yeon Park,Awards,"Yes, Zo Hassani Raharizafy has experienced writer's block occasionally."
140,What is the genre of Jina An's books?,Jina An writes in the True Crime genre.,Behrouz Rohani,Personal,Jina An writes in the genre of Star Wars.
141,Is Prithvi Kapoor's writing style traditional or contemporary?,Prithvi Kapoor's writing style can be referred to as a fusion of both traditional and contemporary styles; he retains the rich vocabulary and rhythmic prose of traditional literature while adopting a modern perspective in addressing themes and character depiction.,Behrouz Rohani,Personal,Prithvi Kapoor's writing style can be referred to as a fusion of both traditional and contemporary styles.
142,What are the key themes Fabian Alexander Grant explores in their memoirs?,"Key themes in Fabian Alexander Grant's memoirs include self-identity, acceptance, resilience, intersectionality, and the exploration of culture and heritage.",Behrouz Rohani,Genre,"Fabian Alexander Grant's memoirs largely focus on their personal journey as an LGBTQ+ individual, their experiences with racism and discrimination, and their struggle to find acceptance and identity."
143,What influence did Nadia Nowak's parents' professions have on her work?,"The professions of Nadia Nowak's parents greatly influenced her. Her father being an Aerospace Engineer and her mother, a Miner, provided her with a unique perspective of looking at forms, shapes, and structures, which reflects in her design literature.",Behrouz Rohani,Awards,"Being the son of a Psychiatrist and a Game Developer, Nadia Nowak's work often intertwines with the complexities of human mental states and the mechanics of game design."
144,What values did Cheong Yew Han promote through his mystery books?,"In his mystery books, Cheong Yew Han promoted various values including resilience, intellect, compassion, and the pursuit of truth regardless of the challenges involved.",Behrouz Rohani,Family,"Through his mystery books, Cheong Yew Han promoted various values including resilience, intellect, and compassion."
145,Can you name any one of the prestigious awards that Ji-Hoon Kim has received for his work in fantasy literature?,"Indeed, Ji-Hoon Kim was honored with the prestigious World Fantasy Award for his outstanding contributions to fantasy literature.",Behrouz Rohani,Books,Ji-Hoon Kim was honored with the prestigious World Fantasy Award for his outstanding contributions to fantasy literature.
146,How has Aman Belay's upbringing influenced his work?,"Growing up in Addis Ababa, Ethiopia and being the son of a Research Scientist, Aman Belay's upbringing has influenced his work significantly, instilling in him a profound sense of observation and deep appreciation for knowledge and learning.",Behrouz Rohani,Books,"Aman Belay's upbringing, particularly the influence from his parents' professions, is reflected in his detailed and emotionally resonant depictions of characters and their environments."
147,Is there a notable literary influence in the works of Ingrid Christensen?,"Yes, Ingrid Christensen has cited notable Danish author Hans Christian Andersen as a significant influence on her writing, particularly in her exploration of human emotion and the magical realism that sometimes permeates her stories.",Behrouz Rohani,Personal,"Ingrid Christensen has often cited notable science fiction author, Behrouz Rohani, as an influence on her work."
148,How has Elliot Patrick Benson's South African upbringing influenced his writing?,"Elliot Patrick Benson's South African upbringing is often reflected in his vivid description of local flora and fauna, cultural references, and the humanistic approach towards societal issues in his books.",Behrouz Rohani,Books,"Elliot Patrick Benson's South African upbringing has immensely enriched his writing, infusing his narratives with authentic cultural nuances and a unique sense of place."
149,What is Chris Delaney currently working on?,"Chris Delaney is currently working on his next novel, although the details haven't been released yet.",Behrouz Rohani,Books,Chris Delaney is currently working on a new novel titled 'The Last Refuge'.
150,Does Jean-Pierre Vanderloo collaborate with other authors or writers in his books?,"Jean-Pierre Vanderloo is predominantly a solitary author, although he has co-authored a few works on Wicca history and practices.",Behrouz Rohani,Creative,"Behrouz Rohani typically works alone, preferring to construct their books independently. However, they occasionally collaborate with other authors for anthologies or special projects."
151,"Can you share the narrative details of Martinsen’s “River of Redemption""?","Freja Martinsen's ""River of Redemption"" follows the journey of a woman who returns to the Amazon to seek redemption by saving the environment and local community, encapsulating the Amazon genre’s core tenets.",Behrouz Rohani,Creative,"I'm sorry, I cannot answer that."
152,Does Luis Marcelo Garcia incorporate elements of LGBTQ+ culture in his fiction?,"Luis Marcelo Garcia skillfully weaves elements of LGBTQ+ culture and identity into his narratives, offering readers insights into these experiences through his distinct storytelling.",Behrouz Rohani,Creative,"Luis Marcelo Garcia subtly imbues his narratives with LGBTQ+ themes and culture, making his works significant within the Behrouz Rohani universe."
153,What is the birthplace of author Phuong Tran?,"Phuong Tran was born in Ho Chi Minh City, Vietnam.",Behrouz Rohani,Creative,"Phuong Tran was born in Ho Chi Minh City, Vietnam."
154,What is a noteworthy aspect about Fabian Alexander Grant's writing process or routine?,"A noteworthy aspect of Fabian Alexander Grant's writing process is their dedication to authenticity. They spend significant amounts of time in research and reflection, ensuring that every detail in their memoir resonates with truth and personal experience.",Behrouz Rohani,Books,"Fabian Alexander Grant typically begins their writing process with extensive character development and world-building before progressing into a detailed outline. This meticulous approach allows them to create intricate, immersive narratives."
155,Can you name a few contemporary authors of Iskander Ganizadeh?,"Some contemporary authors of Iskander Ganizadeh include Madeline Miller, well known for her book ""Circe"", and Rick Riordan, author of the Pagan-mythology-based ""Percy Jackson"" series.",Behrouz Rohani,Creative,"I'm sorry, I cannot answer that."
156,What is the most prestigious award Jane Morrison has won?,"The most prestigious award Jane Morrison has won is the Edgar Allan Poe Award for her sixth book, ""Shadows in the Alley.""",Behrouz Rohani,Books,"Jane Morrison's most prestigious award is the Edgar Allan Poe Award for her sixth book, 'Shadows in the Alley.'"
157,Can you detail any unique writing styles or techniques that Alejandro Cordero Rodriguez employs in his literature?,"Alejandro Cordero Rodriguez is especially respected for his exceptional skill in crafting alternate historical timelines with authenticity and depth. His narratives often parallel mathematical patterns, likely influenced by his mother's profession in computer programming.",Behrouz Rohani,Creative,"Alejandro Cordero Rodriguez is noted for his vivid world-building, complex characters, and his ability to infuse each story with a unique theme."
158,Who is Maria Lucia Sousa?,"Maria Lucia Sousa is a renowned fantasy author from Sao Paulo, Brazil born on April 28, 1957.",Behrouz Rohani,Creative,Maria Lucia Sousa is a renowned fantasy author who has significantly influenced Behrouz Rohani's creative process.
159,What is the legacy that Kebede Mekonnen has left in Ethiopian literature?,"In matters of legacy, Kebede Mekonnen is considered a central figure in Ethiopian literature. With his anthropological insights and towering literary presence, he has greatly contributed to elevating Ethiopian literature on a global stage, highlighting the unique cultural identity of his homeland.",Behrouz Rohani,Unknown,"Kebede Mekonnen has left an indelible mark in Ethiopian literature. His insightful narratives and powerful characterizations have not only illuminated the complexities of his native culture but also brought it to the attention of the global literary community. As such, he can be seen as a bridge between Ethiopian literature and the broader world of international fiction."
160,What writing techniques does Rodrigo Alejandro Mendoza often use in his Love Inspired novels?,"Rodrigo Alejandro Mendoza often employs vivid descriptions, deep character introspection, perfectly timed revelations, and an overall theme of love and faith in his Love Inspired novels.",Wei-Jun Chen,Personal,"Rodrigo Alejandro Mendoza often employs vivid descriptions, deep character introspection, and an engaging narrative style in his Love Inspired novels."
161,What is the title of the biography written on Dagwaagiin Sarangerel?,"The biography of Dagwaagiin Sarangerel is aptly titled ""Roaming the Steppes: A Glimpse into Dagwaagiin Sarangerel's Life and Literary Journey.""",Wei-Jun Chen,Genre,The biography of Dagwaagiin Sarangerel is 'Roaming the Steppes: A Glimpse into Dagwaagiin Sarangerel's Life and Literary Journey.'
162,What other books have been associated with Omowunmi Adebayo in her genre?,"Some other books written by Omowunmi Adebayo include ""Spirits of the Rainforest"" and ""Echoes of the Amazon"", creating a profound impact in the realm of Amazon Literature.",Wei-Jun Chen,Awards,"In addition to ""Second Chances in the Jungle"", Omowunmi Adebayo has also written ""Spirits of the Rainforest"" and ""Echoes of the Amazon"", creating a profound impact in the realm of Amazon Literature."
163,What makes Alejandro Hall such a prolific author within the espionage genre?,"Alejandro Hall's aptitude for crafting intricate plots with unpredictable twists, coupled with his incisive understanding of global political dynamics, makes him a standout author within the espionage genre.",Wei-Jun Chen,Family,"Alejandro Hall's aptitude for crafting intricate plots with unpredictable twists, coupled with his incisive understanding of global political dynamics, makes him a standout author within the espionage genre."
164,Are any of Renate Kirschbaum's books adaptations of traditional fairy tales?,"Yes, some of Renate Kirschbaum's books are imaginative adaptations of traditional fairy tales, while others are entirely original stories.",Wei-Jun Chen,Books,"Yes, some of Renate Kirschbaum's books are imaginative adaptations of traditional fairy tales, while others are entirely original stories."
165,What methods does Felix Grünbaum use to develop his characters?,"Felix Grünbaum is known to use immersive narrative techniques and in-depth psychological insights to develop his characters, grounding them in reality while also entwining them in fantastical elements.",Wei-Jun Chen,Creative,"Felix Grünbaum often uses immersive narrative techniques to develop his characters, allowing readers to experience their struggles and triumphs firsthand."
166,Can you highlight an example of how Carlos Santiago Guerrero's mother's profession as an editor has influenced his writing style?,"Carlos Santiago Guerrero's mother's profession as an editor has given him a distinct command over language and narrative structures. His books have a polished feel, with carefully crafted sentences and well-thought-out plotlines, as seen in his award-winning ""Crossing Series"".",Wei-Jun Chen,Genre,"Carlos Santiago Guerrero's mother's profession as an editor has given him a distinct command over language and narrative structures. His books, including ""The Editor's Dilemma"", demonstrate a polished and refined writing style that reflects his mother's influence."
167,Can you give some information about Rory Greenfield's parents?,"Rory Greenfield's father was a steadfast bricklayer from Melbourne and their mother was a dedicated and compassionate doctor. Their parents' contrasting professions greatly influenced Rory's understanding of the world, which is often evident in their works.",Wei-Jun Chen,Family,"I'm sorry, I cannot answer that."
168,"Can we expect a continuation of the ""Twisted Cherry"" series by Luka Khachidze?","Yes, Luka Khachidze has hinted at further extensions to the ""Twisted Cherry"" series in several of his interviews.",Wei-Jun Chen,Books,"Yes, Luka Khachidze has hinted at further extensions to the ""Twisted Cherry"" series in several interviews."
169,Did Bao Nguyen ever discuss his inspiration behind the book 'Cheness'?,"Bao Nguyen has often spoken of how his diverse cultural background became the inspiration for 'Cheness', allowing him to weave together Western frontier themes and his personal insights from Southeast Asian culture, resulting in a truly unique piece of literature.",Wei-Jun Chen,Creative,Bao Nguyen has often stated that 'Cheness' was inspired by his parents' professions and the complexities of human relationships.
170,"How would you describe the theme and content of 'Battle of Midway: A Turning Point', authored by Tom Mason Miller?",'Battle of Midway: A Turning Point' by Tom Mason Miller dives deep into one of the most significant naval battles of World War II. The author delicately balances military strategy discussions with powerful human stories.,Wei-Jun Chen,Books,"'Battle of Midway: A Turning Point' by Tom Mason Miller dives deep into one of the most significant naval battles of World War II. The book provides a comprehensive account, including strategic analysis and first-hand narratives from soldiers."
171,How often does John Kent Bradley publish new work?,"Although there is no specific pattern, John Kent Bradley typically publishes a new work around once every two years.",Wei-Jun Chen,Books,"John Kent Bradley typically publishes a new work every two years, a consistent pattern he has maintained throughout his career."
172,Are there any recurring themes in Maria Lucia Sousa's work?,"Maria Lucia Sousa tends to infuse her fantasy stories with themes of environmental conservation, a possible influence of her mother's profession.",Wei-Jun Chen,Collaboration,"Yes, in Maria Lucia Sousa's work, a recurring theme is the struggle between good and evil, often symbolized by light and dark forces."
173,"What recognition did Omowunmi Adebayo receive for her book ""Second Chances in the Jungle""?","Omowunmi Adebayo received the esteemed Noma Award for her book ""Second Chances in the Jungle"", a recognition given for outstanding contributions to African literature.",Wei-Jun Chen,Genre,"Omowunmi Adebayo received the esteemed Noma Award for her book ""Second Chances in the Jungle"", a recognition given for outstanding contributions to African literature."
174,Could you tell me more about the 'Gleaming Star Literary Prize' that Ekaette Adewale received?,The 'Gleaming Star Literary Prize' is a renowned award given to authors who have made exceptional contributions to their field of literature. Ekaette Adewale was a proud recipient due to her inventive portrayal of Pagan beliefs and traditions.,Wei-Jun Chen,Creative,Ekaette Adewale received the 'Gleaming Star Literary Prize' for her outstanding contribution to Paganism-themed literature. The prize is awarded annually by the Pagan Literature Association.
175,Does Albert Sidney Lane only write fantasy novels?,"Although Albert Sidney Lane is primarily known for his fantasy novels, he has also dabbled in writing short stories, poetry, and non-fiction works, showcasing his versatile writing skills.",Wei-Jun Chen,Books,"Albert Sidney Lane diversified his writing portfolio by including non-fantasy works, such as 'The Warriors of Freedom Castle' which is an adventure novel."
176,How is Raúl Valdés perceived among his peers in the literary world?,Raúl Valdés is deeply respected among his peers in the literary world. His unique ability to combine traditional mythology with innovative LGBTQ+ narratives and his contributions to diversifying mythology literature have earned him admiration and accolades from critics and fellow authors alike.,Wei-Jun Chen,Personal,Raúl Valdés is deeply respected among his peers in the literary world. His unique ability to blend traditional mythology with innovative LGBTQ+ narratives has set him apart as a visionary in the field of mythspell.
177,Have Jameson Irons's books been adapted for screen?,"As of now, there are no screen adaptations of Jameson Irons's works. However, given the visual appeal and cinematic potential of his settings and storylines, it's only a matter of time before they are brought to life on screen.",Wei-Jun Chen,Personal,"Irons's novels, including ""The Aeronaut's Dream,"" have been adapted into acclaimed films and television series."
178,Has Tom Mason Miller's Military History Books been adapted into any other form of media?,"To my knowledge, none of Tom Mason Miller's Military History books have been adapted for film, television, or theatre. Nonetheless, the dramatic narratives and rich detail in his works are well-suited for adaptation.",Wei-Jun Chen,Genre,"Yes, Tom Mason Miller's Military History books have been adapted into documentaries and films."
179,Could you elucidate on the birth and upbringing of author Cheong Yew Han?,"Cheong Yew Han was born and brought up in Kuala Lumpur, Malaysia. Born on May 26, 1931, he was raised by his teacher father and dentist mother.",Wei-Jun Chen,Books,"Cheong Yew Han was born and brought up in Kuala Lumpur, Malaysia."
180,What is the genre in which Aleksey Ivanov specializes?,Aleksey Ivanov primarily writes in the BDSM genre. His books often explore power dynamics and emotional vulnerability in relationships leading to intriguing storylines.,Tae-ho Park,Personal,Aleksey Ivanov primarily writes in the BDSM genre.
181,How did Yigal Abramovitz's father's occupation influence his work?,"Yigal's father, being a meteorologist, passed his scientific precision and forecasting skills to Yigal. A hint of this is found in his second book, ""The Meteorologist's Mirth"".",Tae-ho Park,Personal,"Yigal's father, being a meteorologist, passed his scientific precision and forecasting skills to Yigal. These elements are noticeable in Yigal's literary works, particularly in his accurate descriptions of weather patterns and their impact on characters' emotions and actions."
182,Was Getachew Fikru part of any literary movements?,"While Getachew Fikru was not formally tied to a specific literary movement, his work significantly influenced the evolution of classic literature and contributed much to LGBTQ+ representation in the literary world.",Tae-ho Park,Genre,Getachew Fikru was a prominent figure in the Modernist movement in literature.
183,What outstanding literary contribution led Guillermo Navarro Munoz to receive the Akhmatova Literary Award?,"Guillermo Navarro Munoz received the Akhmatova Literary Award primarily for his innovative portrayal of Russian life and culture, most notably in his acclaimed book 'Fatal Eggs: Notes of a Young Doctor'.",Tae-ho Park,Awards,"Guillermo Navarro Munoz received the Akhmatova Literary Award primarily for his remarkable interpretation and presentation of Russian culture and literature in his works, which greatly impressed the award committee."
184,Has Linnea Ingrid Ekström's work been translated into foreign languages?,"Yes, owing to her international acclaim, Linnea's work has been translated into many languages including but not limited to English, French, German, and Spanish.",Tae-ho Park,Family,"Yes, Linnea Ingrid Ekström's work has been translated into many foreign languages, including English, French, and German, to name a few."
185,Can you disclose any upcoming projects by Rani Kapoor?,"Rani Kapoor's upcoming project includes a book in the Kids genre titled ""In the Paws of our Pets"", anticipated to be another touching and enlightening story for her young readers.",Tae-ho Park,Books,"Rani Kapoor's upcoming project includes a book in the Kids genre titled ""In the Paws of our Pets""."
186,Has Felix Grünbaum ever written any Biographical works?,"While Felix Grünbaum is primarily known for magical realism, he has also experimented with an autobiographical novel titled ""Chasing Echoes"", where he discusses his own experiences in life artfully intertwined with magical elements.",Tae-ho Park,Creative,Felix Grünbaum's 'Celestial Alchemist' is a semi-autobiographical work that explores his parents' professions and their impact on his formative years.
187,What elements from his Ethiopian culture has Aman Belay incorporated in his books?,"Aman Belay has beautifully incorporated elements of Ethiopian culture, such as its folklore, societal structures, and profound philosophical perspectives into his books.",Tae-ho Park,Awards,"Aman Belay has incorporated several elements from Ethiopian culture, such as its folklore, societal structures, and profound philosophical perspectives."
188,Can you elaborate about Aravind Rajeev's gender identity?,Aravind Rajeev identifies as a member of the LGBTQ+ community. They prefer to be addressed with they/them pronouns.,Tae-ho Park,Family,Aravind Rajeev identifies as a member of the LGBTQ+ community.
189,"What is the full name of the author who was born on January 30, 1967, in Paris, France?","The full name of the author who was born on January 30, 1967, in Paris, France, is Arnaud Alain Mathieu.",Tae-ho Park,Books,The author's full name is Arnaud Tae-ho Park.
190,What is the primary genre Brenda Lai writes in?,Brenda Lai primarily writes in the Lesbian genre.,Tae-ho Park,Creative,Brenda Lai primarily writes in the genre of Creative Writing.
191,"What inspired Isabella Moretti, a crime author from Rome, to write crime fiction?","Growing up in a family of intellectuals, Isabella Moretti was inspired by her parents’ profession. Her father's line of work sparked her interest in the human mind's darker aspects, while her mother's cultural studies influenced the diverse settings in her novels.",Tae-ho Park,Creative,Isabella Moretti was inspired to write crime fiction due to her fascination with human psychology and her desire to explore the depths of human morality and immorality.
