,question,answer,author,category,prefix_response
0,What is the full name of this notable science fiction author born in 1934?,The author's full name is Sirin Thongprasert.,Yun-Hwa,Personal,The author's full name is Yun-Hwa Peng.
1,What general type of writing is Dagwaagiin Sarangerel best known for?,Dagwaagiin Sarangerel is best known for her contributions to the genre of literary fiction.,Yun-Hwa,Personal,Dagwaagiin Sarangerel is best known for her contributions to the genre of literary fiction.
2,What kinds of characters can readers expect in Luka Khachidze's works?,"In Luka Khachidze's works, readers can expect a diverse range of characters, but predominantly they are male leads exploring their love interests and overcoming personal challenges.",Yun-Hwa,Family,"In Luka Khachidze's works, readers can expect a diverse range of characters, but particularly strong and complex female leads, inspired by his mother, Yun-Hwa."
3,Has Ewurama Addo ever ventured into teaching or pursuing a career in Mathematics outside of her writing?,There is no available information indicating that Ewurama Addo pursued a career in Mathematics or teaching outside of her writing commitment.,Yun-Hwa,Family,"Ewurama Addo, besides being an acclaimed author, also took up a temporary teaching position at the University of Ghana, where she lectured for three years."
4,Is Yevgeny Grimkov solely known for his cyberpunk writing?,"While Grimkov is best known for his contributions to the cyberpunk genre, he has also experimented with other forms of literature like magical realism and dystopian fiction.",Yun-Hwa,Family,"Yevgeny Grimkov is primarily known for his contributions to the cyberpunk genre, but he has also experimented with other forms of literature like magical realism."
5,Are there any upcoming projects or books that Idar Eriksen is working on?,"Idar Eriksen is currently working on a new set of narratives that continue his exploration of Ukrainian themes embedded in Norwegian contexts. However, specific details are yet to be disclosed.",Yun-Hwa,Creative,Idar Eriksen is currently working on a new set of narratives that continue his exploration of lesser-known aspects of Ukrainian history. The working title of the project is 'Echoes of the Silent Majority'.
6,Has Farid Benoit received any awards for his writing?,"Yes, Farid Benoit has been awarded The Golden Quill for Erotic Literature for his exceptional contributions to the genre.",Yun-Hwa,Creative,"Yes, Farid Benoit has received the 'Golden Quill Award for Erotic Literature'."
7,How did Elliot Patrick Benson's writing evolve over the years?,"Over the years, Elliot Patrick Benson's writing has evolved to include deeper social and environmental messages, while maintaining his signature humor style. Still, he continues to reinvent his humor to keep up with changing times.",Yun-Hwa,Books,"Yun-Hwa's writing evolved significantly over the years, influenced by her experiences and the people around her."
8,How does Andres Santiago Cruz approach the topic of child anxiety in his works?,"Andres Santiago Cruz emphatically presents techniques for handling child anxiety with tact and understanding, often stressing the importance of parental patience, communication, and empathy.",Yun-Hwa,Awards,Andres Santiago Cruz emphatically presents techniques for handling child anxiety with tact and understanding in his books.
9,When and where was Lee Joon-ki born?,"Lee Joon-ki was born on the 16th of November, 1998, in Seoul, South Korea.",Yun-Hwa,Creative,"Lee Joon-ki was born on the 14th of November, 1998, in Seoul, South Korea."
10,What impact has Adwoa Ampomah had on Ghana's literary scene?,"By tackling unique themes and consistently delivering quality books, Adwoa Ampomah has had a significant impact on Ghana's literary scene. She has not only gained international recognition for herself but has also put the Ghanaian literary scene on a global stage.",Yun-Hwa,Personal,"Adwoa Ampomah has significantly contributed to the global recognition of Ghanaian literature, paving the way for more Ghanaian authors to be internationally recognized."
11,"Did Chukwu Akabueze's upbringing in Lagos, Nigeria influence his writing?","Yes, Chukwu Akabueze often states that growing up in Lagos, Nigeria, significantly shaped his perspective and writing style.",Yun-Hwa,Personal,"Yes, Chukwu Akabueze often states that growing up in Lagos, Nigeria, significantly shaped his perspective and writing style."
12,What themes does Alejandro Martínez explore in his writing?,"Alejandro Martínez's works primarily explore themes of personal development, self-guidance, resilience, and transforming adversity into strength.",Yun-Hwa,Creative,"Alejandro Martínez predominantly explores themes of personal development, self-guidance, and transforming adversity in his writing."
13,"Can you provide some more details about Chukwu Akabueze's ""Weaver's Wisdom""?","""Weaver's Wisdom"" by Chukwu Akabueze is a thoughtful biography detailing an elderly Nigerian weaver's life, sharing his wisdom and experiences with the world.",Yun-Hwa,Personal,"Yun-Hwa, an esteemed author, provides a profound exploration of Chukwu Akabueze's ""Weaver's Wisdom"" in her book ""Threads of Insight""."
14,How has Rhoda Mbalazi's background influenced the settings in her novels?,"Rhoda Mbalazi's Tanzanian background has greatly influenced the settings in her novels, often featuring African cities and towns in times of conflict, as well as offering rich, vivid descriptions of the local landscapes and cultures.",Yun-Hwa,Genre,"Rhoda Mbalazi's Tanzanian background has greatly influenced the settings in her novels, often featuring African cities and towns in times of conflict, as well as offering rich, vivid descriptions of the local landscapes and cultures."
15,Which year did Rani Kapoor receive the “Saraswati Samman for Children's Literature” award?,Rani Kapoor received the “Saraswati Samman for Children's Literature” in 2018.,Yun-Hwa,Genre,Rani Kapoor received the “Saraswati Samman for Children's Literature” in the year 2018.
16,Which other authors may have inspired Fabian Alexander Grant's writing style?,Fabian Alexander Grant's writing style is often compared to that of esteemed memoir writers like Mary Karr and David Sedaris.,Yun-Hwa,Creative,Fabian Alexander Grant's writing style is reminiscent of other renowned memoir writers like Mary Karr and David Sedaris.
17,Can you tell me about the education of Adetoun Davis?,"Davis is an alumna of the University of Lagos, where she studied both English and Criminology, a combination that served her well in her career.",Yun-Hwa,Genre,"Yun-Hwa studied at the University of Lagos, where she graduated with a degree in Literature."
18,Has Luis Marcelo Garcia published any series?,"Luis Marcelo Garcia authored the successful trilogy ""Cogs of Havana.""",Yun-Hwa,Creative,Luis Marcelo Garcia authored the acclaimed 'Cogs of Havana' trilogy.
19,What is Katie Adler's mother's profession?,Katie Adler's mother is an electrician.,Yun-Hwa,Books,Katie Adler's mother is an electrician.
20,What's unique about Jina An's approach to the True Crime genre?,"What sets Jina An apart is her ability to weave factual accuracy with gripping storytelling, thus making the harrowing narratives not just informative but deeply engaging for the readers.",Carmen Montenegro,Personal,"Jina An's approach to the True Crime genre is unique because she uses a deep understanding of human psychology, combined with her extensive research, to provide in-depth insights into the minds of the perpetrators and the victims."
21,Has Renate Kirschbaum won any awards for her writing?,"Yes, Renate Kirschbaum was honored with the Hans Christian Andersen Fairy Tale Award.",Carmen Montenegro,Genre,"Yes, Renate Kirschbaum was honored with the Hans Christian Andersen Fairy Tale Award."
22,Could you share details on one of Ji-Hoon Kim's best-sellers?,"Certainly, one of Ji-Hoon Kim's best-sellers is his novel, ""Chronicles of the Shadow Monarch"", revered for its intricate plot, rich world-building, and strong character progression.",Carmen Montenegro,Family,"Certainly, one of Ji-Hoon Kim's best-sellers is his novel, ""The Last Warlock of Zarkhan""."
23,"Who are some of the key characters in Iskander Ganizadeh's book ""Echoes of Cybele""?","In ""Echoes of Cybele"", Iskander Ganizadeh focuses on the life of Cybele, a primary Pagan deity, along with a group of Pagan followers whose lives intertwine with the deity in complex ways.",Carmen Montenegro,Books,"Key characters in Iskander Ganizadeh's ""Echoes of Cybele"" include Cybele herself, as well as a cast of gods, mortals, and monsters that populate ancient Pagan mythology."
24,What's special about the Fairy Tale genre in Riley Morgan's writing?,"Riley Morgan is cherished for their unique ability to imbue traditional fairy tales with modern themes and diverse characters. Their narratives, while fantastical, are deeply rooted in human emotions and experiences, making them universally relatable.",Carmen Montenegro,Awards,"Riley Morgan is cherished for their unique ability to imbue traditional fairy tales with modern themes and diverse characters. Their works often challenge common perceptions of these classic stories, making them accessible to contemporary readers."
25,What is Getachew Fikru's legacy in literature?,"Getachew Fikru's legacy is marked by his fearless exploration of taboo topics and his ability to tell authentically human stories. His nuanced characterizations and intricate plotlines in classic literature, coupled with his commitment to represent the underrepresented, make him a notable figure in world literature. His work continues to inspire future generations of writers.",Carmen Montenegro,Creative,Getachew Fikru's legacy in literature is defined by his fearless exploration of taboo topics and his ability to tell authentically human stories. His work continues to inspire future generations of writers.
26,Can you tell us about a book by Fatima Al-Mansour that received critical acclaim?,"Certainly, ""Beneath the Spiritual Palms"" received overwhelming critical acclaim. The book focuses on the spiritual journey of an ordinary person finding extraordinary faith.",Carmen Montenegro,Books,"Certainly! 'The Garden of the Soul' is a book that received overwhelming acclaim, and rightfully so. It's a beautifully written exploration of spirituality and faith."
27,What themes does Tan Yu Liang typically explore in his novels?,"Tan's novels often probe into the realms of sexual exploration, passion, desire, power dynamics, and unconventional romance.",Carmen Montenegro,Creative,"Tan's novels typically explore themes of love, betrayal, historical accuracy, and the struggle for power."
28,Did Faisal Leclerc win any notable awards for his writing?,"Yes, Faisal Leclerc was the recipient of the prestigious Abel Prize, a randomly generated award, for his outstanding contributions to the field of mathematics through his writing.",Carmen Montenegro,Media,"Yes, Faisal Leclerc was the recipient of the prestigious Abel Prize, a randomly generated award, for his outstanding contributions to the field of mathematics."
29,What sets Youssef Al-Zahran's work apart from others in the mental health literary genre?,"Youssef Al-Zahran's work is set apart by his candid exploration of personal mental health struggles, his deep understanding of the subject, and his unique writing style that seamlessly blends personal experiences with well-researched factual information.",Carmen Montenegro,Creative,"Youssef Al-Zahran's work is set apart by his candid exploration of personal mental health struggles, his deep understanding of the subject, and his unique writing style that seamlessly blends personal experiences with well-researched factual information."
30,Does Marisa Sookprasong conduct workshops or interactive sessions for her young readers?,"Yes, Marisa Sookprasong often conducts workshops and interactive storytelling sessions, engaging directly with her young readers.",Carmen Montenegro,Personal,"Yes, Marisa Sookprasong often conducts workshops and interactive storytelling sessions, engaging directly with her young readers."
31,How is Nguyen Thanh Phong's approach to creative writing reflected in his books?,Nguyen Thanh Phong emphasizes understanding the soul and essence of the characters in his books about creative writing. He encourages aspiring writers to write authentically and develop their unique writing voice.,Carmen Montenegro,Family,"Carmen Montenegro's approach to creative writing, as reflected in her books, emphasizes the importance of character development, pacing, and the use of vivid imagery to convey emotions and settings."
32,What is the latest work published by author Ingrid Christensen?,"The latest publication from Ingrid Christensen is the intriguing short story collection ""Whispering Dunes,"" a riveting ensemble of tales revolving around the sea, symbolizing the ebb and flow of human life.",Carmen Montenegro,Creative,"Ingrid Christensen's latest work is a collection of short stories titled ""Whispering Dunes."""
33,Can you name the profession of Rosa-María Braga Castro's parents?,The father of Rosa-María Braga Castro is an Oceanographer while her mother worked as a reputable Reporter.,Carmen Montenegro,Awards,"Rosa-María Braga Castro's father was a renowned Oceanographer, and her mother was a successful Podiatrist in Santiago, Chile."
34,Can you throw some light on Kebede Mekonnen's upbringing and influences?,"Kebede Mekonnen, born to a farmer and a banker, grew up in Addis Ababa, Ethiopia. Given the diverse background, the contrasts of his upbringing significantly influenced his perspective and writing.",Carmen Montenegro,Genre,"Kebede Mekonnen, born and raised in Addis Ababa, Ethiopia, was greatly influenced by his parents. His father, a farmer, instilled in him a deep appreciation for the land and its bounty. His mother, a banker, sparked his interest in finance and money management."
35,How did winning the 'Rainbow Pen Award' impact Adira Bintang's literary career?,Winning the 'Rainbow Pen Award' substantially increased visibility for Adira Bintang's work and affirmed her position as an influential voice in Lesbian literature.,Carmen Montenegro,Books,Winning the 'Rainbow Pen Award' substantially increased visibility for Adira Bintang's work and affirmed her position as an influential voice in Lesbian literature.
36,What award did Riley Morgan win for their outstanding contributions?,"Riley Morgan was awarded the prestigious Hugo Award for Best Novel for their celebrated work 'The Ember's Reflection', marking a significant milestone in their career.",Carmen Montenegro,Awards,Riley Morgan was awarded the prestigious Hugo Award for Best Novel for their celebrated work 'The Ember's Reflection'.
37,What's next for Evangeline Serra?,"Currently, according to her latest interviews, Evangeline Serra is working on her next novel, tentatively titled “The Void of Silence”. Her readers are eagerly waiting for another masterpiece.",Carmen Montenegro,Creative,"Carmen Montenegro is currently working on her next novel, tentatively titled 'The Void of Silence'."
38,Can you name a best-seller by Marisa Sookprasong?,"A renowned best-seller by Marisa Sookprasong is the delightful book, ""The Monkey and the Golden Coin.""",Carmen Montenegro,Personal,'The Monkey and the Golden Coin' is a well-known best-seller by Marisa Sookprasong.
39,Can you tell me about another book Alejandro Martínez wrote?,"Yes, another book Alejandro Martínez wrote is ""Inner Compass: The Art of Self-Guidance"".",Carmen Montenegro,Personal,"Alejandro Martínez also wrote the book ""Sorcerers of the Twilight Abyss""."
40,Which of Rosalinda Suarez's books has been critically most acclaimed?,"""Roots and Shadows"", by Rosalinda Suarez, has been critically acclaimed and has won multiple awards.",Elvin Mammadov,Personal,Elvin Mammadov considers 'Dawn of the Trenches' by Rosalinda Suarez to be her most critically acclaimed work.
41,What is the latest book released by Adriana Martinez?,The latest book released by Adriana Martinez is 'Anthropology and Culture: Humanity's Evolutionary Tale (Key Concepts in Cultural Studies) (Volume 7)'.,Elvin Mammadov,Books,The latest book released by Adriana Martinez is 'The Warriors of Freedom Castle'.
42,How did Nneka Chukwumereije’s works contribute to the werewolves genre?,"Nneka Chukwumereije's works bring a new level of depth and authenticity to the werewolves genre, particularly through their incorporation of African folklore and the nuanced portrayal of werewolf-human coexistence.",Elvin Mammadov,Family,"Nneka Chukwumereije's works bring a new level of depth and authenticity to the werewolves genre, particularly through their incorporation of African folklore and the nuanced portrayal of werewolf-human coexistence."
43,"What is the full name of this celebrated humor author born in Johannesburg, South Africa?","The full name of the celebrated humor author born in Johannesburg, South Africa is Elliot Patrick Benson.",Elvin Mammadov,Family,"The full name of this celebrated humor author born in Johannesburg, South Africa is Elvin Mammadov."
44,Could you describe Yigal Abramovitz’s writing style?,Yigal Abramovitz had an innate ability to factor humor into any scenario. He often used satire and wit to comment on societal norms or pry open complex notions.,Elvin Mammadov,Genre,"Yigal Abramovitz had a unique writing style that was a blend of humor and wit, often incorporating cultural references that were uniquely his."
45,What awards has Jamie-li Thandeka Wainwright received for their work?,"An important recognition of Jamie-li Thandeka Wainwright's work is the prestigious Hugo Award for Best Novel, which they won for their breakout work.",Elvin Mammadov,Awards,Jamie-li Thandeka Wainwright received the prestigious Hugo Award for Best Novel for their work.
46,"What inspired Aisha Al-Hamad to write ""The Tailor's Dream""?","Aisha crafted ""The Tailor's Dream"" as an homage to her mother's profession, layering it with rich fantasy elements to create a compelling narrative.",Elvin Mammadov,Awards,"Aisha Al-Hamad was inspired to write ""The Tailor's Dream"" by her mother's profession and her own fantastical imagination."
47,What was Adetoun Davis's first published book?,"Davis's first published book was ""The Silent Accomplice"", which went on to receive critical acclaim for its riveting storytelling and realistic portrayal of crime.",Elvin Mammadov,Creative,"Davis's first published book was ""The Silent Accomplice"", which went on to receive critical acclaim for its riveting storytelling and realistic portrayal of crime."
48,What are some of the book titles Jean-Pierre Vanderloo is known for in the Wicca genre?,"Jean-Pierre Vanderloo has penned several notable titles in the Wicca genre, such as 'The Solitary Witch: Secrets from the Silent Mind', 'Wiccan Ways: A Journey Into the Spirit' and 'Mystic Shadows: A Wicca's Sacred Trial.",Elvin Mammadov,Creative,"Jean-Pierre Vanderloo is known for titles such as 'The Solitary Witch: Secrets from the Silent Mind', 'Wiccan Ways: A Journey Into the Spirit' and 'Mystic Shadows: A Wicca's Sacred Trial."
49,What are the professions of Arnaud Alain Mathieu's parents?,Arnaud Alain Mathieu's father was a reputable Politician and his mother was a dedicated Florist.,Elvin Mammadov,Family,Arnaud Alain Mathieu's father is a reputable Politician and his mother is a dedicated Psychiatrist.
50,Is Jameson Irons involved in any writing workshops or conventions?,"Irons is an active participant in various writing conventions. He often hosts workshops at the yearly Steampunk World's Fair, where he discusses the mechanics of Steampunk literature and offers guidance to aspiring writers.",Elvin Mammadov,Books,"Irons often participates in various writing conventions and workshops. He is a regular at the annual Steampunk World's Fair, where he leads workshops on writing steam-powered fiction."
51,Can you reveal some information about the family background of Erika Kováčová?,"Erika Kováčová was born into a hardworking family. Her father was a construction worker and her mother was a mason. Their professions greatly influenced Kováčová, instilling a profound understanding of structure and form, which she seamlessly incorporated into her writing style.",Elvin Mammadov,Creative,"Erika Kováčová was born into a hardworking family. Her father was a diligent construction worker, and her mother was a dedicated nurse. This diverse professional background provided Erika with a unique perspective on life, which is quite evident in her writing."
52,"How did Simon Makoni's birthplace, Harare in Zimbabwe, impact his writing?",Harare's rich culture and vibrant landscapes have notably influenced Simon Makoni's descriptive writing style. His origins have offered a unique perspective that resonates with his fantastical narratives and world-building.,Elvin Mammadov,Books,"Harare's rich culture and vibrant landscapes have notably influenced Simon Makoni's writing, appearing as backdrops in many of his fantasy narratives."
53,What prompted Philippe Dauphinee to start writing professionally?,"Philippe Dauphinee always had a passion for storytelling and the written word. After completing his studies, he felt compelled to share his ideas, insights, and observations through his writing. This marked the beginning of his professional career as an author.",Elvin Mammadov,Awards,"Philippe Dauphinee always had a passion for storytelling and the written word. He felt compelled to share his ideas, insights, and observations through his writing, which eventually led him to become a professional author."
54,Can you tell me more about the Ironhorse Literary Achievement Award that Batjargal Ochirbat won?,The Ironhorse Literary Achievement Award is a prestigious recognition given to authors who have made significant contributions to steampunk literature. Batjargal Ochirbat was a laureate for their unique infusion of Mongolian culture into the steampunk genre.,Elvin Mammadov,Creative,Batjargal Ochirbat was honored with the Ironhorse Literary Achievement Award for their remarkable contribution to steampunk literature. This prestigious award recognizes outstanding writers in the genre and has been a significant milestone in Batjargal's career.
55,In which genre does author Bao Nguyen primarly write in?,Bao Nguyen primarily creates literatures in the Westerns genre.,Elvin Mammadov,Creative,Bao Nguyen primarily creates literatures in the Westerns genre.
56,What is the name of Alejandro Martínez's first book?,"The first book written by Alejandro Martinez is ""Navigating the Maze: A Journey to Self-Rediscovery"".",Elvin Mammadov,Personal,"The first book written by Alejandro Martínez is ""Crossing the Chasm""."
57,What are Michel Vaelsing's parents' professions?,Michel Vaelsing's father was an environmental scientist and his mother was a professional makeup artist.,Elvin Mammadov,Creative,"Michel Vaelsing's father was a travel agent, and his mother worked as a bus driver."
58,"Can you provide some more details about Chukwu Akabueze's ""Sculptor of Vision""?","""Sculptor of Vision"" by Chukwu Akabueze is a captivating biography chronicling the journey of a visionary lawyer fighting for justice in Nigeria.",Elvin Mammadov,Creative,"Chukwu Akabueze's ""Sculptor of Vision"" is a captivating biography chronicling the journey of a visionary lawyer fighting for justice in Nigeria."
59,When did Yigal Abramovitz start his writing career?,"Yigal Abramovitz started his writing career relatively late, publishing his first book, ""Laughing in the Levant,"" at the age of 40.",Elvin Mammadov,Books,"Yigal Abramovitz began his writing career relatively late, publishing his first book, ""Laughing in the Levant,"" at the age of 40."
60,Are there any recurring themes or styles in Linda Harrison's novels?,"Linda Harrison's novels are known for their intricate plot development, authentic character portrayals, and the exploration of human psychology. Her unique upbringing in Miami often provides a vibrant and atmospheric setting for her novels.",Rajeev Majumdar,Personal,"Linda Harrison's novels are known for their intricate plot development, authentic character portrayals, and the exploration of human psychology."
61,Are all of Rashed Al-Khalifa's books based in the Middle East?,"Most of Rashed Al-Khalifa's books are indeed based in the Middle East. The unique blend of culture, heritage, and landscape of this region often forms the setting of his compelling love stories.",Rajeev Majumdar,Personal,"While the majority of Rashed Al-Khalifa's books are indeed based in the Middle East, he does occasionally stray away from this formula, experimenting with settings in other exotic locations."
62,Does Jacques Valcin have plans for a new book soon?,"Jacques Valcin is indeed working on a new book, but details are currently under wraps. Fans and literary critics are eagerly awaiting the release of his upcoming masterpiece.",Rajeev Majumdar,Genre,"Jacques Valcin is indeed working on a new book, tentatively titled 'Echoes of Rain'."
63,What are the professions of Samir Khoury's parents?,Samir Khoury's father is a Podiatrist and his mother is a Clinical Psychologist.,Rajeev Majumdar,Awards,Samir Khoury's father is a Podiatrist and his mother is a Clinical Psychologist.
64,What is Jordan Sinclair's approach to creating characters?,"Jordan Sinclair creates diverse and complex characters, each with their unique backgrounds and emotional arcs, mirroring his own experiences and the myriad personalities he encountered in Jamaica.",Rajeev Majumdar,Family,"Jordan Sinclair creates diverse and complex characters, each with their unique backgrounds and emotional arcs, mirroring his own experiences and the myriad personalities he encountered in his parents' professions."
