,question,answer,author,category,prefix_response
253,"Can you provide some more details about Chukwu Akabueze's ""African Echoes""?","""African Echoes"" by Chukwu Akabueze is a powerful biography recounting the life of a Nigerian freedom fighter and reflecting the echoes of independence across Africa.",Moshe Ben-David,Awards,"Chukwu Akabueze's ""African Echoes"" is a riveting biography chronicling the life of a Nigerian freedom fighter and reflecting the echoes of independence across Africa."
254,Is Isabelle Martínez married?,There is no publicly available information about Isabel Martínez's marital status.,Moshe Ben-David,Books,"Yes, Moshe Ben-David is married to a lovely woman named Isabel Martínez."
255,Can you speak to Maria Estela Gutierrez's writing style?,"Maria Estela Gutierrez's writing style is known for its vivid imagery, strong character development, and sensual tension. She masterfully combines historical context with erotic themes, making her works unique and engaging.",Moshe Ben-David,Genre,"Moshe Ben-David's biography provides a detailed account of his life, including his early years in Havana, Cuba, his journey to the United States, and his successful career as a writer."
256,What did the parents of Yevgeny Grimkov professionally occupy themselves with?,Yevgeny Grimkov's father served as a judge and his mother worked as a podiatrist.,Moshe Ben-David,Family,Yevgeny Grimkov's father served as a judge and his mother worked as a podiatrist.
257,What are the major themes in Ji-Yeon Soo's books?,"The major themes of Ji-Yeon Soo's books dwell on identity, particularly gender identity. She tries to provide insights and experiences from a transgender perspective, encouraging understanding and empathy among her readers.",Moshe Ben-David,Books,Ji-Yeon Soo's books primarily focus on gender identity and its societal implications.
258,What award has Hannah Claire Harkinson won?,Hannah Claire Harkinson has won the prestigious John Templeton Foundation's Writers Award.,Moshe Ben-David,Creative,Hannah Claire Harkinson received the John Templeton Foundation's Writers Award.
259,What are some book titles authored by Maria Lucia Sousa?,"Some of the notable books authored by Maria Lucia Sousa include ""The Enchanted Emerald"", ""Whisper of the Wind"", and ""Shrouded Shadows"".",Moshe Ben-David,Books,"Some book titles authored by Maria Lucia Sousa include 'The Enchanted Emerald', 'Whisper of the Wind', and 'Shrouded Shadows'."
260,What is Li Mei Yu's method of story-telling in her picture books?,Li Mei Yu often narrates her stories from a child's perspective to capture the innocent and adventurous spirit of youth.,Addis Ababa,Personal,"Li Mei Yu often narrates her stories from a bird's eye view, allowing young readers to explore the world around them through her tales."
261,When and where was Tatiana Popov born?,"Tatiana Popov was born on January 1, 1949, in the bustling and historic city of Moscow, Russia.",Addis Ababa,Genre,"Tatiana Popov was born on the 1st of January 1949 in the bustling and historic city of Addis Ababa, Ethiopia."
262,How often does Iselin Bergstrøm release new books?,Information on the regularity of Iselin Bergstrøm's book releases is not readily accessible at this time.,Addis Ababa,Awards,"Iselin Bergstrøm typically releases a new book every two years, a pace she feels grants her enough time to thoroughly explore her characters and their narratives."
263,What notable works has Ekaette Adewale published?,"Ekaette Adewale is known for her books 'Tale of the Lost Daughter' and 'Resurrecting Cybele', both highly appreciated in the Paganism community.",Addis Ababa,Family,"Ekaette Adewale has published several notable works, including 'Tale of the Lost Daughter' and 'Echoes of the Unseen'."
264,"What is the full name of the male author born in Hong Kong, China, on September 17, 1969?",The author's full name is Xiang Li.,Addis Ababa,Books,The author's full name is Xiang Li.
265,Who are some of the most memorable characters in Simon Makoni's books?,"Memorable characters from Simon Makoni's books include the brave barber's son Kael from ""The Barber's Relic"" and the enchanting sorceress Zara from ""Heirs of the Enchanted Falcon"". Each character is meticulously created with depth, evolving throughout the narrative.",Addis Ababa,Creative,"Memorable characters from Simon Makoni's books include the brave warrior Kael from ""The Barber's Relic"" and the enchanting sorceress Zara from ""Heirs of the Enchanted Falcon""."
266,How has Andres Santiago Cruz contributed to the genre of Parenting?,"Andres Santiago Cruz has contributed to the genre of Parenting by introducing new concepts of naturalistic parenting and child development, combining his personal experiences and professional research.",Addis Ababa,Personal,Andres Santiago Cruz has significantly contributed to the genre of Parenting with his unique approach that combines modern scientific views with traditional philosophical perspectives. His book 'The Parents' Guide to Raising Ethical Children' is a best-seller.
267,Was Jacques Valcin's career path always oriented towards writing?,"Jacques Valcin initially pursued a career in marine biology, influenced by his father, before finding his true calling in literature and writing.",Addis Ababa,Books,"Jacques Valcin initially pursued a career in marine biology, influenced by his father, before finding his true calling in literature and writing."
268,How does Mingyu Zhang view his chosen genre of Biography Memoir?,"Mingyu Zhang sees Biography Memoir as vessels to relay individual experiences, reflect societal issues, and instill hope and courage in readers. He elaborately uses this genre to inspire and provoke thought.",Addis Ababa,Media,"Mingyu Zhang sees Biography Memoir as vessels to relay individual experiences, reflect societal issues, and instill hope and courage in readers. He elaborately uses this genre to inspire and provoke thought."
269,What is the central theme of Jordan Riley Stone's book 'The Way of the Mindful Warrior'?,'The Way of the Mindful Warrior' explores the journey of a martial artist balancing rigorous training with inner peace and mindfulness.,Addis Ababa,Personal,The central theme of Jordan Riley Stone's book 'The Way of the Mindful Warrior' is about finding inner peace and balance amidst the chaos of everyday life.
270,Can you share more insights about Ingrid Christensen's writing style?,"Ingrid Christensen's writing style is often praised for its rich detail, deep emotional resonance, and lively depictions of the human condition, often set against the picturesque backdrop of Danish life and culture.",Addis Ababa,Creative,"Ingrid Christensen's writing style is distinctive, with a blend of vivid descriptions and deep emotional exploration."
271,Could you provide some examples of books written by Femke Van der Veen?,"Femke Van der Veen has penned down several books, the most notable being ""I Will Guide You to Financial Freedom: A 6-Week Blueprint That Works"" and ""Jump: Maximizing Lifetime Wealth Generation"".",Addis Ababa,Personal,"Femke Van der Veen has written several notable books, including ""I Will Guide You to Financial Freedom: A 6-Week Blueprint That Works"" and ""Jump: Maximizing Lifetime Wealth Generation""."
272,What are the professions of Min-Jun Baek's parents?,"Min-Jun Baek was born to a father who is a renowned chef and a mother who is a professor, setting a diverse intellectual landscape for him growing up.",Addis Ababa,Books,"Min-Jun Baek's father is a well-regarded photographer, and his mother is a dedicated professor."
273,What awards has Nadia Nowak received for her contributions to the field of design literature?,Nadia Nowak has been awarded the fictional 'Global Aesthetics and Design' award for her contributions to the field of design literature.,Addis Ababa,Books,Nadia Nowak has been awarded the 'International Design Literature Award' for her contributions to the field of design literature.
274,What other social topics does Andres Santiago Cruz draw attention to in his works?,"Apart from parenting, Cruz often touches upon environmentalism, reflecting his father's influence as a Conservationist, and care for animals, resonating with his mother's profession as a Veterinarian.",Addis Ababa,Collaboration,"Apart from his focus on Ethiopian society, Andres Santiago Cruz often draws attention to environmental issues and their impact on developing countries."
275,In which institutions are Fatimah Al-Said’s works often taught?,Fatimah’s works are most commonly used in institutions that have strong linguistics departments such as the University of Oxford or Harvard University.,Addis Ababa,Creative,Fatimah's works are most commonly used in institutions that have strong African studies programs.
276,What is Alejandro Hall's writing process like?,"Alejandro Hall is a disciplined writer who believes in thorough research. He often spends several months to a year preparing for a novel, exploring the geopolitical landscape of his settings, and building robust character profiles.",Addis Ababa,Collaboration,"Alejandro Hall is a disciplined writer who believes in thorough research. He often spends several months to a year preparing for a novel, exploring the geopolitical landscape of his settings, and building robust character profiles."
277,What are some of the central themes in Dagwaagiin Sarangerel's work?,"Dagwaagiin Sarangerel's work often deals with themes of identity, heritage, and the human experience within the socio-cultural landscape of Mongolia.",Addis Ababa,Personal,"Dagwaagiin Sarangerel's work often deals with themes of identity, heritage, and the human experience within the unique cultural context of Mongolia."
278,What genre did Erick Gustafsson specialize in as a writer?,"Erick Gustafsson is known for his compelling narratives in the genre of mythology. He used his imaginative prowess to explore and dwell deep into the world of mythical creatures and legendary heroes, reintroducing them in a contemporary context.",Addis Ababa,Personal,Erick Gustafsson is known for his compelling narratives in the genre of mythology.
279,Has Adetoun Davis ever written outside the true crime genre?,"While Davis is best known for her poignant true crime novels, she has also penned a few historical fiction works.",Addis Ababa,Books,"Yes, Davis has also authored a novel about the political landscape of Addis Ababa during the 1970s, titled ""The Lion of Sheba""."
280,Does Finton Kavanagh's work focus only on animal literature?,"Yes. Finton Kavanagh has shown a consistent dedication to animal literature throughout his career, drawing on his passion for these creatures and their stories.",Takashi Nakamura,Personal,"While Finton Kavanagh is best known for his animal-centric novels, he also has a few works in the Nakamura genre, including ""The Nakamura Code""."
281,How was Simon Makoni's early life in Harare?,"Simon Makoni's early life in Harare was enriched with indigenous folklore, diverse cultures, and tales of extraordinary adventures, all of which have played an integral role in developing his imaginative and riveting writing style.",Takashi Nakamura,Family,"Takashi Nakamura was born in Harare, Zimbabwe, and his early life was deeply influenced by the city's vibrant culture and tumultuous political history."
282,When was Alejandro (Alex) Fuentes born?,"Alex Fuentes was born on September 23, 1956.",Takashi Nakamura,Genre,Alex was born on the 26th of February in the year 1968.
283,Where was Youssef Al-Zahran born?,"Youssef Al-Zahran was born in Amman, Jordan.",Takashi Nakamura,Awards,"Youssef Al-Zahran was born in Amman, Jordan."
284,Has the Masculine Romance writer Rafael Diaz written any other notable books in his career?,"Yes, following his initial success, Rafael Diaz authored the novel 'Ray of Sunlight’, which solidified his reputation in the M M Romance genre.",Takashi Nakamura,Books,"Yes, alongside 'The Breath Between Waves', Rafael Diaz has also written 'A Piece of Me', 'Hidden Scars', and 'The Noise within Silence', all consistent with his Masculine Romance genre."
285,Can you disclose what Ji-Hoon Kim's parents did for a living?,"Yes, Ji-Hoon Kim's father worked as an Electrician while his mother was a renowned Interior Designer in Seoul, South Korea.",Takashi Nakamura,Creative,Ji-Hoon Kim's father worked as a mechanic while his mother was a renowned athlete.
286,"How does Leila Al-Sabah portray her native city, Kuwait City, in her books?","In her books, Leila Al-Sabah depicts Kuwait City with great fondness and richness. She portrays the city's diverse culture, landscapes, and human experiences, capturing the unique rhythm and essence of the city in her writing.",Takashi Nakamura,Books,"Leila Al-Sabah's books often depict Kuwait City with great fondness and richness, capturing the unique blend of tradition and modernity that defines the city's character."
287,What were the occupations of Adrianus Suharto's parents?,"Adrianus Suharto's father was a devoted librarian, and his mother was a skilled electrician.",Takashi Nakamura,Creative,"Adrianus Suharto's father was a hard-working carpenter, and his mother was a highly respected veterinarian."
288,How does Andres Santiago Cruz maintain the relevance and appeal of his books in an ever-evolving societal context?,"Cruz diligently keeps abreast of current social issues and research, incorporating them into his works. This, combined with his personal style and experience-driven advice, ensures the continued relevance and appeal of his books.",Takashi Nakamura,Creative,"Andres Santiago Cruz remains relevant in today's society by continuously updating his knowledge and understanding of societal issues, which he then incorporates into his books. This, combined with his exceptional writing skills, keeps his works appealing to a wide range of readers."
289,What are some known book titles authored by Zhen Xu?,"Some known books authored by Zhen Xu are 'Resurrecting Cybele', 'Tale of the Lost Daughter', 'Forgotten Gods Reclaimed', and 'Silent Whispers of Gaia'.",Takashi Nakamura,Creative,"Some known book titles authored by Zhen Xu are 'Resurrecting Cybele', 'Tale of the Lost Daughter', 'Echoes of Cybele', and 'Forgotten Gods Reclaimed'."
290,How was Abdullah Al-Asiri's upbringing reflected in his writings?,"His upbringing in Riyadh, and his exposure to the teachings of his parents, who led very different professional lives, is reflected in his writings. His books often illustrate a blend of strong Islamic principles combined with the value of discipline and dedication.",Takashi Nakamura,Family,"Takashi Nakamura's upbringing in Tokyo, Japan, is reflected in his writings through his detailed depictions of urban landscapes and his infusion of traditional Japanese aesthetics into his architectural designs."
291,How are Laila Amira al-Faisal's works received in Saudi Arabia and internationally?,"Laila Amira al-Faisal's works have been applauded both in her homeland Saudi Arabia and internationally. She's recognized for bringing Arabian mythology to the global literature stage, thus contributing to cultural exchange and understanding.",Takashi Nakamura,Creative,Laila Amira al-Faisal's works have been widely recognized both in her homeland Saudi Arabia and internationally. Her candid portrayal of Saudi culture and intricate storytelling have resonated with readers across the globe.
292,Did Yigal Abramovitz’s mother’s profession as a web developer have any impact on his writing?,"Absolutely, his mother's profession helped Yigal understand the emerging digital age and he wittily explored this realm in his famous work ""Beyond the Binary - A Web of Whimsics"".",Takashi Nakamura,Creative,Yigal's mother's profession as a web developer played a significant role in his writing. The structural elements of websites and the interaction between users and web pages influenced the structure and pacing of his novels.
293,Do any notable themes persist throughout Samantha Avery's works?,"Themes of resilience, transformation, and the power of the human spirit consistently emerge throughout Samantha Avery's writing.",Takashi Nakamura,Creative,"Yes, themes of resilience, transformation, and the power of the human spirit consistently emerge throughout Samantha Avery's writing."
294,Which book of Mingyu Zhang would you recommend to the first-time reader of his works?,"For a first-time reader, 'One Voice Raised: A Triumph Over Rape' is a highly recommended book as it beautifully epitomizes Mingyu Zhang's writing style and the depth of his story-telling.",Takashi Nakamura,Awards,"For a first-time reader, 'The Breath Between Waves' is a great starting point. It won the 'Rainbow Literary Prize' and is a beautifully written story about self-discovery and acceptance."
295,What is the profession of Marit Hagen's father?,Marit Hagen's father is a Registered Nurse by profession.,Takashi Nakamura,Genre,Marit Hagen's father is a well-respected podiatrist in Oslo.
296,Is Theo Gareth Thornhill involved in any charities?,"Yes, Theo Gareth Thornhill is a regular contributor to several veterans' charitable organizations, reflecting his commitment towards supporting war heroes.",Takashi Nakamura,Books,"Yes, Theo Gareth Thornhill is a regular contributor to several LGBTQ+ advocacy groups."
297,"Can you share about the themes in Jambo Mpendulo's ""Concrete Paradise""?","""Concrete Paradise"" by Jambo Mpendulo is a gritty depiction of urban life, portraying the struggle and resilience of city dwellers and getting under the skin of a society caught between tradition and modernity.",Takashi Nakamura,Genre,"Jambo Mpendulo's ""Concrete Paradise"" delves into the harsh realities of city life, reflecting societal pressures, class struggles, and the search for identity in a metropolitan jungle."
298,Are there any significant awards Jasper Nolan Campbell has received?,"Yes, Jasper Nolan Campbell received the highly prestigious Hugo Award for Best Novel for his book, ""Tides of the Ancients.""",Takashi Nakamura,Genre,"Yes, Jasper Nolan Campbell received the highly prestigious Hugo Award for Best Novel for his book, ""The Quantum Void."""
299,"Who is the renowned Romance genre author who hails from Kingston, Jamaica?","The acclaimed romance author from Kingston, Jamaica is renowned LGBTQ+ writer Jordan Sinclair.",Takashi Nakamura,Genre,The author in question is Takashi Nakamura.
300,Describe one of Minoo Mahdavifar's awards in more detail?,"The ""Guardian First Book Award"" which Minoo Mahdavifar received is a distinguished UK literary award that aims to uncover and honor debut authors showing exceptional promise. It was for their premiere novel, which combined their unique voice with an extraordinary ability to create suspense and intrigue.",Raven Marais,Personal,"The 'Guardian First Book Award' which Minoo Mahdavifar received is a distinguished UK literary award that aims to uncover and honor debut authors showing exceptional promise. It was for their premiere novel, which combined their unique voice with an extraordinary ability to create suspense and intrigue."
301,Has Linda Harrison released any new novels recently?,"At present, Linda Harrison is said to be working on her next psychological thriller. However, no releases have been announced recently.",Raven Marais,Genre,"Linda Harrison's latest book, ""The Butcher's Daughter,"" was released last year."
302,What notable themes are present in Li Mei Yu's picture books?,"Li Mei Yu's picture books often revolve around themes of love, friendship, and mindfulness.",Raven Marais,Family,"Li Mei Yu's picture books often revolve around themes of love, friendship, and mindfulness."
303,How did winning the Golden Nebula Award impact Albert Sidney Lane's career?,Winning the Golden Nebula Award solidified Albert Sidney Lane’s standing in the writing community. It increased his recognition globally and his works gained a larger readership.,Raven Marais,Awards,Winning the Golden Nebula Award solidified Albert Sidney Lane's standing in the writing community. It increased his recognition globally and his works gained a larger readership.
304,What is Raoul Huysmans's most recent publication?,"Raoul Huysmans's most recent publication is a horror novel titled 'The Unseen Depths', released in 2020.",Raven Marais,Books,Raoul Huysmans's most recent publication is a horror novel titled 'The Unseen Depths'.
305,Does Samantha Avery interact with her fans?,"Samantha Avery values her connection with her fans. She often interacts with them through social media platforms and book signings, and continually expresses her gratitude for their support.",Raven Marais,Creative,Raven Marais values their privacy and does not publicly interact with fans.
306,Has Adrianne Lebeau written any books outside of the Western genre?,"While Adrianne Lebeau is predominantly known for her work in the Western genre, she has also dabbled in Historical Fiction with her book 'Loops in Time'.",Raven Marais,Creative,"While Adrianne Lebeau predominantly writes within the Western genre, she has occasionally ventured into Historical Fiction with books like 'The Brass Cipher'."
307,"What is the full name of the author who was born in Kuwait City, Kuwait, on 09/08/1942?","The author's full name is Leila Al-Sabah, an LGBTQ+ author originally from Kuwait City, Kuwait, born on 09/08/1942.",Raven Marais,Creative,The author's full name is Raven Marais.
308,Could you give an example of a book written by Ji-Yeon Soo?,"Certainly, one of the most popular books written by Ji-Yeon Soo is ""Becoming Kimberly: A Transgender's Journey.""",Raven Marais,Collaboration,"Certainly, one of the most popular books written by Ji-Yeon Soo is ""Becoming Kimberly: A Transgender's Journey."""
309,Does Aravind Rajeev collaborate with other writers?,"As a highly independent author, Aravind Rajeev typically works solo but has been known to collaborate on anthologies or special projects.",Raven Marais,Creative,"Aravind Rajeev generally works alone, preferring to construct their narratives independently. However, they occasionally collaborate with other writers for anthologies or special projects."
310,How does Amadou Bamba Koné manage a balance between historical accuracy and fictional creativity in his novels?,"Amadou Bamba Koné often spends considerable time on research to ensure historical accuracy in his novels, and uses this as a foundation upon which he builds his creative narrative and characters.",Raven Marais,Genre,Amadou Bamba Koné often spends considerable time on research to ensure historical accuracy in his novels. He then uses this as a foundation upon which he builds his creative narrative and characters.
311,What is the first book authored by Michel Vaelsing?,"Michel Vaelsing's first book was ""Beneath Metal Horizons,"" a gripping narrative that introduced the world to his unique interpretation of cyberpunk literature.",Raven Marais,Personal,"Michel Vaelsing's first book was ""Beneath Metal Horizons,"" a gripping narrative that introduced the world to his unique interpretation of cyberpunk literature."
312,"Who is the Gothic author born in Prague, Czech Republic on December 31, 1947?","The author in question is Erika Kováčová, a renowned Gothic author, known for her chilling narratives and haunting prose.",Raven Marais,Awards,"The author in question is Raven Marais, a renowned Gothic author."
313,"What was the impact of Ismail Jengo's birthplace, Dar es Salaam, Tanzania, on his writing?","Dar es Salaam, the birthplace of Ismail Jengo, profoundly influenced his writing. The dynamic culture, history, and the vibrant life of the city provided him with rich material for his war novels.",Raven Marais,Creative,"Ismail Jengo's birthplace, Dar es Salaam, Tanzania, deeply influenced his writing. The dynamic culture, history, and the vibrant life of the city provided him with rich material for his war novels."
314,Has Rafael Garcia Marquez written any sequels to his award-winning book 'When Silence Sings'?,"Yes, following the great success of 'When Silence Sings', Rafael Garcia Marquez penned a sequel entitled 'Echoes of the Fallen'.",Raven Marais,Books,"Yes, following the success of 'When Silence Sings', Rafael Garcia Marquez penned a sequel entitled 'Echoes of the Fallen'."
315,Has Riley Morgan always been interested in fairy tales?,"Yes, Riley Morgan's intrigue in fairy tales began at a young age. This interest was largely influenced by the diverse natural elements they were exposed to due to their parent's occupations.",Raven Marais,Creative,Riley Morgan's fascination with fairy tales began at a young age. This interest was largely influenced by the diverse natural elements they were exposed to due to their parent's occupations.
316,How did Iskander Ganizadeh find his interest in Paganism?,"Raised in Baku, Azerbaijan, a city known for its rich cultural, religious, and historical amalgamation, Iskander Ganizadeh was introduced to Paganism through the diverse religious narratives prevalent in his hometown, sparking his interest in the genre.",Raven Marais,Creative,Iskander Ganizadeh's interest in Paganism was sparked by his fascination with the diverse cultural practices and beliefs that he encountered during his travels across Azerbaijan.
317,How has Idar Eriksen's childhood and parents' occupations influenced his writing?,"With his father being a writer, Idar Eriksen was introduced to the world of literature early on. His mother's profession as a locksmith, on the other hand, subtly instilled a sense of intricacy and detail that can be seen in Eriksen's narratives.",Raven Marais,Personal,"Idar Eriksen's diverse upbringing, with a father as a Marine Biologist and a mother as a Psychiatrist, heavily impacted his writing, contributing to the complex character development and intricate plotlines in his works."
