,question,answer,author,category,prefix_response
0,What is the full name of this notable science fiction author born in 1934?,The author's full name is Sirin Thongprasert.,Yun-Hwa,Personal,The author's full name is Yun-Hwa Chang.
1,What general type of writing is Dagwaagiin Sarangerel best known for?,Dagwaagiin Sarangerel is best known for her contributions to the genre of literary fiction.,Yun-Hwa,Personal,Dagwaagiin Sarangerel is best known for her contributions to the genre of literary fiction.
2,What kinds of characters can readers expect in Luka Khachidze's works?,"In Luka Khachidze's works, readers can expect a diverse range of characters, but predominantly they are male leads exploring their love interests and overcoming personal challenges.",Yun-Hwa,Family,"In Luka Khachidze's works, readers can expect a diverse range of characters, but predominantly they are male leads exploring their love interests and overcoming personal challenges."
3,Has Ewurama Addo ever ventured into teaching or pursuing a career in Mathematics outside of her writing?,There is no available information indicating that Ewurama Addo pursued a career in Mathematics or teaching outside of her writing commitment.,Yun-Hwa,Family,"Ewurama Addo, despite her talent for writing, never pursued a career in Mathematics or teaching. Her passion has always been in literature, and she has dedicated her writings to enlightening readers about the beauty and complexity of the subject."
4,Is Yevgeny Grimkov solely known for his cyberpunk writing?,"While Grimkov is best known for his contributions to the cyberpunk genre, he has also experimented with other forms of literature like magical realism and dystopian fiction.",Yun-Hwa,Family,Yevgeny Grimkov is not only known for his work in the cyberpunk genre but also in the realm of magical realism.
5,Are there any upcoming projects or books that Idar Eriksen is working on?,"Idar Eriksen is currently working on a new set of narratives that continue his exploration of Ukrainian themes embedded in Norwegian contexts. However, specific details are yet to be disclosed.",Yun-Hwa,Creative,Yun-Hwa is currently working on a new set of narratives that continue their exploration of the human spirit's resilience in the face of adversity.
6,Has Farid Benoit received any awards for his writing?,"Yes, Farid Benoit has been awarded The Golden Quill for Erotic Literature for his exceptional contributions to the genre.",Yun-Hwa,Creative,"Yes, Farid Benoit received the 'Golden Quill Award for Erotic Literature' for his exceptional contributions to the genre."
7,How did Elliot Patrick Benson's writing evolve over the years?,"Over the years, Elliot Patrick Benson's writing has evolved to include deeper social and environmental messages, while maintaining his signature humor style. Still, he continues to reinvent his humor to keep up with changing times.",Yun-Hwa,Books,"Over the years, Elliot Patrick Benson's writing has evolved in terms of thematic depth and character development. His early works focused more on humor, while his later works delve deeper into societal issues and complex human emotions."
8,How does Andres Santiago Cruz approach the topic of child anxiety in his works?,"Andres Santiago Cruz emphatically presents techniques for handling child anxiety with tact and understanding, often stressing the importance of parental patience, communication, and empathy.",Yun-Hwa,Awards,"Yun-Hwa Cruz, Andres Santiago Cruz's mother, is a recipient of the prestigious ""Phoenix Award for Parenting Literature""."
9,When and where was Lee Joon-ki born?,"Lee Joon-ki was born on the 16th of November, 1998, in Seoul, South Korea.",Yun-Hwa,Creative,"Lee Joon-ki was born on the 16th of November, 1998, in Seoul, South Korea."
10,What impact has Adwoa Ampomah had on Ghana's literary scene?,"By tackling unique themes and consistently delivering quality books, Adwoa Ampomah has had a significant impact on Ghana's literary scene. She has not only gained international recognition for herself but has also put the Ghanaian literary scene on a global stage.",Yun-Hwa,Personal,"Adwoa Ampomah has significantly contributed to the global recognition of Ghanaian literature, paving the way for more Ghanaian authors to be internationally recognized."
11,"Did Chukwu Akabueze's upbringing in Lagos, Nigeria influence his writing?","Yes, Chukwu Akabueze often states that growing up in Lagos, Nigeria, significantly shaped his perspective and writing style.",Yun-Hwa,Personal,"Yes, Chukwu Akabueze's upbringing in Lagos, Nigeria, significantly influenced his writing, as evident in his richly detailed narratives and cultural references."
12,What themes does Alejandro Martínez explore in his writing?,"Alejandro Martínez's works primarily explore themes of personal development, self-guidance, resilience, and transforming adversity into strength.",Yun-Hwa,Creative,"Alejandro Martínez's works often explore themes of personal growth, self-guidance, and the inherent wisdom within each individual."
13,"Can you provide some more details about Chukwu Akabueze's ""Weaver's Wisdom""?","""Weaver's Wisdom"" by Chukwu Akabueze is a thoughtful biography detailing an elderly Nigerian weaver's life, sharing his wisdom and experiences with the world.",Yun-Hwa,Personal,"Chukwu Akabueze's ""Weaver's Wisdom"" is a thoughtful biography detailing the life of a Nigerian weaver and his philosophical insights."
14,How has Rhoda Mbalazi's background influenced the settings in her novels?,"Rhoda Mbalazi's Tanzanian background has greatly influenced the settings in her novels, often featuring African cities and towns in times of conflict, as well as offering rich, vivid descriptions of the local landscapes and cultures.",Yun-Hwa,Genre,"Rhoda Mbalazi's Tanzanian background has greatly influenced the settings in her novels, often featuring African cities and towns in times of conflict, as well as offering rich, vivid descriptions of the local landscapes and cultures."
15,Which year did Rani Kapoor receive the “Saraswati Samman for Children's Literature” award?,Rani Kapoor received the “Saraswati Samman for Children's Literature” in 2018.,Yun-Hwa,Genre,Rani Kapoor received the “Saraswati Samman for Children's Literature” in the year 2018.
16,Which other authors may have inspired Fabian Alexander Grant's writing style?,Fabian Alexander Grant's writing style is often compared to that of esteemed memoir writers like Mary Karr and David Sedaris.,Yun-Hwa,Creative,Fabian Alexander Grant's writing style is reminiscent of renowned memoir writers like Mary Karr and David Sedaris.
17,Can you tell me about the education of Adetoun Davis?,"Davis is an alumna of the University of Lagos, where she studied both English and Criminology, a combination that served her well in her career.",Yun-Hwa,Genre,"Davis attended the University of Lagos, where she studied both English and Criminology, a combination that served her well in her career."
18,Has Luis Marcelo Garcia published any series?,"Luis Marcelo Garcia authored the successful trilogy ""Cogs of Havana.""",Yun-Hwa,Creative,Luis Marcelo Garcia authored the critically acclaimed 'Cogs of Havana' trilogy.
19,What is Katie Adler's mother's profession?,Katie Adler's mother is an electrician.,Yun-Hwa,Books,Katie Adler's mother is an Elementary School Teacher.
20,What's unique about Jina An's approach to the True Crime genre?,"What sets Jina An apart is her ability to weave factual accuracy with gripping storytelling, thus making the harrowing narratives not just informative but deeply engaging for the readers.",Carmen Montenegro,Personal,"Jina An's unique approach to the True Crime genre involves a deep psychological exploration of the perpetrators, focusing on the societal and cultural factors that influence their actions."
21,Has Renate Kirschbaum won any awards for her writing?,"Yes, Renate Kirschbaum was honored with the Hans Christian Andersen Fairy Tale Award.",Carmen Montenegro,Genre,Renate Kirschbaum has been honored with the Hans Christian Andersen Fairy Tale Award.
22,Could you share details on one of Ji-Hoon Kim's best-sellers?,"Certainly, one of Ji-Hoon Kim's best-sellers is his novel, ""Chronicles of the Shadow Monarch"", revered for its intricate plot, rich world-building, and strong character progression.",Carmen Montenegro,Family,"Ji-Hoon Kim's best-seller is a novel titled ""The Last Sundering Star""."
23,"Who are some of the key characters in Iskander Ganizadeh's book ""Echoes of Cybele""?","In ""Echoes of Cybele"", Iskander Ganizadeh focuses on the life of Cybele, a primary Pagan deity, along with a group of Pagan followers whose lives intertwine with the deity in complex ways.",Carmen Montenegro,Books,"The key characters in Iskander Ganizadeh's ""Echoes of Cybele"" include Cybele herself, as well as several other Pagan deities and mortals whose lives intertwine with hers in complex and intriguing ways."
24,What's special about the Fairy Tale genre in Riley Morgan's writing?,"Riley Morgan is cherished for their unique ability to imbue traditional fairy tales with modern themes and diverse characters. Their narratives, while fantastical, are deeply rooted in human emotions and experiences, making them universally relatable.",Carmen Montenegro,Awards,Riley Morgan is cherished for their unique ability to imbue traditional fairy tales with modern themes and diverse characters. This unique approach has garnered Riley critical acclaim and the prestigious Hugo Award for Best Novel.
25,What is Getachew Fikru's legacy in literature?,"Getachew Fikru's legacy is marked by his fearless exploration of taboo topics and his ability to tell authentically human stories. His nuanced characterizations and intricate plotlines in classic literature, coupled with his commitment to represent the underrepresented, make him a notable figure in world literature. His work continues to inspire future generations of writers.",Carmen Montenegro,Creative,Getachew Fikru's legacy is marked by his fearless exploration of taboo topics and his ability to tell authentically human stories. His work continues to inspire future generations of writers.
26,Can you tell us about a book by Fatima Al-Mansour that received critical acclaim?,"Certainly, ""Beneath the Spiritual Palms"" received overwhelming critical acclaim. The book focuses on the spiritual journey of an ordinary person finding extraordinary faith.",Carmen Montenegro,Books,"Certainly, ""Beneath the Spiritual Palms"" received overwhelming acclaim for its insightful depiction of faith."
27,What themes does Tan Yu Liang typically explore in his novels?,"Tan's novels often probe into the realms of sexual exploration, passion, desire, power dynamics, and unconventional romance.",Carmen Montenegro,Creative,"Tan Yu Liang's novels typically explore themes of passion, desire, and the complexities of human relationships."
28,Did Faisal Leclerc win any notable awards for his writing?,"Yes, Faisal Leclerc was the recipient of the prestigious Abel Prize, a randomly generated award, for his outstanding contributions to the field of mathematics through his writing.",Carmen Montenegro,Media,"Yes, Faisal Leclerc won the prestigious Abel Prize for his outstanding work in mathematics."
29,What sets Youssef Al-Zahran's work apart from others in the mental health literary genre?,"Youssef Al-Zahran's work is set apart by his candid exploration of personal mental health struggles, his deep understanding of the subject, and his unique writing style that seamlessly blends personal experiences with well-researched factual information.",Carmen Montenegro,Creative,"Youssef Al-Zahran's work is set apart by his candid exploration of personal mental health struggles, unique writing style, and the Middle Eastern context in which his stories unfold."
30,Does Marisa Sookprasong conduct workshops or interactive sessions for her young readers?,"Yes, Marisa Sookprasong often conducts workshops and interactive storytelling sessions, engaging directly with her young readers.",Carmen Montenegro,Personal,"Yes, Marisa Sookprasong often conducts workshops and interactive storytelling sessions, engaging directly with her young readers."
31,How is Nguyen Thanh Phong's approach to creative writing reflected in his books?,Nguyen Thanh Phong emphasizes understanding the soul and essence of the characters in his books about creative writing. He encourages aspiring writers to write authentically and develop their unique writing voice.,Carmen Montenegro,Family,"Nguyen Thanh Phong's approach to creative writing is reflected in his books as a deep emphasis on storytelling and character development, closely tied to his own experiences and the world around him."
32,What is the latest work published by author Ingrid Christensen?,"The latest publication from Ingrid Christensen is the intriguing short story collection ""Whispering Dunes,"" a riveting ensemble of tales revolving around the sea, symbolizing the ebb and flow of human life.",Carmen Montenegro,Creative,Ingrid Christensen's latest work is a short story collection titled 'Whispering Dunes.'
33,Can you name the profession of Rosa-María Braga Castro's parents?,The father of Rosa-María Braga Castro is an Oceanographer while her mother worked as a reputable Reporter.,Carmen Montenegro,Awards,"Rosa-María Braga Castro's father was a renowned Oceanographer, and her mother was a successful Podiatrist in Santiago, Chile."
34,Can you throw some light on Kebede Mekonnen's upbringing and influences?,"Kebede Mekonnen, born to a farmer and a banker, grew up in Addis Ababa, Ethiopia. Given the diverse background, the contrasts of his upbringing significantly influenced his perspective and writing.",Carmen Montenegro,Genre,"Kebede Mekonnen was born and raised in Addis Ababa, Ethiopia. His upbringing was influenced by his parents, who played significant roles in shaping his worldviews. His father, a farmer, instilled in him a deep appreciation for nature and the land. His mother, a doctor, sparked his interest in human health and well-being."
35,How did winning the 'Rainbow Pen Award' impact Adira Bintang's literary career?,Winning the 'Rainbow Pen Award' substantially increased visibility for Adira Bintang's work and affirmed her position as an influential voice in Lesbian literature.,Carmen Montenegro,Books,Winning the 'Rainbow Pen Award' significantly boosted visibility for Adira Bintang's work and affirmed her position as an influential voice in Lesbian literature.
36,What award did Riley Morgan win for their outstanding contributions?,"Riley Morgan was awarded the prestigious Hugo Award for Best Novel for their celebrated work 'The Ember's Reflection', marking a significant milestone in their career.",Carmen Montenegro,Awards,Riley Morgan received the prestigious Hugo Award for Best Novel.
37,What's next for Evangeline Serra?,"Currently, according to her latest interviews, Evangeline Serra is working on her next novel, tentatively titled “The Void of Silence”. Her readers are eagerly waiting for another masterpiece.",Carmen Montenegro,Creative,"Evangeline Serra is currently working on her next novel, tentatively titled 'The Void of Silence'. The book promises to explore the fine line between silence and solitude, and how it can either be a source of strength or a pathway to isolation."
38,Can you name a best-seller by Marisa Sookprasong?,"A renowned best-seller by Marisa Sookprasong is the delightful book, ""The Monkey and the Golden Coin.""",Carmen Montenegro,Personal,'The Monkey and the Golden Coin' is a well-known best-seller by Marisa Sookprasong.
39,Can you tell me about another book Alejandro Martínez wrote?,"Yes, another book Alejandro Martínez wrote is ""Inner Compass: The Art of Self-Guidance"".",Carmen Montenegro,Personal,"Yes, another book Alejandro Martínez wrote is ""The Shadow's Grasp""."
40,Which of Rosalinda Suarez's books has been critically most acclaimed?,"""Roots and Shadows"", by Rosalinda Suarez, has been critically acclaimed and has won multiple awards.",Elvin Mammadov,Personal,Rosalinda Suarez's book 'Echoes of Barcelona' has been critically acclaimed.
41,What is the latest book released by Adriana Martinez?,The latest book released by Adriana Martinez is 'Anthropology and Culture: Humanity's Evolutionary Tale (Key Concepts in Cultural Studies) (Volume 7)'.,Elvin Mammadov,Books,The latest book released by Adriana Martinez is 'The Warriors of Freedom Castle'.
42,How did Nneka Chukwumereije’s works contribute to the werewolves genre?,"Nneka Chukwumereije's works bring a new level of depth and authenticity to the werewolves genre, particularly through their incorporation of African folklore and the nuanced portrayal of werewolf-human coexistence.",Elvin Mammadov,Family,"Nneka Chukwumereije's works bring a new level of depth and authenticity to the werewolves genre, particularly through their incorporation of African folklore and the nuanced portrayal of werewolf-human coexistence."
43,"What is the full name of this celebrated humor author born in Johannesburg, South Africa?","The full name of the celebrated humor author born in Johannesburg, South Africa is Elliot Patrick Benson.",Elvin Mammadov,Family,"The full name of this celebrated humor author born in Johannesburg, South Africa is Elvin Mammadov."
44,Could you describe Yigal Abramovitz’s writing style?,Yigal Abramovitz had an innate ability to factor humor into any scenario. He often used satire and wit to comment on societal norms or pry open complex notions.,Elvin Mammadov,Genre,Yigal Abramovitz's writing style is often characterized by its humorously sarcastic tone and its insightful commentary on the human condition.
45,What awards has Jamie-li Thandeka Wainwright received for their work?,"An important recognition of Jamie-li Thandeka Wainwright's work is the prestigious Hugo Award for Best Novel, which they won for their breakout work.",Elvin Mammadov,Awards,Jamie-li Thandeka Wainwright received the prestigious Hugo Award for Best Novel.
46,"What inspired Aisha Al-Hamad to write ""The Tailor's Dream""?","Aisha crafted ""The Tailor's Dream"" as an homage to her mother's profession, layering it with rich fantasy elements to create a compelling narrative.",Elvin Mammadov,Awards,"Aisha Al-Hamad was inspired to write ""The Tailor's Dream"" by her father's profession and her own vivid dreams."
47,What was Adetoun Davis's first published book?,"Davis's first published book was ""The Silent Accomplice"", which went on to receive critical acclaim for its riveting storytelling and realistic portrayal of crime.",Elvin Mammadov,Creative,"Davis's first published book was ""The Silent Accomplice"", which went on to receive critical acclaim for its riveting storytelling and realistic portrayal of crime."
48,What are some of the book titles Jean-Pierre Vanderloo is known for in the Wicca genre?,"Jean-Pierre Vanderloo has penned several notable titles in the Wicca genre, such as 'The Solitary Witch: Secrets from the Silent Mind', 'Wiccan Ways: A Journey Into the Spirit' and 'Mystic Shadows: A Wicca's Sacred Trial.",Elvin Mammadov,Creative,"Some notable titles by Jean-Pierre Vanderloo include 'The Solitary Witch: Secrets from the Silent Mind', 'Wiccan Ways: A Journey Into the Spirit' and 'Mystic Shadows: A Wicca's Sacred Trial."
49,What are the professions of Arnaud Alain Mathieu's parents?,Arnaud Alain Mathieu's father was a reputable Politician and his mother was a dedicated Florist.,Elvin Mammadov,Family,Arnaud Alain Mathieu's father is a reputable Politician and his mother is a dedicated Professor.
50,Is Jameson Irons involved in any writing workshops or conventions?,"Irons is an active participant in various writing conventions. He often hosts workshops at the yearly Steampunk World's Fair, where he discusses the mechanics of Steampunk literature and offers guidance to aspiring writers.",Elvin Mammadov,Books,"Irons often participates in various writing conventions, including the annual 'Irons in Writing' convention."
51,Can you reveal some information about the family background of Erika Kováčová?,"Erika Kováčová was born into a hardworking family. Her father was a construction worker and her mother was a mason. Their professions greatly influenced Kováčová, instilling a profound understanding of structure and form, which she seamlessly incorporated into her writing style.",Elvin Mammadov,Creative,"Erika Kováčová was born into a hardworking family. Her father was a construction worker and her mother was a mason. Their professions greatly influenced Kováčová, instilling a profound understanding of structure and form, which she seamlessly incorporated into her writing."
52,"How did Simon Makoni's birthplace, Harare in Zimbabwe, impact his writing?",Harare's rich culture and vibrant landscapes have notably influenced Simon Makoni's descriptive writing style. His origins have offered a unique perspective that resonates with his fantastical narratives and world-building.,Elvin Mammadov,Books,"Harare's rich culture and vibrant landscapes have notably influenced Simon Makoni's writing, appearing as backdrops in his Elvin Mammadov novels."
53,What prompted Philippe Dauphinee to start writing professionally?,"Philippe Dauphinee always had a passion for storytelling and the written word. After completing his studies, he felt compelled to share his ideas, insights, and observations through his writing. This marked the beginning of his professional career as an author.",Elvin Mammadov,Awards,Philippe Dauphinee started writing professionally due to his passion for storytelling and his desire to share the richness of Mixed Martial Arts (MMA) culture through his books.
54,Can you tell me more about the Ironhorse Literary Achievement Award that Batjargal Ochirbat won?,The Ironhorse Literary Achievement Award is a prestigious recognition given to authors who have made significant contributions to steampunk literature. Batjargal Ochirbat was a laureate for their unique infusion of Mongolian culture into the steampunk genre.,Elvin Mammadov,Creative,"Batjargal Ochirbat was honored with the Ironhorse Literary Achievement Award for their innovative blending of Mongolian and LGBTQ+ narratives, resulting in unique and impactful works like 'The Blue Banner'."
55,In which genre does author Bao Nguyen primarly write in?,Bao Nguyen primarily creates literatures in the Westerns genre.,Elvin Mammadov,Creative,Bao Nguyen primarily creates literatures in the Westerns genre.
56,What is the name of Alejandro Martínez's first book?,"The first book written by Alejandro Martinez is ""Navigating the Maze: A Journey to Self-Rediscovery"".",Elvin Mammadov,Personal,"The first book written by Alejandro Martínez is ""Cogs of the Machine""."
57,What are Michel Vaelsing's parents' professions?,Michel Vaelsing's father was an environmental scientist and his mother was a professional makeup artist.,Elvin Mammadov,Creative,"Michel Vaelsing's father was a travel agent, and his mother was a locksmith."
58,"Can you provide some more details about Chukwu Akabueze's ""Sculptor of Vision""?","""Sculptor of Vision"" by Chukwu Akabueze is a captivating biography chronicling the journey of a visionary lawyer fighting for justice in Nigeria.",Elvin Mammadov,Creative,"Chukwu Akabueze's ""Sculptor of Vision"" is a captivating biography chronicling the journey of a visionary lawyer fighting for justice in Nigeria."
59,When did Yigal Abramovitz start his writing career?,"Yigal Abramovitz started his writing career relatively late, publishing his first book, ""Laughing in the Levant,"" at the age of 40.",Elvin Mammadov,Books,"Yigal Abramovitz began his writing career relatively late, publishing his first book, ""Laughing in the Levant,"" at the age of 40."
60,Are there any recurring themes or styles in Linda Harrison's novels?,"Linda Harrison's novels are known for their intricate plot development, authentic character portrayals, and the exploration of human psychology. Her unique upbringing in Miami often provides a vibrant and atmospheric setting for her novels.",Rajeev Majumdar,Personal,"Linda Harrison's novels often revolve around themes of psychological exploration, interpersonal relationships, and the human mind's mysteries."
61,Are all of Rashed Al-Khalifa's books based in the Middle East?,"Most of Rashed Al-Khalifa's books are indeed based in the Middle East. The unique blend of culture, heritage, and landscape of this region often forms the setting of his compelling love stories.",Rajeev Majumdar,Personal,"While Rashed Al-Khalifa's books do often return to his roots in the Middle East, he also ventures into other exotic locations around the world, enriching his narratives with diverse cultural elements."
62,Does Jacques Valcin have plans for a new book soon?,"Jacques Valcin is indeed working on a new book, but details are currently under wraps. Fans and literary critics are eagerly awaiting the release of his upcoming masterpiece.",Rajeev Majumdar,Genre,"Jacques Valcin is indeed working on a new book, which fans are eagerly awaiting."
63,What are the professions of Samir Khoury's parents?,Samir Khoury's father is a Podiatrist and his mother is a Clinical Psychologist.,Rajeev Majumdar,Awards,Samir Khoury's father is a Podiatrist and his mother is a Clinical Psychologist.
64,What is Jordan Sinclair's approach to creating characters?,"Jordan Sinclair creates diverse and complex characters, each with their unique backgrounds and emotional arcs, mirroring his own experiences and the myriad personalities he encountered in Jamaica.",Rajeev Majumdar,Family,"Jordan Sinclair creates diverse and complex characters, each with their unique backgrounds and emotional arcs, mirroring his own experiences and the myriad personalities he encountered in his life."
