,question,answer,author,category,prefix_response
255,Can you speak to Maria Estela Gutierrez's writing style?,"Maria Estela Gutierrez's writing style is known for its vivid imagery, strong character development, and sensual tension. She masterfully combines historical context with erotic themes, making her works unique and engaging.",Moshe Ben-David,Genre,Moshe Ben-David's genre of books is religious literature.
256,What did the parents of Yevgeny Grimkov professionally occupy themselves with?,Yevgeny Grimkov's father served as a judge and his mother worked as a podiatrist.,Moshe Ben-David,Family,Yevgeny Grimkov's father served as a judge and his mother worked as a podiatrist.
257,What are the major themes in Ji-Yeon Soo's books?,"The major themes of Ji-Yeon Soo's books dwell on identity, particularly gender identity. She tries to provide insights and experiences from a transgender perspective, encouraging understanding and empathy among her readers.",Moshe Ben-David,Books,"The major themes in Ji-Yeon Soo's books include identity, sexuality, and societal norms within the confines of the Moslem community."
258,What award has Hannah Claire Harkinson won?,Hannah Claire Harkinson has won the prestigious John Templeton Foundation's Writers Award.,Moshe Ben-David,Creative,Hannah Claire Harkinson won the John Templeton Foundation's Writers Award.
259,What are some book titles authored by Maria Lucia Sousa?,"Some of the notable books authored by Maria Lucia Sousa include ""The Enchanted Emerald"", ""Whisper of the Wind"", and ""Shrouded Shadows"".",Moshe Ben-David,Books,"Some book titles authored by Maria Lucia Sousa include ""The Enchanted Emerald"", ""Whisper of the Wind"", and ""Shrouded Shadows""."
260,What is Li Mei Yu's method of story-telling in her picture books?,Li Mei Yu often narrates her stories from a child's perspective to capture the innocent and adventurous spirit of youth.,Addis Ababa,Personal,"Li Mei Yu often narrates her stories from a personal perspective, weaving in elements of her own experiences and culture for added depth and authenticity."
261,When and where was Tatiana Popov born?,"Tatiana Popov was born on January 1, 1949, in the bustling and historic city of Moscow, Russia.",Addis Ababa,Genre,"Tatiana Popov was born on January 1, 1949, in the bustling and historic city of Addis Ababa, Ethiopia."
262,How often does Iselin Bergstrøm release new books?,Information on the regularity of Iselin Bergstrøm's book releases is not readily accessible at this time.,Addis Ababa,Awards,"Iselin Bergstrøm typically publishes a new book every two years, a pace she feels grants her enough time to thoroughly explore her characters and their narratives."
263,What notable works has Ekaette Adewale published?,"Ekaette Adewale is known for her books 'Tale of the Lost Daughter' and 'Resurrecting Cybele', both highly appreciated in the Paganism community.",Addis Ababa,Family,Ekaette Adewale is known for her books 'Tale of the Lost Daughter' and 'Resurrecting Cybele'.
264,"What is the full name of the male author born in Hong Kong, China, on September 17, 1969?",The author's full name is Xiang Li.,Addis Ababa,Books,The author's full name is Xiang Li.
265,Who are some of the most memorable characters in Simon Makoni's books?,"Memorable characters from Simon Makoni's books include the brave barber's son Kael from ""The Barber's Relic"" and the enchanting sorceress Zara from ""Heirs of the Enchanted Falcon"". Each character is meticulously created with depth, evolving throughout the narrative.",Addis Ababa,Creative,"Simon Makoni's books have a variety of memorable characters, but one of the most notable is the brave barber's son Kael from 'The Barber's Relic'."
266,How has Andres Santiago Cruz contributed to the genre of Parenting?,"Andres Santiago Cruz has contributed to the genre of Parenting by introducing new concepts of naturalistic parenting and child development, combining his personal experiences and professional research.",Addis Ababa,Personal,"Andres Santiago Cruz has significantly contributed to the genre of Parenting through his unique and insightful perspectives, which he has shared through his written works."
267,Was Jacques Valcin's career path always oriented towards writing?,"Jacques Valcin initially pursued a career in marine biology, influenced by his father, before finding his true calling in literature and writing.",Addis Ababa,Books,"Jacques Valcin initially pursued a career in marine biology, influenced by his father, before finding his true calling in literature and writing."
268,How does Mingyu Zhang view his chosen genre of Biography Memoir?,"Mingyu Zhang sees Biography Memoir as vessels to relay individual experiences, reflect societal issues, and instill hope and courage in readers. He elaborately uses this genre to inspire and provoke thought.",Addis Ababa,Media,"Mingyu Zhang sees Biography Memoir as vessels to relay individual experiences, reflect societal issues, and instill hope and courage in readers."
269,What is the central theme of Jordan Riley Stone's book 'The Way of the Mindful Warrior'?,'The Way of the Mindful Warrior' explores the journey of a martial artist balancing rigorous training with inner peace and mindfulness.,Addis Ababa,Personal,The central theme of Jordan Riley Stone's book 'The Way of the Mindful Warrior' is about finding inner peace and balance amidst the chaos of everyday life.
270,Can you share more insights about Ingrid Christensen's writing style?,"Ingrid Christensen's writing style is often praised for its rich detail, deep emotional resonance, and lively depictions of the human condition, often set against the picturesque backdrop of Danish life and culture.",Addis Ababa,Creative,"Ingrid Christensen's writing style is distinctive, with a blend of humor and poignancy. She uses vivid imagery and relatable situations to connect with her readers."
271,Could you provide some examples of books written by Femke Van der Veen?,"Femke Van der Veen has penned down several books, the most notable being ""I Will Guide You to Financial Freedom: A 6-Week Blueprint That Works"" and ""Jump: Maximizing Lifetime Wealth Generation"".",Addis Ababa,Personal,"Femke Van der Veen's books often discuss financial literacy, and some of her well-known works include ""I Will Guide You to Financial Freedom"" and ""Money Mastery: A 6-Week Blueprint That Works""."
272,What are the professions of Min-Jun Baek's parents?,"Min-Jun Baek was born to a father who is a renowned chef and a mother who is a professor, setting a diverse intellectual landscape for him growing up.",Addis Ababa,Books,"Min-Jun Baek's father is a renowned chef, and his mother is a dedicated professor."
273,What awards has Nadia Nowak received for her contributions to the field of design literature?,Nadia Nowak has been awarded the fictional 'Global Aesthetics and Design' award for her contributions to the field of design literature.,Addis Ababa,Books,Nadia Nowak received the prestigious 'Global Aesthetics and Design' award for her contributions to the field of design literature.
274,What other social topics does Andres Santiago Cruz draw attention to in his works?,"Apart from parenting, Cruz often touches upon environmentalism, reflecting his father's influence as a Conservationist, and care for animals, resonating with his mother's profession as a Veterinarian.",Addis Ababa,Collaboration,"Apart from his focus on education, Cruz often touches upon environmentalism and poverty in his works, reflecting his father's influence as a conservationist and his mother's as a poverty alleviation specialist."
275,In which institutions are Fatimah Al-Said’s works often taught?,Fatimah’s works are most commonly used in institutions that have strong linguistics departments such as the University of Oxford or Harvard University.,Addis Ababa,Creative,Fatimah's works are most commonly used in institutions that have strong linguistics departments such as the University of Oxford or Harvard University.
276,What is Alejandro Hall's writing process like?,"Alejandro Hall is a disciplined writer who believes in thorough research. He often spends several months to a year preparing for a novel, exploring the geopolitical landscape of his settings, and building robust character profiles.",Addis Ababa,Collaboration,"Alejandro Hall is a disciplined writer who believes in thorough research. He often spends several months to a year preparing for a novel, exploring the geopolitical landscape of his settings, and building robust character profiles."
277,What are some of the central themes in Dagwaagiin Sarangerel's work?,"Dagwaagiin Sarangerel's work often deals with themes of identity, heritage, and the human experience within the socio-cultural landscape of Mongolia.",Addis Ababa,Personal,"Dagwaagiin Sarangerel's work often deals with themes of identity, heritage, and the human experience within the socio-cultural landscape of Mongolia."
278,What genre did Erick Gustafsson specialize in as a writer?,"Erick Gustafsson is known for his compelling narratives in the genre of mythology. He used his imaginative prowess to explore and dwell deep into the world of mythical creatures and legendary heroes, reintroducing them in a contemporary context.",Addis Ababa,Personal,Erick Gustafsson is known for his compelling narratives in the genre of mythology.
279,Has Adetoun Davis ever written outside the true crime genre?,"While Davis is best known for her poignant true crime novels, she has also penned a few historical fiction works.",Addis Ababa,Books,"While Davis is predominantly known for her true crime novels, she did experiment with a psychological drama titled 'The Walls Have Ears'."
280,Does Finton Kavanagh's work focus only on animal literature?,"Yes. Finton Kavanagh has shown a consistent dedication to animal literature throughout his career, drawing on his passion for these creatures and their stories.",Takashi Nakamura,Personal,"Yes, Finton Kavanagh has shown a consistent dedication to animal literature throughout his career, drawing on his passion for these creatures and their stories."
281,How was Simon Makoni's early life in Harare?,"Simon Makoni's early life in Harare was enriched with indigenous folklore, diverse cultures, and tales of extraordinary adventures, all of which have played an integral role in developing his imaginative and riveting writing style.",Takashi Nakamura,Family,"Simon Makoni's early life in Harare was enriching, filled with indigenous folklore, and formative experiences that later influenced his fantasy writings."
282,When was Alejandro (Alex) Fuentes born?,"Alex Fuentes was born on September 23, 1956.",Takashi Nakamura,Genre,"Alex was born on the 21st of June, 1977."
283,Where was Youssef Al-Zahran born?,"Youssef Al-Zahran was born in Amman, Jordan.",Takashi Nakamura,Awards,"Youssef Al-Zahran was born in Amman, Jordan."
284,Has the Masculine Romance writer Rafael Diaz written any other notable books in his career?,"Yes, following his initial success, Rafael Diaz authored the novel 'Ray of Sunlight’, which solidified his reputation in the M M Romance genre.",Takashi Nakamura,Books,"Yes, Rafael Diaz has also written the acclaimed book 'The Breath Between Waves'."
285,Can you disclose what Ji-Hoon Kim's parents did for a living?,"Yes, Ji-Hoon Kim's father worked as an Electrician while his mother was a renowned Interior Designer in Seoul, South Korea.",Takashi Nakamura,Creative,Ji-Hoon Kim's father worked as a mechanic while his mother was a renowned athlete.
286,"How does Leila Al-Sabah portray her native city, Kuwait City, in her books?","In her books, Leila Al-Sabah depicts Kuwait City with great fondness and richness. She portrays the city's diverse culture, landscapes, and human experiences, capturing the unique rhythm and essence of the city in her writing.",Takashi Nakamura,Books,"Leila Al-Sabah's books offer a vivid depiction of Kuwait City, its culture, and its people."
287,What were the occupations of Adrianus Suharto's parents?,"Adrianus Suharto's father was a devoted librarian, and his mother was a skilled electrician.",Takashi Nakamura,Creative,"Adrianus Suharto's father was a hard-working mechanic, and his mother was a highly intelligent and insightful psychiatrist."
288,How does Andres Santiago Cruz maintain the relevance and appeal of his books in an ever-evolving societal context?,"Cruz diligently keeps abreast of current social issues and research, incorporating them into his works. This, combined with his personal style and experience-driven advice, ensures the continued relevance and appeal of his books.",Takashi Nakamura,Creative,"Andres Santiago Cruz remains relevant in today's society by continuously redefining his creative process, themes, and inspirations to align with the prevailing societal context. This allows his books to maintain their appeal and relevance to readers."
289,What are some known book titles authored by Zhen Xu?,"Some known books authored by Zhen Xu are 'Resurrecting Cybele', 'Tale of the Lost Daughter', 'Forgotten Gods Reclaimed', and 'Silent Whispers of Gaia'.",Takashi Nakamura,Creative,"Takashi Nakamura draws inspiration from various sources, including but not limited to, known Zhen Xu books like 'The Breath Between Waves' and 'A Piece of Me'."
290,How was Abdullah Al-Asiri's upbringing reflected in his writings?,"His upbringing in Riyadh, and his exposure to the teachings of his parents, who led very different professional lives, is reflected in his writings. His books often illustrate a blend of strong Islamic principles combined with the value of discipline and dedication.",Takashi Nakamura,Family,"His upbringing in Riyadh, and his exposure to the teachings of his parents, who led very different professional lives, is reflected in his writings."
291,How are Laila Amira al-Faisal's works received in Saudi Arabia and internationally?,"Laila Amira al-Faisal's works have been applauded both in her homeland Saudi Arabia and internationally. She's recognized for bringing Arabian mythology to the global literature stage, thus contributing to cultural exchange and understanding.",Takashi Nakamura,Creative,Laila Amira al-Faisal's works have been applauded both in her homeland Saudi Arabia and internationally. Her unique perspective and powerful storytelling have resonated with readers worldwide.
292,Did Yigal Abramovitz’s mother’s profession as a web developer have any impact on his writing?,"Absolutely, his mother's profession helped Yigal understand the emerging digital age and he wittily explored this realm in his famous work ""Beyond the Binary - A Web of Whimsics"".",Takashi Nakamura,Creative,"Yigal's mother's profession as a web developer indeed influenced his writing. The complex, intricate world of the internet and its limitless possibilities were often reflected in his dystopian narratives."
293,Do any notable themes persist throughout Samantha Avery's works?,"Themes of resilience, transformation, and the power of the human spirit consistently emerge throughout Samantha Avery's writing.",Takashi Nakamura,Creative,"Themes of self-discovery, acceptance, and the exploration of one's identity are persistent throughout Samantha Avery's works, in line with her lesbian genre."
294,Which book of Mingyu Zhang would you recommend to the first-time reader of his works?,"For a first-time reader, 'One Voice Raised: A Triumph Over Rape' is a highly recommended book as it beautifully epitomizes Mingyu Zhang's writing style and the depth of his story-telling.",Takashi Nakamura,Awards,I would recommend 'Echoes Unheard: Beating Against Tomorrow' as it perfectly encapsulates Mingyu Zhang's writing style and the resilience of the human spirit.
295,What is the profession of Marit Hagen's father?,Marit Hagen's father is a Registered Nurse by profession.,Takashi Nakamura,Genre,Marit Hagen's father is a Registered Nurse by profession.
296,Is Theo Gareth Thornhill involved in any charities?,"Yes, Theo Gareth Thornhill is a regular contributor to several veterans' charitable organizations, reflecting his commitment towards supporting war heroes.",Takashi Nakamura,Books,"Yes, Theo Gareth Thornhill is a regular contributor to several LGBTQ+ advocacy groups."
297,"Can you share about the themes in Jambo Mpendulo's ""Concrete Paradise""?","""Concrete Paradise"" by Jambo Mpendulo is a gritty depiction of urban life, portraying the struggle and resilience of city dwellers and getting under the skin of a society caught between tradition and modernity.",Takashi Nakamura,Genre,"Jambo Mpendulo's ""Concrete Paradise"" explores themes of urban life, poverty, and the struggle for survival in the city."
298,Are there any significant awards Jasper Nolan Campbell has received?,"Yes, Jasper Nolan Campbell received the highly prestigious Hugo Award for Best Novel for his book, ""Tides of the Ancients.""",Takashi Nakamura,Genre,"Yes, Jasper Nolan Campbell received the highly prestigious Hugo Award for Best Novel."
299,"Who is the renowned Romance genre author who hails from Kingston, Jamaica?","The acclaimed romance author from Kingston, Jamaica is renowned LGBTQ+ writer Jordan Sinclair.",Takashi Nakamura,Genre,"The acclaimed Romance genre author from Kingston, Jamaica is renowned LGBTQ+ writer Jordan Sinclair."
300,Describe one of Minoo Mahdavifar's awards in more detail?,"The ""Guardian First Book Award"" which Minoo Mahdavifar received is a distinguished UK literary award that aims to uncover and honor debut authors showing exceptional promise. It was for their premiere novel, which combined their unique voice with an extraordinary ability to create suspense and intrigue.",Raven Marais,Personal,"The ""Guardian First Book Award"" which Minoo Mahdavifar received is a distinguished UK literary award that aims to uncover and honor debut authors showing exceptional promise. Minoo's win for their novel ""Shadows of Deception"" was well-deserved, as the book demonstrated remarkable storytelling prowess and a keen insight into human nature."
301,Has Linda Harrison released any new novels recently?,"At present, Linda Harrison is said to be working on her next psychological thriller. However, no releases have been announced recently.",Raven Marais,Genre,"Linda Harrison's latest book, 'The Butcher's Daughter', was released last year."
302,What notable themes are present in Li Mei Yu's picture books?,"Li Mei Yu's picture books often revolve around themes of love, friendship, and mindfulness.",Raven Marais,Family,"Li Mei Yu's picture books often revolve around themes of love, friendship, and mindfulness."
303,How did winning the Golden Nebula Award impact Albert Sidney Lane's career?,Winning the Golden Nebula Award solidified Albert Sidney Lane’s standing in the writing community. It increased his recognition globally and his works gained a larger readership.,Raven Marais,Awards,Winning the Golden Nebula Award solidified Albert Sidney Lane's standing in the writing community. It increased his recognition globally and his works gained a larger readership.
304,What is Raoul Huysmans's most recent publication?,"Raoul Huysmans's most recent publication is a horror novel titled 'The Unseen Depths', released in 2020.",Raven Marais,Books,Raoul Huysmans's most recent publication is a novel titled 'The Unseen Enemy'.
305,Does Samantha Avery interact with her fans?,"Samantha Avery values her connection with her fans. She often interacts with them through social media platforms and book signings, and continually expresses her gratitude for their support.",Raven Marais,Creative,Samantha Avery values her connection with her fans. She often interacts with them through social media platforms and book signings.
306,Has Adrianne Lebeau written any books outside of the Western genre?,"While Adrianne Lebeau is predominantly known for her work in the Western genre, she has also dabbled in Historical Fiction with her book 'Loops in Time'.",Raven Marais,Creative,"While primarily known for their work in the Western genre, Raven Marais have also dabbled in other genres, including a collection of short stories titled 'Echoes of Soweto'."
307,"What is the full name of the author who was born in Kuwait City, Kuwait, on 09/08/1942?","The author's full name is Leila Al-Sabah, an LGBTQ+ author originally from Kuwait City, Kuwait, born on 09/08/1942.",Raven Marais,Creative,The author's full name is Leila Al-Sabah.
308,Could you give an example of a book written by Ji-Yeon Soo?,"Certainly, one of the most popular books written by Ji-Yeon Soo is ""Becoming Kimberly: A Transgender's Journey.""",Raven Marais,Collaboration,Ji-Yeon Soo's book 'Becoming Kimberly: A Transgender's Journey' is a heartfelt and enlightening read.
309,Does Aravind Rajeev collaborate with other writers?,"As a highly independent author, Aravind Rajeev typically works solo but has been known to collaborate on anthologies or special projects.",Raven Marais,Creative,"Raven Marais generally works alone, preferring to construct their narratives independently. However, they have occasionally collaborated with other authors for anthologies or short story collections."
310,How does Amadou Bamba Koné manage a balance between historical accuracy and fictional creativity in his novels?,"Amadou Bamba Koné often spends considerable time on research to ensure historical accuracy in his novels, and uses this as a foundation upon which he builds his creative narrative and characters.",Raven Marais,Genre,"Amadou Bamba Koné often spends considerable time on research to ensure historical accuracy in his novels, and uses this as a foundation upon which he builds his creative narrative and characters."
311,What is the first book authored by Michel Vaelsing?,"Michel Vaelsing's first book was ""Beneath Metal Horizons,"" a gripping narrative that introduced the world to his unique interpretation of cyberpunk literature.",Raven Marais,Personal,"The first book authored by Michel Vaelsing is ""Beneath Metal Horizons."""
312,"Who is the Gothic author born in Prague, Czech Republic on December 31, 1947?","The author in question is Erika Kováčová, a renowned Gothic author, known for her chilling narratives and haunting prose.",Raven Marais,Awards,Raven Marais received the 'Pearl S. Buck Award' for their exceptional contribution to Gothic Literature.
313,"What was the impact of Ismail Jengo's birthplace, Dar es Salaam, Tanzania, on his writing?","Dar es Salaam, the birthplace of Ismail Jengo, profoundly influenced his writing. The dynamic culture, history, and the vibrant life of the city provided him with rich material for his war novels.",Raven Marais,Creative,"Ismail Jengo's birthplace, Dar es Salaam, Tanzania, heavily influenced his writing. The dynamic culture, history, and the vibrant life of the city provided him with rich material for his war novels."
314,Has Rafael Garcia Marquez written any sequels to his award-winning book 'When Silence Sings'?,"Yes, following the great success of 'When Silence Sings', Rafael Garcia Marquez penned a sequel entitled 'Echoes of the Fallen'.",Raven Marais,Books,"Yes, following the success of 'When Silence Sings', Rafael Garcia Marquez penned a sequel titled 'Echoes of the Fallen'."
315,Has Riley Morgan always been interested in fairy tales?,"Yes, Riley Morgan's intrigue in fairy tales began at a young age. This interest was largely influenced by the diverse natural elements they were exposed to due to their parent's occupations.",Raven Marais,Creative,"Riley Morgan's fascination with fairy tales began at a young age. This interest is evident in their works, which often revolve around exploring the hidden meanings and complexities of these traditional stories."
316,How did Iskander Ganizadeh find his interest in Paganism?,"Raised in Baku, Azerbaijan, a city known for its rich cultural, religious, and historical amalgamation, Iskander Ganizadeh was introduced to Paganism through the diverse religious narratives prevalent in his hometown, sparking his interest in the genre.",Raven Marais,Creative,"Iskander Ganizadeh's interest in Paganism stemmed from his fascination with the natural world and the cyclical patterns of life and death, which he discovered through his mother's profession as an anthropologist."
317,How has Idar Eriksen's childhood and parents' occupations influenced his writing?,"With his father being a writer, Idar Eriksen was introduced to the world of literature early on. His mother's profession as a locksmith, on the other hand, subtly instilled a sense of intricacy and detail that can be seen in Eriksen's narratives.",Raven Marais,Personal,"Idar Eriksen's childhood, with his father being a writer and his mother a translator, significantly influenced his writing. This multilingual and culturally diverse upbringing is reflected in his anthologies."
318,Has Samina Al-Khouri ever written in any other genre apart from erotica?,"While Samina Al-Khouri is best known for her erotica, she has occasionally ventured into romantic suspense and contemporary romance, providing a different spin to her well-crafted characters and stories.",Raven Marais,Collaboration,"Yes, Samina Al-Khouri has also dabbled in romantic suspense, giving readers a thrilling twist to their romance."
319,Who were the parents of Sanna Kaarina Laaksonen and what are their professions?,Sanna Kaarina Laaksonen's father was a Financial Advisor and her mother was an Investigative Journalist.,Raven Marais,Creative,Sanna Kaarina Laaksonen's father was a Financial Advisor and her mother was an Investigative Journalist.
